value,importance,reason
0_12h_r_oxygen_device_none_measured,1,Measurement frequency for documenting 'no oxygen device' in the immediate postop window. Primarily a documentation/monitoring artifact with minimal direct renal relevance.
13_24h_r_oxygen_device_none_measured,1,"Measurement frequency for 'no oxygen device' during 13–24h, mostly reflecting charting intensity and respiratory monitoring. Weak indirect association with AKI risk; strong proxy penalty."
25_36h_r_oxygen_device_none_measured,1,"Measurement frequency for 'no oxygen device' in 25–36h; largely documentation intensity rather than physiology. Even with temporal proximity, it is not a renal mechanism and should remain low importance."
0_12h_r_oxygen_device_low_flow_mean,2,"Average use of low-flow oxygen in the first 12h, reflecting early postoperative respiratory support needs. Indirectly correlates with overall severity and potential hypoperfusion risk, but early timing and mean aggregation limit renal-specific predictive value."
13_24h_r_oxygen_device_low_flow_mean,2,"Represents average use of low-flow oxygen in the 13–24h window, a nonspecific marker of respiratory support/overall recovery. Only indirectly related to AKI risk via illness severity and oxygenation, with substantial proxy penalty."
25_36h_r_oxygen_device_low_flow_mean,2,"Average low-flow oxygen use closer to the outcome window may reflect persistent cardiopulmonary limitation. Still an indirect severity proxy with weak renal specificity, so limited value for predicting creatinine rise."
0_12h_r_oxygen_device_low_flow_max,1,Any/max low-flow oxygen use immediately post-op is common and heavily influenced by routine extubation/weaning practices. Minimal renal specificity and high care-process confounding.
13_24h_r_oxygen_device_low_flow_max,2,"Indicates whether low-flow oxygen was needed at any point in 13–24h, suggesting ongoing respiratory support needs. Indirect association with AKI through overall instability, but not a renal mechanism."
25_36h_r_oxygen_device_low_flow_max,2,Any low-flow oxygen requirement in 25–36h may signal incomplete recovery and higher illness burden near the prediction horizon. Still largely nonspecific and not tightly linked to renal perfusion or injury.
0_12h_r_oxygen_device_low_flow_min,1,Minimum low-flow oxygen use in the immediate post-op period is largely a reflection of routine oxygen administration patterns. Provides little mechanistic information about kidney injury risk.
13_24h_r_oxygen_device_low_flow_min,1,Minimum low-flow oxygen use is a weak aggregation for capturing clinically meaningful hypoxemia/respiratory failure (extremes in oxygenation would matter more). Mostly redundant and nonspecific for renal outcomes.
25_36h_r_oxygen_device_low_flow_min,1,Minimum low-flow oxygen use near 25–36h does not capture severity (it can be low even if intermittent higher support is needed). Low renal specificity and poor aggregation for AKI prediction.
0_12h_r_oxygen_device_low_flow_measured,1,Measurement frequency/documentation of low-flow oxygen in 0–12h mainly reflects monitoring and routine post-op charting. High proxy penalty and minimal direct renal relevance.
13_24h_r_oxygen_device_low_flow_measured,1,How often low-flow oxygen is recorded in 13–24h is primarily a documentation/monitoring-intensity signal. Not a physiologic renal pathway and should contribute little to creatinine ratio prediction.
25_36h_r_oxygen_device_low_flow_measured,1,"Recording frequency of low-flow oxygen in 25–36h is a care-process proxy rather than a biomarker. Even near the outcome window, it lacks renal specificity and is unlikely to add predictive value."
0_12h_r_oxygen_device_high_flow_mean,2,"High-flow oxygen use early post-op suggests more significant respiratory support needs, which can correlate with hemodynamic stress and AKI risk. However, in 0–12h it is still confounded by immediate post-op management and is indirect for renal injury."
13_24h_r_oxygen_device_high_flow_mean,3,"Persistent high-flow oxygen requirement in 13–24h indicates ongoing respiratory failure/low reserve and higher systemic illness burden, which is an established AKI risk context. Still indirect (proxy for severity) but more informative than low-flow and early window measures."
25_36h_r_oxygen_device_high_flow_mean,3,High-flow oxygen use in 25–36h is closer to Hour 60 and may reflect sustained cardiopulmonary dysfunction and congestion that can worsen renal perfusion. Prognostically relevant but remains nonspecific and treatment-influenced.
0_12h_r_oxygen_device_high_flow_max,2,"Any high-flow oxygen use in the immediate post-op period flags early respiratory compromise, which can accompany shock/AKI risk. Temporal proximity is poor and it is still largely a severity/treatment proxy rather than renal-specific."
13_24h_r_oxygen_device_high_flow_max,3,"Any high-flow oxygen requirement in 13–24h suggests clinically meaningful respiratory failure beyond routine recovery, often co-traveling with hemodynamic instability and AKI risk. Better aggregation (captures need for escalation) with moderate renal prognostic relevance."
25_36h_r_oxygen_device_high_flow_max,2,"Use of high-flow oxygen in the 25–36h window reflects ongoing respiratory failure/illness severity and possibly low cardiac output states. It is only an indirect proxy for renal hypoperfusion/AKI risk and is heavily confounded by clinician practice, so predictive value for creatinine_ratio is limited."
0_12h_r_oxygen_device_high_flow_min,1,"High-flow oxygen use immediately post-op is common and often transient due to anesthesia, atelectasis, and routine post-bypass care. This is a nonspecific early proxy with weak renal mechanistic linkage and high practice-pattern confounding."
13_24h_r_oxygen_device_high_flow_min,2,"Persistent need for high-flow oxygen in 13–24h suggests slower cardiopulmonary recovery and higher overall acuity. Renal relevance is indirect (possible low output/shock), so it is a weak-to-moderate predictor at best."
25_36h_r_oxygen_device_high_flow_min,2,"Continued high-flow oxygen requirement close to the outcome window can correlate with ongoing hemodynamic/respiratory compromise that may predispose to AKI. Still, it is not kidney-specific and largely reflects global severity and management choices."
0_12h_r_oxygen_device_high_flow_measured,1,A “measured” count mainly captures documentation/monitoring intensity rather than physiology. In the immediate post-op period this is especially routine and provides minimal specific signal for Hour-60 creatinine_ratio.
13_24h_r_oxygen_device_high_flow_measured,1,"Measurement frequency is primarily a care-process proxy and not a renal mechanism. Any association with AKI would be indirect via acuity/attention, so importance is low."
25_36h_r_oxygen_device_high_flow_measured,2,"More frequent documentation of high-flow oxygen in 25–36h may indicate persistent instability or clinician concern closer to the outcome window. However it remains a monitoring-intensity proxy, so it should not score above 2."
0_12h_r_heart_block_type_degree_1_measured,1,Degree 1 heart block documentation frequency is a monitoring/ECG interpretation artifact and usually clinically mild. It has no direct renal specificity and early post-op conduction changes are common and transient.
13_24h_r_heart_block_type_degree_1_measured,1,"This “measured” feature reflects how often degree 1 block is recorded rather than a physiologic exposure. Degree 1 block is rarely a driver of renal hypoperfusion, so relevance to creatinine_ratio is minimal."
25_36h_r_heart_block_type_degree_1_measured,1,"Even near the outcome window, degree 1 block measurement frequency is not kidney-specific and is mostly documentation-related. Any renal association would be weak and indirect through overall illness severity."
0_12h_r_heart_block_type_degree_23_measured,2,"Documentation frequency of higher-grade AV block (2nd/3rd degree) may signal significant conduction disease requiring pacing/pressors, which can relate indirectly to renal perfusion. Still, as a “measured” variable it is largely a care-process proxy and early post-op blocks can be transient."
13_24h_r_heart_block_type_degree_23_measured,2,Persistent or frequently documented high-grade AV block in 13–24h can indicate ongoing hemodynamic vulnerability that may increase AKI risk. However the feature is measurement-based (proxy penalty) and not a direct renal marker.
25_36h_r_heart_block_type_degree_23_measured,3,"Frequent documentation of 2nd/3rd degree AV block in 25–36h suggests ongoing significant conduction-related instability close to the Hour-60 creatinine outcome, potentially impacting renal perfusion. Despite being a “measured” proxy, the clinical state it implies is more plausibly prognostic here, warranting a 3 but not higher."
0_12h_r_heart_block_type_bundle_branch_block_measured,1,"Bundle branch block measurement frequency is largely an ECG documentation artifact and often reflects chronic conduction disease rather than acute shock. It has low renal specificity and high proxy penalty, especially in the immediate post-op window."
13_24h_r_heart_block_type_bundle_branch_block_measured,1,This is a monitoring/recording frequency feature with weak mechanistic linkage to AKI. Any association with creatinine_ratio would be indirect and likely redundant with stronger hemodynamic variables.
25_36h_r_heart_block_type_bundle_branch_block_measured,1,"Even close to the outcome window, bundle branch block “measured” mainly reflects documentation intensity and underlying cardiac disease rather than renal perfusion or injury. Predictive usefulness for creatinine_ratio is therefore minimal."
0_12h_ionized_calcium_mean,2,Mean ionized calcium in the immediate postop period reflects electrolyte/acid-base shifts and transfusion/citrate effects more than renal injury. It is an indirect severity/metabolic proxy and early means can wash out brief extremes relevant to perfusion.
13_24h_ionized_calcium_mean,2,"Ionized calcium mean during 13–24h may reflect ongoing critical illness, citrate load, or endocrine/metabolic status rather than kidney-specific dysfunction. Some prognostic value via overall instability, but still indirect for Hour-60 creatinine ratio."
25_36h_ionized_calcium_mean,2,"Later mean ionized calcium can correlate with persistent illness and organ dysfunction, but it is not a direct AKI biomarker. Timing is closer to outcome, yet the signal remains nonspecific and mean aggregation dilutes transient hypoperfusion episodes."
0_12h_ionized_calcium_max,2,"Peak ionized calcium early after surgery often reflects supplementation and shifts during resuscitation rather than renal pathophysiology. As an extreme it may capture treatment intensity more than impending AKI, so predictive value is limited."
13_24h_ionized_calcium_max,2,"Maximum ionized calcium in 13–24h may indicate aggressive replacement or metabolic derangements, which are only indirectly related to renal outcomes. It is more a care/process and severity proxy than a kidney-specific precursor."
25_36h_ionized_calcium_max,2,"A late peak ionized calcium could reflect ongoing replacement or metabolic stress but has weak mechanistic linkage to creatinine rise. Despite better temporal proximity, it remains nonspecific and often clinician-driven."
0_12h_ionized_calcium_min,3,"Early nadir ionized calcium can reflect citrate from transfusion/CPB, shock/acid-base disturbance, and severe physiologic stress that may accompany renal hypoperfusion. Extremes are more informative than means, but the immediate postop window is noisy/transient."
13_24h_ionized_calcium_min,3,"A low ionized calcium nadir in 13–24h suggests persistent metabolic derangement or ongoing transfusion/critical illness, which can track with AKI risk. Still indirect for kidney injury, but the trajectory phase makes it moderately informative."
25_36h_ionized_calcium_min,3,"Late low ionized calcium may mark sustained critical illness, ongoing citrate exposure, or endocrine/metabolic failure that correlates with worsening organ function. It is not kidney-specific, but the closer timing and extreme aggregation support moderate predictive value."
0_12h_ionized_calcium_measured,1,"Number of ionized calcium measurements mainly reflects monitoring intensity and clinician concern during immediate postop management. This is a weak, behavior-driven proxy with little direct renal specificity."
13_24h_ionized_calcium_measured,1,"Measurement frequency in 13–24h is primarily a care-process signal (instability, transfusions, electrolyte replacement protocols) rather than a renal mechanism. Proxy penalty is high, so usefulness for creatinine ratio is minimal."
25_36h_ionized_calcium_measured,2,"More frequent late ionized calcium checks can indicate ongoing instability or complex ICU management, which may correlate with AKI risk. Still largely a monitoring-intensity proxy, so it should not score high."
0_12h_magnesium_mean,2,"Mean magnesium early after cardiac surgery reflects replacement practices, hemodilution, and shifts with CPB rather than kidney injury per se. It is an indirect marker and early means can obscure brief clinically relevant lows."
13_24h_magnesium_mean,2,"Magnesium mean in 13–24h may relate to renal handling and overall illness, but in ICU it is heavily influenced by supplementation protocols. Overall association with Hour-60 creatinine ratio is plausible but weak and nonspecific."
25_36h_magnesium_mean,2,"Later mean magnesium could reflect reduced renal excretion or ongoing replacement, but it is not a strong or specific AKI biomarker. Temporal proximity helps slightly, yet mean aggregation and treatment confounding limit predictive value."
0_12h_magnesium_max,2,"Early peak magnesium is often driven by IV replacement (e.g., arrhythmia prophylaxis) and perioperative shifts rather than evolving renal dysfunction. As an extreme it may capture treatment intensity more than renal injury, especially in the immediate postop window."
13_24h_magnesium_max,2,"Peak magnesium in the 13–24h window mainly reflects supplementation, shifts, or reduced clearance. It is only indirectly related to AKI risk and is a moderate-proxy lab rather than a direct renal injury signal."
25_36h_magnesium_max,2,"Later peak magnesium can weakly reflect impaired renal excretion closer to the outcome window, but is still heavily influenced by replacement practices. Overall renal specificity is limited, so predictive value is modest."
0_12h_magnesium_min,1,Early postoperative low magnesium is common from hemodilution and repletion patterns after bypass. It has little direct mechanistic linkage to subsequent creatinine rise and is temporally distant/unstable.
13_24h_magnesium_min,1,Minimum magnesium in 13–24h mostly captures ongoing electrolyte management and redistribution rather than kidney injury. Renal specificity and prognostic proximity to creatinine rise are weak.
25_36h_magnesium_min,2,"Low magnesium at 25–36h may reflect continued losses/diuretics or inadequate repletion and can correlate with overall instability. It remains nonspecific for renal injury, but timing is closer so it may add slight predictive signal."
0_12h_magnesium_measured,1,Measurement count is primarily a monitoring-intensity/clinician-behavior proxy rather than physiology. In the immediate postop period it is routine and not specific to renal risk.
13_24h_magnesium_measured,1,Frequency of magnesium checks in 13–24h mostly reflects ICU protocol or electrolyte replacement workflows. It is not a renal mechanism and should be low-importance.
25_36h_magnesium_measured,2,"More frequent magnesium measurement at 25–36h can indicate ongoing instability, diuretic use, or concern for organ dysfunction, which may correlate with AKI risk. Still a proxy variable, so it should not score high."
0_12h_base_excess_mean,2,"Mean base excess reflects overall metabolic acid-base status and can proxy early hypoperfusion/lactic acidosis after surgery. In 0–12h it is often transient and diluted by resuscitation, limiting specificity for later creatinine rise."
13_24h_base_excess_mean,3,"Persistently abnormal mean base excess in 13–24h suggests ongoing metabolic acidosis from shock, low cardiac output, or poor perfusion—pathways linked to AKI. Mean can still wash out short insults, but trajectory-phase timing improves usefulness."
25_36h_base_excess_mean,4,Sustained metabolic acidosis in the 25–36h window is a strong near-term indicator of ongoing hypoperfusion/organ dysfunction that can precede creatinine rise. Mean is appropriate here because persistent derangement is clinically meaningful.
0_12h_base_excess_max,1,"Maximum (most positive) base excess reflects relative alkalosis, often driven by ventilation, bicarbonate, or transfusion effects early after surgery. It has low renal specificity and limited prognostic value for AKI."
13_24h_base_excess_max,1,A high (positive) base excess in 13–24h is generally not a typical AKI precursor and is often treatment-related. It provides little direct signal about renal hypoperfusion or evolving kidney injury.
25_36h_base_excess_max,1,Most positive base excess near 25–36h usually reflects alkalosis from therapy rather than renal injury physiology. It is not a strong or specific predictor of creatinine increase.
0_12h_base_excess_min,3,"Minimum base excess captures the worst metabolic acidosis early after surgery, which can reflect severe hypoperfusion and is mechanistically linked to AKI risk. However, in 0–12h it may be transient and influenced by bypass/resuscitation, so score is moderated."
13_24h_base_excess_min,4,"Worst base excess in 13–24h captures significant ongoing metabolic acidosis, a strong marker of persistent shock/low output and renal hypoperfusion. The extreme aggregation is well-suited to detect clinically meaningful insults in this trajectory window."
25_36h_base_excess_min,4,"Low (more negative) base excess reflects metabolic acidosis from hypoperfusion/lactate or impaired acid handling, which often accompanies evolving AKI. The 25–36h minimum captures worst derangement close to the Hour-60 creatinine outcome, making it a strong near-term prognostic signal."
0_12h_base_excess_measured,1,Count/frequency of base excess measurements mainly reflects monitoring intensity and clinician concern in the immediate post-op period. It is not a physiologic renal marker and is heavily confounded by routine post-bypass ABG protocols.
13_24h_base_excess_measured,2,"Measurement frequency may weakly proxy ongoing instability or concern for shock/acid-base issues, which can relate to renal hypoperfusion. Still primarily a care-process variable rather than a renal mechanism."
25_36h_base_excess_measured,2,More frequent base excess checks in the 25–36h window can indicate persistent hemodynamic/respiratory instability that raises AKI risk. However it remains a monitoring-intensity proxy and should not score high.
0_12h_direct_bilirubin_measured,1,Direct bilirubin measurement frequency is largely driven by routine labs or evaluation of hepatic dysfunction rather than kidney-specific pathways. Early post-op measurement intensity has minimal direct value for predicting creatinine ratio.
13_24h_direct_bilirubin_measured,1,This is primarily a clinician-behavior/monitoring proxy (workup for cholestasis/ischemic hepatitis) with only indirect linkage to AKI. Limited renal specificity and no physiologic magnitude information.
25_36h_direct_bilirubin_measured,1,"Even close to the outcome window, the fact that direct bilirubin was measured mainly reflects lab ordering patterns and hepatic concern. It provides little kidney-specific signal for Hour-60 creatinine ratio."
0_12h_wbc_mean,2,"Mean WBC reflects inflammation/stress response and possible infection, which can contribute to AKI risk but is nonspecific. In the immediate post-op window it is often transiently elevated from surgery/CPB, reducing prognostic value."
13_24h_wbc_mean,2,"Persistent leukocytosis in the trajectory phase may indicate ongoing inflammation/infection associated with AKI, but mean values can dilute spikes. Overall renal relevance is indirect and moderate at best."
25_36h_wbc_mean,3,"Sustained leukocytosis closer to Hour 60 can signal evolving infection/SIRS that increases AKI risk via hemodynamic and inflammatory pathways. Still indirect and less specific than renal/hemodynamic markers, but timing improves usefulness."
0_12h_wbc_max,2,"Peak WBC captures the strongest inflammatory response, but early post-op peaks are common and often nonpathologic after CPB. Indirect association with AKI and limited specificity keep the score low."
13_24h_wbc_max,2,"A higher WBC peak in 13–24h may better reflect emerging infection/inflammation than the mean, which can relate to AKI risk. However it remains nonspecific and only a modest predictor."
25_36h_wbc_max,3,"A high WBC peak in the 25–36h window can indicate active infection/SIRS near the outcome window, which is a meaningful AKI risk context. It is still an indirect proxy (not kidney-specific), so not top-tier."
0_12h_wbc_min,1,Low WBC early post-op is uncommon and often reflects dilutional effects or lab variability rather than a renal pathway. Minimal specificity for predicting creatinine ratio.
13_24h_wbc_min,1,WBC minimum is generally less informative than peaks for infection/inflammation and may reflect dilution or sampling noise. Weak and nonspecific linkage to AKI.
25_36h_wbc_min,1,"A low WBC minimum near 25–36h is not a typical direct precursor of AKI and is often confounded by dilution, marrow suppression, or measurement variability. Limited prognostic value for Hour-60 creatinine ratio."
0_12h_wbc_measured,1,"Count of WBC lab draws in the immediate postop window, mainly reflecting monitoring intensity rather than renal physiology. As a _measured variable it is a weak proxy for acuity/concern and not kidney-specific."
13_24h_wbc_measured,1,"Frequency of WBC checks in the 13–24h trajectory phase, largely a care-process/monitoring signal. Not kidney-specific and should not add much beyond general illness severity."
25_36h_wbc_measured,2,"Frequency of WBC checks closer to the outcome may reflect evolving complications (infection/inflammation) that can contribute to AKI risk. Still primarily a monitoring-intensity proxy, so only weakly predictive."
0_12h_prothrombin_time_mean,2,"Average PT early after surgery reflects coagulopathy/hemodilution/liver dysfunction and transfusion context, which are indirect AKI risk correlates. Early means can be transient and are not renal-specific."
25_36h_prothrombin_time_mean,3,"Persistently elevated mean PT at 25–36h suggests ongoing hepatic dysfunction, shock, or dilutional coagulopathy, which correlates with sustained hypoperfusion and AKI risk. Timing is closer to Hour 60, making it a moderate predictor despite indirect renal linkage."
0_12h_prothrombin_time_max,2,"Peak PT in the immediate postop period captures worst coagulopathy/bleeding-resuscitation exposure, which can associate with AKI via hypotension/transfusion. However it is early and nonspecific, so predictive value is limited."
25_36h_prothrombin_time_max,3,"Peak PT closer to the outcome may capture ongoing severe coagulopathy or hepatic hypoperfusion, a stronger marker of persistent critical illness linked to AKI. Max is a better aggregation for capturing clinically meaningful extremes than mean."
0_12h_prothrombin_time_min,1,Minimum PT early postop is usually near-normal and not a plausible mechanism for kidney injury. This aggregation is unlikely to capture renal-relevant pathology and is largely uninformative.
25_36h_prothrombin_time_min,1,Minimum PT in 25–36h generally reflects the best/normal value rather than coagulopathy burden. It has weak mechanistic linkage to AKI and is redundant with more informative PT max/mean.
0_12h_prothrombin_time_measured,1,Number of PT measurements early postop reflects monitoring/transfusion workflows rather than renal physiology. As a _measured feature it is primarily a clinician-behavior proxy.
13_24h_prothrombin_time_measured,1,"Frequency of PT checks in 13–24h is mainly driven by care processes (bleeding concern, anticoagulation management). It is not kidney-specific and offers little direct prognostic signal for creatinine ratio."
25_36h_prothrombin_time_measured,2,"More frequent PT monitoring at 25–36h may indicate ongoing instability/bleeding or anticoagulation complexity, which can co-occur with AKI risk. Still a monitoring-intensity proxy, so only weakly useful."
0_12h_nucleated_red_blood_cells_mean,2,"Mean NRBCs early can reflect hypoxemia, systemic stress, or severe inflammation after cardiopulmonary bypass, indirectly associated with organ dysfunction including AKI. Early postoperative elevations may be transient and nonspecific."
13_24h_nucleated_red_blood_cells_mean,3,"NRBC persistence into 13–24h suggests ongoing hypoxia/shock or severe systemic stress, which is more prognostically relevant for subsequent AKI than immediate postop values. Mean is acceptable for persistence but remains indirect."
25_36h_nucleated_red_blood_cells_mean,3,"Sustained NRBC elevation at 25–36h is a marker of ongoing critical illness/hypoperfusion and correlates with multi-organ dysfunction risk including AKI near Hour 60. Not kidney-specific, but timing improves predictive utility."
0_12h_nucleated_red_blood_cells_max,2,"Peak NRBCs early captures the most extreme stress/hypoxia signal, which can correlate with later AKI risk. However it is early and nonspecific, so it remains a weak-to-moderate predictor."
