value,importance,reason
25_36h_r_pap_diastolic_measured,2,"Frequency of diastolic PAP measurements in 25–36h, reflecting ongoing need for invasive monitoring. Slightly more informative than earlier windows as a severity proxy, but still indirect and dominated by physiologic extremes."
0_12h_pulse_mean,2,"Average heart rate in the immediate 0–12h post-op period. Mean HR is a nonspecific stress/illness marker and early values are noisy, so weak sparse-model candidate."
13_24h_pulse_mean,2,"Average heart rate in 13–24h, reflecting sustained sympathetic drive/arrhythmia burden. Still nonspecific for AKI and likely redundant with more informative extremes and other hemodynamics, so low priority."
25_36h_pulse_mean,3,"Average heart rate in 25–36h, closer to the outcome and may capture persistent tachycardia from low output/sepsis/AF affecting renal perfusion. Moderately useful but indirect and often redundant with BP/vasopressor signals."
0_12h_pulse_max,2,"Peak heart rate in 0–12h, capturing transient tachyarrhythmia/stress immediately after surgery. Early peaks are often perioperative noise and nonspecific, so limited sparse-model value."
13_24h_pulse_max,3,"Peak heart rate in 13–24h, which can reflect clinically meaningful tachyarrhythmia or evolving shock impacting renal perfusion. More informative than mean HR but still indirect, so moderate priority."
25_36h_pulse_max,3,"Peak heart rate in 25–36h, closer to Hour 60 and may capture ongoing instability/AF with RVR associated with renal hypoperfusion. Useful as an extreme but still a general severity marker, so moderate priority."
0_12h_pulse_min,2,"Lowest heart rate in 0–12h, potentially reflecting pacing, sedation, or conduction issues. Early minima are often treatment-related and not specific for AKI risk, so low priority."
13_24h_pulse_min,2,"Lowest heart rate in 13–24h, reflecting bradycardia/pacing needs. Generally indirect for renal outcomes and often clinician-driven, so weak sparse-model candidate."
25_36h_pulse_min,2,"Lowest heart rate in 25–36h, which may indicate conduction disease or over-sedation/pacing. Still not a strong or specific precursor of creatinine rise compared with perfusion/renal markers, so low priority."
0_12h_pulse_measured,1,"Frequency of pulse measurements in 0–12h, largely reflecting routine monitoring intensity. This is a proxy variable with minimal unique physiologic signal, so very low priority."
13_24h_pulse_measured,1,"Frequency of pulse measurements in 13–24h, mainly indicating monitoring/acuity rather than renal physiology. Unlikely to survive sparse selection when true hemodynamic variables are available."
25_36h_pulse_measured,1,"Frequency of pulse measurements in 25–36h, still primarily a monitoring-intensity proxy. Adds little unique predictive value for creatinine_ratio beyond actual HR/hemodynamic features, so lowest priority."
0_12h_r_an_agents_o2_mean,1,Mean inspired O2 from anesthetic/respiratory gas delivery in the immediate post-op window. Weak and indirect for AKI prediction and largely reflects ventilator/OR practice rather than renal physiology; likely dominated by hemodynamics/renal markers.
0_12h_r_an_agents_o2_max,1,Peak inspired O2 exposure early after surgery. High FiO2 is a nonspecific severity/ventilation proxy and not a direct renal insult signal; low priority for sparse selection.
0_12h_r_an_agents_o2_min,1,"Lowest inspired O2 early post-op, loosely related to oxygenation strategy. Not a direct predictor of creatinine rise and highly confounded by extubation/vent settings; unlikely to add unique value."
0_12h_r_an_agents_o2_measured,1,Count/frequency of recorded inspired O2 values in 0–12h. Primarily a monitoring/documentation intensity proxy rather than physiology; low value for sparse modeling.
13_24h_r_an_agents_o2_measured,1,Measurement frequency of inspired O2 in 13–24h. Still mainly reflects care intensity/ventilation workflow and is not a renal biomarker; unlikely to survive feature selection.
25_36h_r_an_agents_o2_measured,2,"Measurement frequency of inspired O2 in 25–36h, closer to the Hour-60 target. Could weakly proxy ongoing respiratory failure/ICU complexity, but remains indirect and clinician-behavior driven."
0_12h_r_an_agents_n2o_mean,1,"Mean nitrous oxide delivery early post-op, largely reflecting intraoperative/anesthesia practice. Minimal mechanistic link to AKI trajectory and likely noise/redundant with other periop factors."
0_12h_r_an_agents_n2o_max,1,Maximum nitrous oxide exposure in 0–12h. Not a recognized driver of postoperative creatinine rise and mostly indicates anesthetic technique; very low sparse-model priority.
0_12h_r_an_agents_n2o_min,1,Minimum nitrous oxide exposure early post-op. Essentially a practice artifact (often zero) with little physiologic information relevant to renal dysfunction.
0_12h_r_an_agents_n2o_measured,1,Frequency of nitrous oxide documentation in 0–12h. Monitoring/protocol proxy with negligible direct renal predictive content.
13_24h_r_an_agents_n2o_measured,1,Frequency of nitrous oxide documentation in 13–24h. N2O is rarely used in ICU; this is likely sparse/noisy and not informative for AKI prediction.
25_36h_r_an_agents_n2o_measured,1,Frequency of nitrous oxide documentation in 25–36h. Almost certainly reflects documentation artifacts rather than physiology; no unique value for creatinine_ratio.
0_12h_r_an_agents_air_mean,1,"Mean medical air delivery early post-op, essentially complementary to FiO2 settings. Indirect and redundant with oxygen/ventilator management signals; low priority for sparse selection."
0_12h_r_an_agents_air_max,1,"Maximum air flow/delivery early post-op, reflecting ventilator gas blending rather than patient renal status. Not a plausible unique predictor of Hour-60 creatinine ratio."
0_12h_r_an_agents_air_min,1,"Minimum air delivery early post-op, often driven by FiO2 changes and equipment settings. Highly redundant and not pathophysiologically tied to AKI risk."
0_12h_r_an_agents_air_measured,1,Measurement frequency of air delivery in 0–12h. Primarily a documentation/monitoring proxy with little direct relevance to evolving kidney dysfunction.
13_24h_r_an_agents_air_measured,1,Count/frequency of recorded “air” as an anesthetic agent is essentially a documentation/monitoring artifact. It has no direct renal physiology and is unlikely to add unique predictive value for Hour-60 creatinine ratio.
25_36h_r_an_agents_air_measured,1,"Measurement frequency of “air” as an anesthetic agent is a clinician/documentation proxy rather than a physiologic exposure. Even though it is closer to Hour 60, it is not a plausible independent driver of AKI risk in a sparse model."
0_12h_r_an_agents_isoflurane_mean,1,"Average isoflurane exposure in the immediate post-op window mainly reflects intraop/early sedation practice and hemodynamic management. It is indirect for renal injury and likely dominated by more direct perfusion/renal markers, so low sparse-selection priority."
0_12h_r_an_agents_isoflurane_max,2,"Peak isoflurane dose may correlate with episodes of vasodilation/hypotension and overall anesthetic intensity. Still an indirect, early (0–12h) clinician-driven signal and unlikely to survive sparse selection over direct perfusion/AKI predictors."
0_12h_r_an_agents_isoflurane_min,1,Minimum isoflurane dose is not a meaningful marker of renal hypoperfusion or evolving AKI and is largely determined by sedation strategy. It is redundant/low-information compared with any peak or hemodynamic variables.
0_12h_r_an_agents_isoflurane_measured,1,Frequency of isoflurane documentation is a monitoring/clinical workflow proxy rather than a physiologic biomarker. Early post-op measurement intensity is noisy and unlikely to add unique predictive value.
13_24h_r_an_agents_isoflurane_measured,1,"Measurement frequency of isoflurane in 13–24h reflects sedation/ventilation management and documentation patterns. It is an indirect proxy and typically dominated by actual hemodynamics, urine output, and labs for AKI prediction."
25_36h_r_an_agents_isoflurane_measured,2,"Later (25–36h) continued isoflurane measurement may indicate prolonged ventilation/sedation and higher illness complexity. Still a clinician-behavior proxy rather than renal physiology, so only weak-to-modest sparse-model value."
0_12h_r_saturated_venous_o2_mean,2,"Mean mixed/central venous O2 saturation reflects global oxygen delivery/consumption balance and can relate to perfusion. In 0–12h it is often confounded by bypass/anesthesia and averages dilute insults, so limited sparse-selection value."
13_24h_r_saturated_venous_o2_mean,3,"Sustained venous O2 saturation in 13–24h can reflect ongoing low cardiac output or impaired oxygen delivery relevant to renal hypoperfusion. Mean is still less sensitive than extremes, but this window is more informative than 0–12h."
0_12h_r_saturated_venous_o2_max,1,"High venous O2 saturation is often non-specific (e.g., high FiO2, reduced extraction, sampling issues) and not a strong AKI precursor. Early post-op maxima are particularly noisy and unlikely to be selected sparsely."
13_24h_r_saturated_venous_o2_max,1,Maximum venous O2 saturation is generally less informative for renal risk than low values and can reflect non-pathologic factors. It is unlikely to add unique predictive value compared with minima or other perfusion markers.
0_12h_r_saturated_venous_o2_min,3,"Minimum venous O2 saturation captures episodes of impaired oxygen delivery/low cardiac output that can precipitate renal hypoperfusion. Despite early-window noise, the extreme (min) preserves the insult signal better than the mean."
13_24h_r_saturated_venous_o2_min,4,"Minimum venous O2 saturation in 13–24h is a strong marker of ongoing low cardiac output/oxygen delivery deficits, a plausible driver of evolving AKI. Among SvO2 summaries in this batch, this extreme in the more informative window is the best sparse-model candidate."
0_12h_r_saturated_venous_o2_measured,1,Number of SvO2 measurements is primarily a monitoring-intensity proxy (sicker patients get checked more). It is not a direct physiologic signal and is typically redundant with actual SvO2 values and other severity markers.
13_24h_r_saturated_venous_o2_measured,2,SvO2 measurement frequency in 13–24h may weakly indicate clinician concern for low output/shock. Still a proxy variable and generally dominated by the SvO2 minima themselves for sparse selection.
25_36h_r_saturated_venous_o2_measured,1,"Indicates whether mixed/central venous O2 saturation was checked in 25–36h, mainly reflecting monitoring intensity or hemodynamic concern. As a clinician-behavior proxy (not the value), it is unlikely to add unique predictive signal for Hour-60 creatinine ratio in a sparse model."
0_12h_r_maintenance_iv_volume_mean,2,"Average maintenance IV fluid volume in the immediate 0–12h post-op window, reflecting early resuscitation/maintenance strategy. Early fluids are noisy and this mean is likely redundant with later fluid balance/hemodynamic signals, so low sparse-selection priority."
13_24h_r_maintenance_iv_volume_mean,2,"Average maintenance IV fluid volume during 13–24h, capturing ongoing fluid administration. Still an indirect exposure and a mean that can miss bolus-driven extremes; likely redundant with max or later-window dosing patterns."
25_36h_r_maintenance_iv_volume_mean,3,"Average maintenance IV fluid volume in 25–36h, closer to the Hour-60 outcome and may reflect sustained fluid needs/renal perfusion strategy. Among means, this is the most temporally relevant, but remains indirect and often dominated by extremes or net fluid balance."
0_12h_r_maintenance_iv_volume_max,2,"Peak maintenance IV fluid volume in 0–12h, potentially capturing early aggressive fluid administration. However, the earliest window is confounded by post-bypass/anesthesia effects and is less reliable for Hour-60 AKI prediction than later peaks."
13_24h_r_maintenance_iv_volume_max,3,"Peak maintenance IV fluid volume in 13–24h, which may better reflect evolving hemodynamic/renal support needs than a mean. This extreme can add some unique signal, but is still an indirect clinician-driven exposure and may be redundant with later-window peaks."
25_36h_r_maintenance_iv_volume_max,4,"Peak maintenance IV fluid volume in 25–36h, the closest window to the target and an extreme that can capture ongoing instability or attempts to support perfusion. Within this batch, this is the strongest fluid-administration summary and most likely to survive sparse selection."
0_12h_r_maintenance_iv_volume_min,1,"Minimum maintenance IV fluid volume in 0–12h, often reflecting brief holds or documentation artifacts rather than a renal insult. Highly redundant and low physiologic specificity for later creatinine rise."
13_24h_r_maintenance_iv_volume_min,1,"Minimum maintenance IV fluid volume in 13–24h, which is typically less informative than peaks for capturing clinically meaningful exposure. Likely reflects transient pauses and adds little unique predictive value."
25_36h_r_maintenance_iv_volume_min,2,"Minimum maintenance IV fluid volume in 25–36h may reflect fluid restriction in response to overload/oliguria, but is still ambiguous and clinician-driven. Some temporal relevance, yet generally dominated by max/mean or direct renal/hemodynamic markers."
0_12h_r_maintenance_iv_volume_measured,1,"Count/indicator of maintenance IV volume measurements in 0–12h, primarily a documentation/monitoring proxy. Measurement frequency is not a direct biomarker and is unlikely to be selected in a sparse model."
13_24h_r_maintenance_iv_volume_measured,1,"Measurement frequency for maintenance IV volume in 13–24h, reflecting charting intensity rather than physiology. Low unique value and should be deprioritized versus actual dose summaries."
25_36h_r_maintenance_iv_volume_measured,1,"Measurement frequency for maintenance IV volume in 25–36h, again a proxy for care complexity rather than renal function. Even with better timing, it is unlikely to add signal beyond the actual volume features."
0_12h_r_an_pap_systolic_measured,1,"Whether systolic pulmonary artery pressure was measured invasively in 0–12h, indicating PA catheter use/monitoring intensity. This is a clinician-behavior proxy and early post-op timing further limits its unique predictive value for creatinine ratio."
13_24h_r_an_pap_systolic_measured,1,"Indicator that systolic PAP was measured in 13–24h, mainly reflecting invasive monitoring and perceived instability. Without the PAP value, it is unlikely to contribute meaningfully in sparse selection."
25_36h_r_an_pap_systolic_measured,2,"Indicator that systolic PAP was measured in 25–36h, which may weakly proxy ongoing cardiopulmonary instability closer to the outcome. Still a monitoring proxy (not physiology), so only a modest score."
0_12h_r_an_pap_diastolic_measured,1,Indicates whether diastolic pulmonary artery pressure was recorded (monitoring intensity). This is a clinician-behavior proxy with weak direct renal signal and is dominated by actual hemodynamic values if available.
13_24h_r_an_pap_diastolic_measured,1,"Binary marker that PAP diastolic was measured in the 13–24h window. Mostly reflects illness complexity/monitoring rather than physiology, so low priority for sparse selection."
25_36h_r_an_pap_diastolic_measured,2,"Binary indicator of PAP diastolic monitoring closer to the outcome window. Slightly more informative as a proxy for ongoing shock/PH/right-heart concerns, but still indirect and typically redundant with actual hemodynamics/vasopressors."
0_12h_r_an_central_venous_pressure_measured,1,Whether CVP was measured in the immediate post-op period. Primarily a monitoring proxy and early (0–12h) post-bypass noise limits usefulness for predicting 60h creatinine ratio.
13_24h_r_an_central_venous_pressure_measured,1,Binary marker of CVP monitoring during 13–24h. Adds little unique predictive value beyond other severity indicators and is not a direct renal perfusion/AKI biomarker.
25_36h_r_an_central_venous_pressure_measured,2,"Indicates CVP monitoring in the 25–36h window, which may correlate with persistent hemodynamic instability/volume management affecting kidneys. Still largely a clinician-intensity proxy and inferior to actual CVP values or fluid balance."
0_12h_r_an_etco2_mean,2,"Mean end-tidal CO2 early post-op reflects ventilation/perfusion and cardiac output indirectly. Early window and averaging dilute transient low-flow episodes, so it’s a weak-to-moderate sparse-model candidate."
13_24h_r_an_etco2_mean,2,"Mean EtCO2 in 13–24h may reflect sustained low cardiac output or ventilation changes that relate to renal hypoperfusion. However, mean is less sensitive than minima and is often confounded by ventilator management."
25_36h_r_an_etco2_mean,3,"Mean EtCO2 closest to the outcome can capture ongoing low-flow physiology that may precede AKI. Still indirect and potentially redundant with EtCO2 minima/maxima and hemodynamic/vasopressor features, so moderate priority."
0_12h_r_an_etco2_max,1,Peak EtCO2 in 0–12h is usually driven by ventilator settings/hypoventilation rather than renal-relevant perfusion. Early timing and weak mechanistic link make it low value for sparse selection.
13_24h_r_an_etco2_max,1,Maximum EtCO2 in 13–24h more often reflects hypoventilation or reduced minute ventilation than kidney risk. Provides little unique AKI signal compared with EtCO2 minima or direct perfusion markers.
25_36h_r_an_etco2_max,2,"Maximum EtCO2 in 25–36h could reflect hypoventilation/CO2 retention and severity, but remains an indirect and management-sensitive signal. Lower priority than EtCO2 minima for capturing low-perfusion risk."
0_12h_r_an_etco2_min,3,"Minimum EtCO2 early can indicate transient low pulmonary blood flow/low cardiac output or major V/Q issues, which can precede renal hypoperfusion. Despite early noise, the extreme (min) preserves the most relevant signal within EtCO2 features."
13_24h_r_an_etco2_min,4,Minimum EtCO2 in 13–24h is a stronger marker of evolving low-flow physiology than means/maxima and is less dominated by immediate post-bypass artifacts. High sparse-model priority as an indirect but sensitive perfusion surrogate.
25_36h_r_an_etco2_min,5,"Minimum EtCO2 in 25–36h is the closest-window extreme and can sensitively capture ongoing low cardiac output/pulmonary blood flow reductions that threaten renal perfusion. Among this batch it is the most informative, least redundant EtCO2 aggregation for predicting 60h creatinine ratio."
0_12h_r_an_etco2_measured,1,Measurement frequency/availability of EtCO2 in 0–12h mainly reflects monitoring and ventilation status rather than physiology. As a proxy variable it is dominated by actual EtCO2 values and has low sparse-model value.
13_24h_r_an_etco2_measured,1,"Count/frequency of end-tidal CO2 documentation in hours 13–24, mainly reflecting monitoring intensity and ventilation status. It is a clinician-behavior proxy with weak, indirect linkage to AKI and unlikely to survive sparse selection."
25_36h_r_an_etco2_measured,1,"Frequency of ETCO2 measurements in hours 25–36, reflecting ongoing intubation/monitoring rather than renal physiology. Even though closer to Hour 60, it remains a low-specificity proxy and is dominated by direct hemodynamic/renal markers (not present in this batch)."
0_12h_r_an_fio2_mean,2,"Average FiO2 requirement in the immediate post-op window, a marker of respiratory dysfunction/oxygenation support. It is indirect for kidney injury and early post-bypass noise plus redundancy with FiO2 extremes makes it a weak sparse-model candidate."
0_12h_r_an_fio2_max,2,"Peak FiO2 in hours 0–12 captures transient severe oxygenation/instability. Extremes are preferable to means, but this is still an early, nonspecific severity signal with limited unique value for predicting creatinine ratio."
0_12h_r_an_fio2_min,1,Minimum FiO2 in hours 0–12 largely reflects baseline ventilator settings/weaning rather than acute insult. It is nonspecific and dominated by FiO2 max/mean if any FiO2 signal is retained.
0_12h_r_an_fio2_measured,1,Frequency of FiO2 recordings in hours 0–12 is primarily a documentation/monitoring proxy. It adds little physiologic information and is unlikely to be selected in a sparse linear model.
13_24h_r_an_fio2_measured,1,Measurement frequency of FiO2 in hours 13–24 reflects care intensity and ventilator management rather than kidney perfusion or injury. Low specificity and high proxy nature make it a poor sparse-selection feature.
25_36h_r_an_fio2_measured,1,"Measurement frequency of FiO2 in hours 25–36 is a proxy for continued ventilation/monitoring. Despite better temporal proximity, it remains indirect and redundant with more physiologic ventilator summaries."
0_12h_r_an_tidal_volume_mean,2,Mean tidal volume in hours 0–12 reflects ventilator strategy and patient size/ventilation needs. It is an indirect severity/management marker and early timing plus redundancy across tidal-volume aggregates limits sparse-model value.
13_24h_r_an_tidal_volume_mean,2,"Mean tidal volume in hours 13–24 may reflect ongoing respiratory failure or ventilator strategy. Still indirect for AKI and likely confounded by body size and clinician settings, so only weak-to-moderate priority."
25_36h_r_an_tidal_volume_mean,3,"Mean tidal volume in hours 25–36 is closer to the Hour 60 outcome and may capture sustained ventilatory support/illness trajectory. Among tidal-volume summaries, this timing makes it the most plausible keeper, though still indirect for renal injury."
0_12h_r_an_tidal_volume_max,2,Maximum tidal volume in hours 0–12 may indicate transient high ventilatory demand or non-protective settings. It is nonspecific for kidney outcomes and early post-op variability reduces its unique predictive value.
13_24h_r_an_tidal_volume_max,2,Maximum tidal volume in hours 13–24 captures episodic high ventilation settings/demand. It remains an indirect severity/management signal and is likely redundant with later-window tidal volume if selecting sparsely.
25_36h_r_an_tidal_volume_max,3,"Maximum tidal volume in hours 25–36 may reflect episodes of worsening respiratory mechanics or aggressive ventilation closer to the creatinine outcome. It can add some unique trajectory information beyond the mean, but remains indirect for AKI."
0_12h_r_an_tidal_volume_min,1,"Minimum tidal volume in hours 0–12 often reflects brief low settings during sedation, procedures, or weaning attempts. It is noisy, early, and dominated by mean/max tidal volume for any severity signal."
13_24h_r_an_tidal_volume_min,1,Minimum tidal volume in hours 13–24 is typically driven by transient clinician adjustments rather than organ dysfunction. It is low-specificity and unlikely to contribute uniquely in a sparse model.
25_36h_r_an_tidal_volume_min,2,Minimum tidal volume in the 25–36h window reflects ventilator strategy/respiratory mechanics rather than a direct renal signal. It may weakly proxy severity or lung-protective ventilation but is unlikely to survive sparse selection for creatinine_ratio.
0_12h_r_an_tidal_volume_measured,1,Indicator of whether tidal volume was recorded in the first 12h is mainly a monitoring/intubation proxy. Early post-op measurement frequency is noisy and offers little unique renal predictive value.
13_24h_r_an_tidal_volume_measured,1,Whether tidal volume was measured at 13–24h mostly reflects ongoing ventilation/monitoring intensity. This is an indirect clinician-behavior proxy and is dominated by actual physiologic/hemodynamic features.
25_36h_r_an_tidal_volume_measured,2,Measurement of tidal volume at 25–36h suggests continued mechanical ventilation closer to the outcome time. Still largely a care-intensity proxy and typically redundant with stronger severity/hemodynamic predictors.
0_12h_r_an_abp_pulse_measured,1,"Whether arterial pulse pressure was measured in 0–12h is a monitoring proxy (e.g., arterial line presence) rather than a physiologic insult measure. Early post-op monitoring intensity is not a strong unique predictor of later creatinine rise."
13_24h_r_an_abp_pulse_measured,1,ABP pulse measurement at 13–24h mainly indicates invasive monitoring/acuity. It adds little beyond actual blood pressure values and is unlikely to be retained in a sparse model.
25_36h_r_an_abp_pulse_measured,2,ABP pulse measurement at 25–36h implies ongoing arterial-line monitoring closer to Hour 60 and may weakly track persistent instability. However it remains an indirect proxy and is dominated by true hypotension/vasopressor features (not present here).
0_12h_r_an_heart_rate_measured,1,Heart rate measurement presence in 0–12h reflects routine monitoring rather than renal physiology. Nearly universal in ICU care and provides minimal discriminative value for sparse selection.
13_24h_r_an_heart_rate_measured,1,Heart rate being measured at 13–24h is a low-information monitoring indicator. It is unlikely to add unique predictive signal compared with actual HR extremes/means (not provided here).
25_36h_r_an_heart_rate_measured,1,"Heart rate measurement at 25–36h is still primarily a monitoring proxy and often near-universal. Without the HR values themselves, it offers little unique value for predicting creatinine_ratio."
0_12h_r_an_abp_mean_measured,1,Whether mean arterial pressure was measured in 0–12h mainly indicates monitoring intensity/arterial line use. It does not capture hypotension burden and is weak for sparse prediction of AKI trajectory.
13_24h_r_an_abp_mean_measured,1,MAP measurement presence at 13–24h is an indirect proxy for acuity and clinician attention. It is redundant with actual MAP summaries and unlikely to be selected in a sparse linear model.
