value,importance,reason
13_24h_r_an_agents_n2o_measured,1,N2O measurement frequency remains a weak behavioral proxy and is not plausibly tied to AKI risk during the trajectory phase.
25_36h_r_an_agents_n2o_measured,1,"Near hour 36, N2O measurement frequency still does not capture a renal injury mechanism and is unlikely to add predictive value for creatinine_ratio."
0_12h_r_an_agents_air_mean,1,Air fraction in the gas mixture is not a direct AKI determinant; early mean values mainly reflect ventilator/anesthesia settings rather than renal physiology.
0_12h_r_an_agents_air_max,1,High air fraction is essentially the complement of FiO2 and is not an established AKI predictor; extremes are typically protocol-driven.
0_12h_r_an_agents_air_min,2,"Very low air fraction (i.e., high FiO2) could weakly proxy severe respiratory failure/critical illness, which correlates with AKI risk, but the link is indirect."
0_12h_r_an_agents_air_measured,1,"Measurement frequency reflects monitoring intensity and documentation rather than a physiologic pathway to AKI, so it has minimal relevance."
13_24h_r_an_agents_air_measured,1,Measurement frequency of “air” as an anesthetic agent is a documentation/monitoring artifact and not a physiologic driver of AKI. As a _measured feature it mainly reflects workflow rather than renal risk.
25_36h_r_an_agents_air_measured,1,"Counts of “air” agent measurements do not plausibly affect kidney perfusion or nephrotoxic exposure. Even close to outcome, this is not a meaningful AKI predictor."
0_12h_r_an_agents_isoflurane_mean,1,Isoflurane exposure in the immediate post-op window is common and typically not nephrotoxic; mean dose is unlikely to add AKI-specific signal. Early (0–12h) anesthetic levels are also heavily confounded by routine OR/ICU practice.
0_12h_r_an_agents_isoflurane_max,1,Transient peaks of isoflurane are not established triggers of postoperative AKI compared with hemodynamic variables and nephrotoxins. In 0–12h this mostly reflects anesthesia management rather than renal insult.
0_12h_r_an_agents_isoflurane_min,1,Minimum isoflurane level is not mechanistically linked to renal hypoperfusion or tubular injury. It is largely a marker of weaning/sedation practice.
0_12h_r_an_agents_isoflurane_measured,1,"As a _measured feature, it reflects how often isoflurane was documented/checked, not kidney physiology. It is unlikely to indicate impending AKI."
13_24h_r_an_agents_isoflurane_measured,1,Frequency of isoflurane measurement is a behavioral/workflow proxy and not a direct AKI risk factor. Any association would be indirect via illness severity and is expected to be weak.
25_36h_r_an_agents_isoflurane_measured,1,"Even in the 25–36h window, measurement frequency of isoflurane is not a physiologic marker of renal injury. At most it weakly proxies ongoing sedation/ventilation needs."
0_12h_r_saturated_venous_o2_mean,2,"Mixed/central venous O2 saturation reflects global oxygen delivery and cardiac output, which relate indirectly to renal perfusion. In 0–12h values are often transiently abnormal post-bypass, so mean is a conservative, less specific signal."
13_24h_r_saturated_venous_o2_mean,2,"Persistently low average venous O2 saturation can indicate inadequate oxygen delivery and low-flow states that predispose to AKI. However, the mean smooths short hypoperfusion episodes and is less informative than minima."
0_12h_r_saturated_venous_o2_max,1,"High venous O2 saturation is not a typical direct trigger for AKI and may reflect high FiO2, shunting, or impaired extraction rather than renal hypoperfusion. The maximum is therefore not a useful AKI predictor."
13_24h_r_saturated_venous_o2_max,1,The maximum venous O2 saturation is rarely the pathologic extreme relevant to AKI risk. It is more influenced by oxygenation/measurement conditions than renal perfusion.
0_12h_r_saturated_venous_o2_min,3,"Low venous O2 saturation minima can capture acute low cardiac output/oxygen delivery episodes that threaten renal perfusion. Despite early post-op confounding, the minimum better reflects hypoperfusion insult than the mean/max."
13_24h_r_saturated_venous_o2_min,3,"A low minimum venous O2 saturation during 13–24h suggests ongoing or recurrent low-flow physiology, a recognized contributor to postoperative AKI. Minima capture clinically important hypoperfusion episodes better than averages."
0_12h_r_saturated_venous_o2_measured,2,"More frequent venous O2 saturation checks can reflect clinician concern for low cardiac output/shock, which is indirectly related to AKI risk. As a _measured feature it remains a weak proxy rather than a mechanism."
13_24h_r_saturated_venous_o2_measured,2,"Higher measurement frequency may indicate persistent hemodynamic instability prompting closer monitoring, which correlates with AKI risk. Still, it is a behavioral marker and should be scored low."
25_36h_r_saturated_venous_o2_measured,2,"Measurement frequency reflects clinician concern about oxygen delivery/low output, which can relate indirectly to renal hypoperfusion. As a _measured proxy (not the SvO2 value), it should stay low."
0_12h_r_maintenance_iv_volume_mean,2,"Maintenance IV volume can contribute to fluid overload/hemodilution, but early post-op fluids are routine and often transient. Mean volume is a nonspecific exposure and less tied to AKI than hemodynamics/urine output."
13_24h_r_maintenance_iv_volume_mean,2,"Ongoing maintenance fluids may reflect evolving instability or attempts to support perfusion, but the mean is still nonspecific. In this trajectory phase, association with AKI is plausible but indirect."
25_36h_r_maintenance_iv_volume_mean,3,"Closer to the outcome, sustained higher maintenance fluids may indicate persistent vasoplegia/low effective circulating volume or contribute to congestion, both linked to AKI risk. Mean remains less specific than extremes but can capture ongoing exposure."
0_12h_r_maintenance_iv_volume_max,2,"A high peak maintenance rate early post-op often reflects routine immediate post-bypass management and may not represent true renal insult. Extremes are more informative than means, but this early epoch warrants conservative scoring."
13_24h_r_maintenance_iv_volume_max,2,"A peak maintenance rate in 13–24h may signal intermittent hypotension/vasoplegia management, indirectly related to AKI. Still nonspecific and potentially collinear with mean volume, so kept low."
25_36h_r_maintenance_iv_volume_max,3,"A late peak in maintenance IV rate can be a leading indicator of persistent shock physiology or attempts to augment renal perfusion, which is associated with AKI. As an extreme, it may better capture acute deterioration than the mean."
0_12h_r_maintenance_iv_volume_min,1,Low minimum maintenance rate early post-op is usually protocol-driven (line patency/transitioning fluids) and not a direct AKI mechanism. The minimum is generally less informative than high-volume extremes for renal risk.
13_24h_r_maintenance_iv_volume_min,1,Minimum maintenance rate is more reflective of ordering practices than physiology and is not a recognized AKI predictor. It is also likely redundant with other fluid metrics.
25_36h_r_maintenance_iv_volume_min,1,A low minimum maintenance rate late is not a direct marker of renal hypoperfusion and may simply reflect fluid restriction or stopping maintenance fluids. Minimum values are weakly linked to AKI compared with hemodynamics and renal labs.
0_12h_r_maintenance_iv_volume_measured,1,Measurement frequency of maintenance IV volume is a documentation/monitoring artifact rather than a physiologic driver. In the immediate post-op period it is routine and not specific for AKI risk.
13_24h_r_maintenance_iv_volume_measured,1,"How often maintenance IV volume is recorded mainly reflects nursing/EMR workflow and general acuity, not kidney injury. As a _measured feature it should remain very low."
25_36h_r_maintenance_iv_volume_measured,1,"Even late, recording frequency is not a physiologic signal and is unlikely to add predictive value beyond actual fluid amounts and hemodynamics. Per rules, _measured features should be scored 1–2."
0_12h_r_an_pap_systolic_measured,2,"Having PAP monitoring suggests higher-risk cardiac dysfunction/right heart strain, which can predispose to renal congestion and AKI. However this is a measurement-presence proxy in the immediate post-op period, so limited specificity."
13_24h_r_an_pap_systolic_measured,2,"Continued PAP monitoring implies ongoing hemodynamic concern (e.g., RV failure, pulmonary hypertension) that can affect renal perfusion/congestion. As a measured/presence indicator rather than the PAP value, it remains low."
25_36h_r_an_pap_systolic_measured,2,"Late persistence of PAP monitoring may indicate unresolved cardiogenic/vasoplegic shock risk states associated with AKI. Still, it is a monitoring proxy (not the PAP level), so importance is capped."
0_12h_r_an_pap_diastolic_measured,1,"Measurement frequency of PA diastolic pressure mainly reflects monitoring intensity rather than renal physiology. In the immediate 0–12h post-op period, this is especially nonspecific for later creatinine rise."
13_24h_r_an_pap_diastolic_measured,1,"Ordering/recording frequency is a weak behavioral proxy for acuity and not a direct AKI mechanism. In 13–24h it may reflect instability, but remains too nonspecific to strongly predict creatinine_ratio."
25_36h_r_an_pap_diastolic_measured,2,"More frequent PA diastolic monitoring late (25–36h) can indicate ongoing shock/heart failure management, which can precede AKI. Still, it is a monitoring-intensity proxy rather than a physiologic insult."
0_12h_r_an_central_venous_pressure_measured,1,"CVP measurement frequency reflects invasive monitoring and clinician concern, not congestion itself. Early post-op monitoring is routine and poorly specific for subsequent AKI."
13_24h_r_an_central_venous_pressure_measured,1,Frequency of CVP documentation is not a direct marker of renal hypoperfusion or venous congestion. It may correlate with severity of illness but is too indirect for AKI prediction.
25_36h_r_an_central_venous_pressure_measured,2,"Increased CVP monitoring in the 25–36h window may signal persistent hemodynamic problems (e.g., RV failure/volume overload) that can contribute to renal venous congestion and AKI. However, the feature captures measurement behavior, not the CVP value."
0_12h_r_an_etco2_mean,1,"Mean EtCO2 in the immediate post-op window is heavily influenced by ventilation settings and anesthesia effects, and is not a primary AKI driver. Any association with perfusion is indirect and confounded early."
13_24h_r_an_etco2_mean,2,"Sustained lower EtCO2 can indirectly reflect low cardiac output or high dead space, which may correlate with poor perfusion and AKI risk. As a mean value, it is less sensitive than extremes for detecting acute hypoperfusion."
25_36h_r_an_etco2_mean,2,"In the leading-indicator window, persistently abnormal EtCO2 may track ongoing low flow states that predispose to AKI. Still, mean EtCO2 is an indirect and ventilator-dependent surrogate."
0_12h_r_an_etco2_max,1,High EtCO2 extremes early are usually driven by hypoventilation/ventilator changes rather than renal-relevant pathology. It is not a recognized trigger for AKI.
13_24h_r_an_etco2_max,1,"EtCO2 maxima generally reflect ventilation rather than perfusion failure, and have weak linkage to AKI. Extremes on the high side are less informative for renal risk than low EtCO2 episodes."
25_36h_r_an_etco2_max,1,Late high EtCO2 is typically ventilatory/hypercapnia-related and not a direct renal insult. It provides little incremental AKI signal compared with low EtCO2 or hemodynamic variables.
0_12h_r_an_etco2_min,2,"Very low EtCO2 can indicate low cardiac output/poor pulmonary blood flow or severe dead space, which can accompany hypoperfusion. In 0–12h this is common and transient post-op, so predictive value is limited."
13_24h_r_an_etco2_min,3,"Low EtCO2 episodes in 13–24h more plausibly reflect persistent low flow/shock physiology, which is an established AKI risk factor. As an extreme, the minimum better captures acute hypoperfusion than the mean."
25_36h_r_an_etco2_min,3,"In 25–36h, a low EtCO2 minimum can be a leading indicator of ongoing low cardiac output or severe V/Q mismatch associated with systemic hypoperfusion and AKI. It remains indirect and confounded by ventilator changes, so not scored as a direct biomarker."
0_12h_r_an_etco2_measured,1,EtCO2 measurement frequency is largely routine in intubated post-cardiac surgery patients and reflects monitoring practice. It does not represent a physiologic mechanism for AKI and is especially nonspecific in 0–12h.
13_24h_r_an_etco2_measured,1,Measurement frequency of EtCO2 mainly reflects ventilation monitoring intensity rather than renal physiology. At most it is a weak proxy for acuity/suspicion and should not drive AKI prediction.
25_36h_r_an_etco2_measured,2,"More frequent EtCO2 checks late may indicate ongoing ventilatory instability or high-acuity care, which can correlate with shock/AKI risk. Still a behavioral proxy, not a direct mechanism."
0_12h_r_an_fio2_mean,2,"Higher average FiO2 early post-op can reflect respiratory failure severity and overall illness, indirectly associated with AKI. In the immediate 0–12h period this is often transient and less specific for renal injury."
0_12h_r_an_fio2_max,2,"FiO2 spikes may mark acute hypoxemia or instability, which can accompany low cardiac output and renal hypoperfusion. Early post-op extremes are common and nonspecific, so importance is limited."
0_12h_r_an_fio2_min,1,Lower minimum FiO2 generally reflects better oxygenation and is not a known trigger for AKI. It is unlikely to add prognostic value beyond other severity markers.
0_12h_r_an_fio2_measured,1,Frequency of FiO2 documentation/orders is routine in ventilated patients and is not a physiologic driver of AKI. It is a weak acuity proxy at best.
13_24h_r_an_fio2_measured,1,FiO2 measurement frequency remains largely standard-of-care and reflects monitoring practices more than kidney perfusion. Limited incremental value for predicting creatinine rise.
25_36h_r_an_fio2_measured,2,"Late frequent FiO2 adjustments/recording may indicate persistent respiratory failure and higher overall ICU acuity, which correlates with AKI risk. Still indirect and behavioral, so capped."
0_12h_r_an_tidal_volume_mean,1,Average tidal volume early post-op is primarily a ventilation strategy variable and not a direct AKI predictor. Any association with AKI is indirect via severity of illness and is diluted by averaging.
13_24h_r_an_tidal_volume_mean,2,"Sustained higher tidal volumes can contribute to ventilator-induced lung injury and systemic inflammation, indirectly increasing AKI risk. In the 13–24h trajectory phase this remains a modest, nonspecific signal."
25_36h_r_an_tidal_volume_mean,2,"Persistently higher tidal volumes closer to outcome may reflect ongoing mechanical ventilation needs and inflammatory burden, indirectly linked to AKI. Mean values are less informative than extremes and remain non-specific."
0_12h_r_an_tidal_volume_max,2,"High tidal volume episodes can indicate poor lung compliance or aggressive ventilation, which may worsen inflammation and hemodynamics affecting renal perfusion. In 0–12h this is often transient and less predictive."
13_24h_r_an_tidal_volume_max,2,"Max tidal volume in this window may capture injurious ventilation episodes and severity of respiratory failure, indirectly associated with AKI. Still not a primary renal driver and may be collinear with other severity markers."
25_36h_r_an_tidal_volume_max,3,"Late high tidal volume extremes can reflect ongoing poor compliance/ARDS physiology and potentially injurious ventilation, contributing to systemic inflammation and renal hypoperfusion risk. As an extreme in the closest window, it is more informative than mean/min."
0_12h_r_an_tidal_volume_min,1,Low minimum tidal volume often reflects lung-protective strategy or brief ventilator adjustments and is not a known AKI trigger. Early post-op minima are common and not specific.
13_24h_r_an_tidal_volume_min,1,Lower minimum tidal volume is generally not harmful and is weakly related to AKI except as a nonspecific marker of ventilation management. It is unlikely to add predictive value compared with max/extreme indicators.
25_36h_r_an_tidal_volume_min,2,Very low tidal volumes may reflect lung-protective ventilation or severe respiratory failure; indirect links to AKI via hypoxemia/hypercapnia and higher intrathoracic pressures affecting renal perfusion. Not a primary AKI driver and can be confounded by ventilator strategy.
0_12h_r_an_tidal_volume_measured,1,Measurement frequency is mainly a documentation/monitoring intensity proxy rather than a physiologic mechanism for AKI. Early (0–12h) post-op monitoring is routine and not specific for impending renal injury.
13_24h_r_an_tidal_volume_measured,1,Counts of tidal volume recordings reflect care intensity and ventilator management rather than kidney perfusion or nephrotoxicity. In this mid-epoch it remains nonspecific for later creatinine rise.
25_36h_r_an_tidal_volume_measured,2,"More frequent ventilator parameter recording late may indicate ongoing instability/ARDS, which can correlate with AKI risk, but it is still a behavioral proxy. Score capped because it is not a direct physiologic marker."
0_12h_r_an_abp_pulse_measured,1,"ABP pulse measurement presence/frequency is a monitoring proxy (arterial line use/attention), not a direct AKI mechanism. In the immediate post-op window it is near-universal and poorly discriminative."
13_24h_r_an_abp_pulse_measured,1,Ongoing ABP pulse monitoring reflects ICU practice and acuity rather than renal perfusion itself. Not specific enough to predict creatinine_ratio.
25_36h_r_an_abp_pulse_measured,2,"Persistent intensive arterial waveform monitoring late may indicate hemodynamic lability/vasopressor needs, which are associated with AKI, but this variable is still indirect. Kept low per the _measured rule."
0_12h_r_an_heart_rate_measured,1,Heart rate measurement frequency is routine in the ICU and does not directly represent renal hypoperfusion or injury. Early post-op monitoring is expected for nearly all patients.
13_24h_r_an_heart_rate_measured,1,This is a care-intensity proxy rather than a physiologic extreme/average linked to AKI. Mid-epoch measurement frequency adds little specific signal for renal outcomes.
25_36h_r_an_heart_rate_measured,2,"More frequent HR recording late can reflect instability (arrhythmias, shock) that increases AKI risk, but it remains indirect and confounded by monitoring practices. Scored low per measurement-frequency guidance."
0_12h_r_an_abp_mean_measured,1,"MAP measurement frequency is not the same as hypotension burden; it mainly reflects monitoring intensity. In 0–12h, arterial MAP monitoring is common and not specific for AKI prediction."
13_24h_r_an_abp_mean_measured,1,Counts of MAP measurements do not capture the hypotensive episodes that drive renal ischemia. As a behavioral proxy it has weak specificity for later creatinine rise.
25_36h_r_an_abp_mean_measured,2,"Late frequent MAP monitoring may indicate ongoing shock/vasopressor titration, which correlates with AKI risk, but the variable does not quantify hypotension itself. Importance capped due to being a _measured feature."
0_12h_anesthesia_respirations_measured,1,Respiration measurement frequency during/after anesthesia is largely routine documentation and not a direct renal risk factor. Early post-op respiratory monitoring is expected and nonspecific.
13_24h_anesthesia_respirations_measured,1,"This reflects monitoring/documentation intensity rather than hypoxemia, hypercapnia, or ventilatory pressures that could affect renal perfusion. Weak link to AKI."
25_36h_anesthesia_respirations_measured,2,"More frequent respiratory measurements late may signal ongoing ventilatory failure or instability, which can co-occur with AKI, but it remains an indirect behavioral marker. Scored low per the _measured rule."
0_12h_anesthesia_pulse_oximetry_measured,1,"Measurement frequency reflects routine monitoring rather than a renal mechanism, especially immediately post-op when pulse oximetry is universal. As a behavioral/acuity proxy only, it has weak specificity for AKI."
13_24h_anesthesia_pulse_oximetry_measured,1,Still largely reflects standard monitoring/acuity rather than kidney perfusion or nephrotoxicity. Frequency is not a direct physiologic predictor of creatinine rise.
25_36h_anesthesia_pulse_oximetry_measured,2,"In the later window, increased monitoring frequency may weakly proxy ongoing instability or hypoxemia concern, which can correlate with AKI risk. However it remains non-specific and not a physiologic measurement itself."
0_12h_r_tube_intake_measured,1,Tube intake documentation frequency is primarily a care-process variable and not a direct driver of renal injury. Early post-op feeding/NG use is common and not specific for AKI.
13_24h_r_tube_intake_measured,1,Measurement frequency mainly reflects nutrition/NG management rather than renal perfusion or injury. Limited specificity for predicting creatinine_ratio.
25_36h_r_tube_intake_measured,2,"Later inability to tolerate enteral intake or increased tracking may weakly reflect severity of illness, which can associate with AKI. Still indirect and non-specific."
0_12h_r_maintenance_iv_bolus_volume_mean,2,"Average maintenance/bolus volume early post-op is a crude proxy for resuscitation and hemodynamic support, which can relate to renal perfusion. Mean is less informative than extremes for AKI-triggering hypoperfusion/overload and is conservative in 0–12h."
0_12h_r_maintenance_iv_bolus_volume_max,3,"Large bolus requirements can indicate hypotension/low cardiac output states that threaten renal perfusion and predispose to AKI. The maximum better captures acute resuscitation needs than the mean/min, though early post-op effects can be transient."
0_12h_r_maintenance_iv_bolus_volume_min,1,Minimum bolus volume is not clinically meaningful for AKI risk and is largely redundant with other volume summaries. It does not capture the pathologic extreme (need for large resuscitation).
0_12h_r_maintenance_iv_bolus_volume_measured,1,"How often bolus volume is recorded is a documentation/acuity proxy rather than a physiologic determinant of AKI. Per rules, measured features are low-importance unless highly specific, which this is not."
13_24h_r_maintenance_iv_bolus_volume_measured,1,Measurement frequency reflects ongoing nursing/clinical attention and is not a direct renal injury marker. Not specific for predicting creatinine_ratio.
25_36h_r_maintenance_iv_bolus_volume_measured,2,"In the leading-indicator window, frequent bolus documentation may weakly indicate persistent hemodynamic instability, which increases AKI risk. Still indirect and non-specific compared with actual hemodynamic/lab values."
0_12h_r_pacemaker_mean,2,"Need for pacing can reflect conduction issues and potentially low cardiac output, which may reduce renal perfusion. In the immediate post-op window this is often transient and less predictive, and mean pacing is less informative than presence/need."
13_24h_r_pacemaker_mean,2,"Ongoing pacing suggests persistent cardiac dysfunction that can impair renal perfusion, but it remains an indirect marker. Trajectory-phase scoring is reduced given evolving stabilization."
25_36h_r_pacemaker_mean,3,"Persistent pacing requirement closer to hour 60 can indicate sustained low-output physiology or significant cardiac dysfunction, a recognized contributor to cardiorenal AKI. Still indirect compared with direct renal biomarkers or blood pressure/vasopressor dose."
0_12h_r_pacemaker_max,3,"Any pacing requirement (max/presence) captures an acute conduction/low-output event that can compromise renal perfusion more directly than a mean value. Early post-op pacing can be transient, so not scored as a strong direct predictor."
13_24h_r_pacemaker_max,2,"Need for pacing suggests conduction disease/low cardiac output risk, which can indirectly reduce renal perfusion. In 13–24h this is less specific and often transient post-op."
25_36h_r_pacemaker_max,3,"Ongoing pacing requirement closer to hour 60 can indicate persistent low output or hemodynamic instability, which is an established AKI risk factor. Binary presence is still indirect (not a renal biomarker)."
0_12h_r_pacemaker_min,1,"Immediate post-op pacing is common and often prophylactic/temporary after cardiac surgery, with weak specificity for later AKI. Early epoch further reduces prognostic value."
13_24h_r_pacemaker_min,2,"Continued pacing into the trajectory phase may reflect ongoing cardiac dysfunction affecting renal perfusion, but remains nonspecific. Less predictive than later (25–36h) indicators."
25_36h_r_pacemaker_min,3,"Persistent pacing in the leading-indicator window can mark sustained hemodynamic compromise (e.g., low cardiac output), a known contributor to postoperative AKI. Still an indirect proxy rather than a direct kidney measure."
0_12h_r_pacemaker_measured,1,"Measurement frequency reflects monitoring/documentation behavior rather than physiology and is not a direct AKI mechanism. In the first 12h, frequent checks are routine post-cardiac surgery."
13_24h_r_pacemaker_measured,1,"Counts of pacemaker-related measurements mainly capture clinician attention/monitoring intensity, not renal injury. At most a weak acuity proxy."
25_36h_r_pacemaker_measured,2,"More frequent pacemaker assessments late may indicate ongoing instability prompting closer monitoring, which can correlate with AKI risk. Still primarily a behavioral proxy, so capped low."
