value,importance,reason
13_24h_po2_min,2,"Minimum PaO2 during 13–24h captures persistent or recurrent hypoxemia, which may worsen renal oxygen delivery indirectly. Still relatively nonspecific for kidney injury and often confounded by lung pathology and ventilator management."
25_36h_po2_min,3,Minimum PaO2 in the 25–36h leading-indicator window reflects ongoing hypoxemia closer to the Hour 60 creatinine outcome and may signal sustained critical illness affecting renal perfusion/oxygenation. It remains indirect (not kidney-specific) but timing and extreme-value aggregation improve prognostic value.
0_12h_po2_measured,1,Count/frequency of PaO2 measurements mainly reflects monitoring intensity (ABG frequency) and clinician concern rather than a renal mechanism. Strong proxy penalty and early postop routine ABGs limit usefulness.
13_24h_po2_measured,1,"PaO2 measurement frequency in 13–24h is largely a care-process/acuity marker (ventilator adjustments, instability) rather than kidney-specific physiology. Proxy penalty dominates, so predictive value for creatinine ratio is low."
25_36h_po2_measured,2,"More frequent PaO2 checks at 25–36h can indicate ongoing respiratory/hemodynamic instability closer to the outcome window. Still primarily a monitoring-intensity proxy, so it should not score high."
0_12h_potassium_mean,2,"Mean potassium early after surgery reflects electrolyte balance influenced by transfusion, acidosis, insulin, and renal handling, but is often affected by perioperative shifts. As a mean in the immediate window it can wash out brief hyperkalemia and is only an indirect AKI signal."
13_24h_potassium_mean,3,"Mean potassium in 13–24h may reflect evolving renal clearance and acid-base status as the patient stabilizes, making it a moderate AKI risk indicator. Mean aggregation still dilutes extremes and is influenced by treatment (insulin, diuretics, dialysis), limiting specificity."
25_36h_potassium_mean,3,Mean potassium in 25–36h is closer to the Hour 60 creatinine and can reflect reduced renal excretion or ongoing tissue breakdown. It remains moderately predictive but not as strong as potassium extremes for detecting impending renal dysfunction.
0_12h_potassium_max,3,"Peak potassium in the immediate postop period can signal impaired renal excretion, hemolysis, acidosis, or massive transfusion, all associated with AKI risk. However, early peaks are often transient/treatment-responsive, so timing warrants some conservatism."
13_24h_potassium_max,4,Peak potassium in 13–24h is a stronger indicator of inadequate renal clearance or ongoing catabolic/acidemic stress after initial perioperative shifts settle. Extreme-value aggregation captures clinically meaningful hyperkalemia linked to worsening renal function.
25_36h_potassium_max,4,Peak potassium in 25–36h is a near-term signal of reduced renal excretory capacity and is temporally close to the Hour 60 creatinine ratio. Max aggregation captures clinically important hyperkalemia episodes that often accompany evolving AKI.
0_12h_potassium_min,2,"Minimum potassium early postop often reflects dilution, diuretics, insulin therapy, or alkalosis rather than kidney injury per se. It is less mechanistically tied to rising creatinine and is confounded by routine electrolyte management."
13_24h_potassium_min,2,"Minimum potassium in 13–24h may indicate ongoing diuresis or aggressive replacement/insulin use and is not a direct marker of renal dysfunction. It is a weaker, treatment-confounded predictor compared with hyperkalemia metrics."
25_36h_potassium_min,2,"Minimum potassium in 25–36h remains more reflective of therapy and shifts than impaired renal clearance, so renal specificity is low. Despite closer timing, it is generally less informative for predicting creatinine rise than potassium maxima."
0_12h_potassium_measured,1,"Potassium measurement frequency mainly reflects lab monitoring intensity and clinician concern (e.g., arrhythmia risk, insulin infusions) rather than renal pathophysiology. Strong proxy penalty and routine early postop lab schedules limit predictive value."
13_24h_potassium_measured,2,Frequency of potassium checks in the 13–24h window mainly reflects monitoring intensity/clinical concern rather than renal function itself. It can weakly proxy evolving AKI or instability but is indirect and penalized as a process-of-care variable.
25_36h_potassium_measured,2,"Potassium measurement frequency close to the outcome may increase with suspected AKI, acidosis, or arrhythmia risk, but it is still primarily a clinician-behavior proxy. Per rules, _measured variables should remain low despite temporal proximity."
0_12h_total_bilirubin_mean,2,"Mean bilirubin early post-op reflects hepatic dysfunction/hemolysis and overall shock burden, which can correlate with AKI risk but is not kidney-specific. The 0–12h mean may dilute transient peaks and is temporally less informative."
0_12h_total_bilirubin_max,2,"Peak bilirubin in the immediate post-op period can indicate hemolysis (e.g., CPB) or hypoperfusion-related cholestasis, indirectly associated with AKI. Still nonspecific for renal injury and early transient elevations are common."
0_12h_total_bilirubin_min,1,Minimum bilirubin in the first 12 hours is unlikely to capture clinically meaningful organ dysfunction relevant to later creatinine rise. It has low renal specificity and poor aggregation for acute insult.
0_12h_total_bilirubin_measured,1,Bilirubin measurement frequency early after surgery is largely routine or driven by general acuity rather than a renal mechanism. Strong proxy penalty and limited renal specificity.
13_24h_total_bilirubin_measured,1,"How often bilirubin is checked in 13–24h mainly reflects clinician concern for hepatic/hemolysis issues and overall severity, not kidney injury directly. As a _measured feature it is a weak, indirect proxy for AKI risk."
25_36h_total_bilirubin_measured,1,"Later bilirubin check frequency may track ongoing critical illness, but it remains a monitoring-intensity signal rather than a renal pathway. Despite being closer to Hour 60, _measured variables should stay low importance."
0_12h_rbc_count_mean,2,"Mean RBC count early post-op reflects anemia/hemodilution/bleeding and transfusion context, which can influence renal perfusion and AKI risk indirectly. Early means are often confounded by fluid shifts and are not kidney-specific."
13_24h_rbc_count_mean,2,"RBC count in 13–24h may reflect ongoing bleeding/transfusion and oxygen delivery, indirectly related to renal hypoxia risk. Mean aggregation and nonspecificity limit predictive strength for creatinine ratio."
25_36h_rbc_count_mean,2,"Later mean RBC count may better represent sustained anemia affecting renal oxygen delivery, but it remains an indirect predictor and heavily confounded by transfusions/fluids. Moderate at best for predicting Hour 60 creatinine ratio."
0_12h_rbc_count_max,1,Maximum RBC count early post-op is usually driven by hemoconcentration or transfusion timing and is not a clear renal-risk signal. Poor renal specificity and high confounding reduce usefulness.
13_24h_rbc_count_max,1,Peak RBC count in 13–24h is not a well-established AKI precursor and often reflects transfusion/volume status rather than renal physiology. Limited mechanistic linkage to subsequent creatinine rise.
25_36h_rbc_count_max,1,Maximum RBC count near the outcome window still mainly reflects transfusion or hemoconcentration rather than kidney injury or perfusion failure. Weak and nonspecific for predicting creatinine ratio.
0_12h_rbc_count_min,3,"Minimum RBC count captures worst anemia/hemodilution/bleeding early after surgery, which can impair oxygen delivery and associate with AKI risk. Although early and confounded, the extreme (min) is more clinically meaningful than mean/max for renal hypoxia risk."
13_24h_rbc_count_min,3,"Minimum RBC count in 13–24h reflects persistent or worsening anemia after initial resuscitation, a more informative trajectory-phase signal for renal oxygen delivery risk. Still indirect, but the extreme value is a better predictor than mean/max."
25_36h_rbc_count_min,2,"Low RBC count late post-op reflects anemia/hemodilution or bleeding/transfusion context, which can correlate with illness severity and renal hypoxia risk but is not kidney-specific. The 25–36h minimum captures a potentially meaningful nadir, yet remains an indirect proxy for AKI risk."
0_12h_rbc_count_measured,1,"Indicates whether/ how often RBC count was checked in the immediate post-op period, mainly reflecting monitoring intensity rather than renal physiology. Early timing and strong proxy penalty make it minimally useful for predicting Hour-60 creatinine ratio."
13_24h_rbc_count_measured,1,"Measurement frequency of RBC count in 13–24h is largely clinician behavior/acuity signaling, not a renal mechanism. Limited renal specificity and proxy penalty keep predictive value low."
25_36h_rbc_count_measured,2,"Late-window RBC monitoring may reflect ongoing bleeding, transfusion needs, or instability closer to the creatinine outcome, which can indirectly relate to AKI risk. Still primarily a care-process proxy, so it should not score high."
0_12h_d_dimer_measured,1,Whether D-dimer was measured early post-op mainly reflects clinician concern for thrombosis/bleeding rather than kidney injury pathways. As a _measured variable it is a monitoring proxy with low renal specificity.
13_24h_d_dimer_measured,1,"D-dimer measurement in 13–24h is typically ordered for suspected VTE/DIC/bleeding and is not directly tied to renal function. Proxy penalty dominates, so usefulness for creatinine_ratio is minimal."
25_36h_d_dimer_measured,2,"Late D-dimer ordering may signal evolving thrombotic/consumptive processes or severe inflammation closer to Hour 60, which can associate with AKI risk indirectly. However it remains a clinician-order proxy (_measured), limiting importance."
0_12h_teg_activated_clotting_time_measured,1,"TEG ACT measurement early post-op reflects coagulation management/bleeding risk assessment rather than renal perfusion or injury. As a measurement indicator, it is mostly a process-of-care proxy with low renal relevance."
13_24h_teg_activated_clotting_time_measured,1,Whether TEG ACT was checked in 13–24h primarily indicates ongoing coagulation/bleeding evaluation and monitoring intensity. It has weak mechanistic linkage to AKI and high proxy penalty.
25_36h_teg_activated_clotting_time_measured,2,"Late TEG ACT measurement may indicate persistent bleeding/coagulopathy or re-intervention risk closer to the outcome, indirectly associated with renal injury via shock/transfusion burden. Still a _measured proxy variable, so capped at low importance."
0_12h_percent_immature_granulocyte_mean,2,"Immature granulocyte percentage reflects systemic inflammation/stress response, which can correlate with postoperative complications and AKI risk but is nonspecific. Mean in 0–12h may be confounded by immediate post-bypass inflammatory surge, limiting predictive strength."
13_24h_percent_immature_granulocyte_mean,3,"Immature granulocyte percentage in 13–24h can reflect ongoing inflammatory/infectious trajectory, which is a moderate AKI risk factor in ICU patients. This epoch is more prognostically informative than 0–12h, though mean aggregation can dilute spikes."
0_12h_percent_immature_granulocyte_max,2,"Peak immature granulocytes early may indicate a strong inflammatory response, but immediate post-op elevations are common and not kidney-specific. Max is the better aggregation for acute stress, yet temporal proximity is limited."
13_24h_percent_immature_granulocyte_max,3,"A higher peak immature granulocyte percentage in 13–24h suggests persistent or worsening inflammation/infection, which is moderately linked to subsequent AKI and creatinine rise. Max captures clinically meaningful spikes better than mean in this trajectory window."
0_12h_percent_immature_granulocyte_min,1,The minimum immature granulocyte percentage is not clinically meaningful for AKI prediction and mainly reflects absence of inflammation rather than a renal pathway. Early timing and poor aggregation relevance make it low value.
13_24h_percent_immature_granulocyte_min,1,Minimum immature granulocyte percentage in 13–24h provides little signal about inflammatory burden or renal risk compared with peaks/levels. Aggregation quality is weak for capturing pathology relevant to Hour-60 creatinine ratio.
0_12h_percent_immature_granulocyte_measured,1,Measurement frequency of immature granulocyte % is mainly a monitoring-intensity/infection-workup proxy rather than a renal mechanism. Early postop timing and “_measured” aggregation add strong proxy penalty for predicting Hour-60 creatinine ratio.
13_24h_percent_immature_granulocyte_measured,1,"Counts how often immature granulocyte % was checked, reflecting clinician concern for inflammation/sepsis more than kidney injury itself. As a “_measured” variable it is largely process-of-care and only indirectly related to AKI risk."
25_36h_percent_immature_granulocyte_measured,2,"Later measurement frequency may weakly signal evolving infection/shock workup closer to the outcome window, which can secondarily affect renal function. Still primarily a monitoring proxy (“_measured”), so predictive value for creatinine ratio should be limited."
0_12h_teg_fibrinolysis_measured,1,"Whether TEG fibrinolysis was measured reflects bleeding/coagulopathy evaluation and clinician behavior, not kidney-specific physiology. Immediate postop period further reduces specificity for later creatinine rise."
13_24h_teg_fibrinolysis_measured,1,TEG fibrinolysis measurement is a care-process marker for coagulation management rather than a direct AKI pathway. Any association with renal outcomes would be indirect via severity/bleeding/transfusion.
25_36h_teg_fibrinolysis_measured,2,"Late TEG measurement may indicate ongoing bleeding/coagulopathy and higher illness severity closer to Hour 60, which can correlate with AKI. However it remains a “measured” proxy with low renal specificity."
0_12h_creatinine_ratio_mean,4,Mean early postoperative creatinine ratio is a direct kidney function biomarker and captures early AKI signal. Discounted slightly because immediate postop creatinine can be diluted/unstable and mean may wash out brief peaks.
13_24h_creatinine_ratio_mean,4,Creatinine ratio in the 13–24h trajectory phase reflects evolving renal dysfunction and is directly on the causal pathway to the Hour-60 ratio. Mean is moderately informative but less sensitive than maxima for acute worsening.
25_36h_creatinine_ratio_mean,5,Creatinine ratio mean at 25–36h is a direct renal biomarker very close in time to the Hour-60 outcome and reflects ongoing AKI trajectory. High temporal proximity and renal specificity make it extremely predictive.
0_12h_creatinine_ratio_max,4,Peak early creatinine ratio captures the worst early renal signal and is more sensitive to acute injury than the mean. Still somewhat discounted because immediate postop peaks may reflect transient hemodilution/assay timing rather than sustained AKI.
13_24h_creatinine_ratio_max,5,Peak creatinine ratio during 13–24h strongly indicates evolving AKI and is directly prognostic for later creatinine elevation. Max aggregation appropriately captures clinically meaningful worsening.
25_36h_creatinine_ratio_max,5,Peak creatinine ratio at 25–36h is a near-term direct marker of kidney injury and strongly anchors the trajectory toward the Hour-60 ratio. Max best captures clinically important deterioration in this leading-indicator window.
0_12h_creatinine_ratio_min,2,Minimum early creatinine ratio is less informative for AKI because low values often reflect dilution/resuscitation rather than renal recovery. It has renal specificity but poor aggregation relevance for predicting later worsening.
13_24h_creatinine_ratio_min,3,"Minimum creatinine ratio in 13–24h may reflect degree of recovery vs persistent elevation, offering some prognostic information. However minima are generally less predictive of subsequent AKI than peaks or sustained elevation."
25_36h_creatinine_ratio_min,4,"Minimum creatinine ratio at 25–36h still reflects renal function close to the outcome and can indicate whether creatinine ever normalizes in that window. Slightly less informative than max/mean for detecting ongoing injury, but still strong due to timing and renal specificity."
0_12h_creatinine_ratio_measured,2,"Frequency of creatinine measurement early postop reflects monitoring intensity and clinician concern (e.g., instability/AKI risk) more than physiology. As a “_measured” feature it has proxy penalty, but may weakly correlate with higher-risk patients."
13_24h_creatinine_ratio_measured,2,Count/frequency of creatinine ratio measurements in 13–24h is mainly a monitoring-intensity/clinician-concern proxy rather than renal physiology. May weakly signal evolving instability/AKI concern but is indirect and should not score high.
25_36h_creatinine_ratio_measured,2,"Measurement frequency of creatinine ratio in the 25–36h window reflects clinician suspicion and care intensity more than kidney function itself. Slightly more temporally proximate to Hour 60, but still a proxy variable so limited usefulness."
0_12h_x25_percent_albumin_dose_total_12h,2,"Use of 25% albumin early post-op often reflects volume management/third spacing or hypotension, which can correlate with renal hypoperfusion but is not kidney-specific. In the immediate 0–12h period it is heavily confounded by routine resuscitation and clinician practice."
13_24h_x25_percent_albumin_dose_total_12h,2,"25% albumin use in 13–24h may indicate ongoing capillary leak/low oncotic pressure or attempts to optimize hemodynamics/diuresis, indirectly related to AKI risk. Still largely a treatment-choice proxy with substantial confounding."
25_36h_x25_percent_albumin_dose_total_12h,3,"25% albumin use in 25–36h can signal persistent hemodynamic/volume-management problems closer to the outcome window, which may track with renal hypoperfusion or fluid overload affecting kidney function. Despite being a clinician-driven variable, the temporal proximity makes it a moderate predictor."
0_12h_albumin_5_percent_dose_total_12h,2,5% albumin dose early post-op is a nonspecific resuscitation/volume-expansion marker and is strongly influenced by practice patterns. It may correlate with shock/bleeding severity but has weak renal specificity in 0–12h.
13_24h_albumin_5_percent_dose_total_12h,2,"5% albumin in 13–24h suggests ongoing volume needs or hypoalbuminemia management, indirectly associated with illness severity and renal risk. However it remains a nonspecific treatment proxy with limited mechanistic linkage to creatinine rise."
25_36h_albumin_5_percent_dose_total_12h,3,"5% albumin use in 25–36h may reflect persistent hemodynamic instability or fluid shifts closer to Hour 60, which can precede AKI. Still confounded by clinician behavior, but timing improves prognostic value."
0_12h_acetaminophen_codeine_dose_total_12h,1,"Analgesic dosing (acetaminophen/codeine) primarily reflects pain control and sedation strategy, not renal perfusion or injury pathways. Any association with creatinine is likely incidental or via general care patterns."
13_24h_acetaminophen_codeine_dose_total_12h,1,Acetaminophen/codeine dose is not a recognized driver of AKI in this context and mainly captures analgesia needs and prescribing habits. Minimal renal specificity and weak prognostic proximity.
25_36h_acetaminophen_codeine_dose_total_12h,1,Later acetaminophen/codeine dosing remains a nonspecific supportive-care variable with little mechanistic link to postoperative creatinine rise. Any signal would be dominated by confounding from overall recovery trajectory.
0_12h_acetaminophen_dose_total_12h,1,Acetaminophen dose is routine postoperative analgesia/antipyresis and is not a meaningful AKI predictor at typical doses. It provides little renal-specific information and is heavily practice-driven.
13_24h_acetaminophen_dose_total_12h,1,Acetaminophen dosing in 13–24h reflects symptom management rather than kidney injury or perfusion. Weak and indirect association with creatinine outcomes.
25_36h_acetaminophen_dose_total_12h,1,Acetaminophen dose in 25–36h is still a nonspecific medication exposure with minimal renal relevance. Not a strong near-term indicator of evolving AKI.
0_12h_allopurinol_dose_total_12h,2,"Allopurinol use reflects chronic gout/hyperuricemia and is dose-adjusted in CKD, so it can weakly proxy baseline renal reserve/comorbidity. In the immediate post-op window it is not causally linked to acute creatinine rise and is largely a home-med continuation signal."
13_24h_allopurinol_dose_total_12h,2,Allopurinol dosing in 13–24h similarly indicates underlying comorbidity and medication continuation rather than an AKI pathway. It may weakly correlate with baseline CKD/renal dosing practices but is an indirect predictor.
25_36h_allopurinol_dose_total_12h,1,Allopurinol use in this window usually reflects chronic gout/hyperuricemia management rather than an acute renal-perfusion or AKI pathway. Dose is heavily clinician-behavior driven and only weakly related to near-term creatinine rise.
0_12h_aminocaproic_acid_dose_total_12h,2,"Aminocaproic acid is an antifibrinolytic used perioperatively to reduce bleeding/transfusion needs, which can indirectly affect AKI risk. In the immediate 0–12h period it is mostly a surgical practice proxy with limited direct renal specificity."
13_24h_aminocaproic_acid_dose_total_12h,1,"Continued aminocaproic acid use is uncommon and mainly reflects ongoing bleeding-management decisions rather than kidney injury biology. Indirect and highly practice-dependent, so weak for predicting Hour-60 creatinine ratio."
25_36h_aminocaproic_acid_dose_total_12h,1,"Late aminocaproic acid administration is primarily a marker of unusual ongoing bleeding/surgical management rather than a direct renal mechanism. Despite closer timing, it remains an indirect proxy with low renal specificity."
0_12h_amiodarone_dose_total_12h,2,"Amiodarone indicates postoperative atrial/ventricular arrhythmia treatment, which can correlate with hemodynamic instability and renal hypoperfusion. Early postoperative dosing is common and nonspecific, so predictive value is limited."
13_24h_amiodarone_dose_total_12h,2,"Ongoing amiodarone use suggests persistent arrhythmia burden and possibly lower cardiac output, indirectly increasing AKI risk. Still a proxy for cardiovascular instability rather than a direct renal biomarker."
25_36h_amiodarone_dose_total_12h,3,Amiodarone in the 25–36h window may reflect sustained arrhythmia/low-output physiology closer to the Hour-60 creatinine outcome. It remains indirect but has better temporal proximity as a marker of ongoing hemodynamic stress.
0_12h_amlodipine_dose_total_12h,1,Amlodipine is a chronic antihypertensive and its early postoperative administration is largely medication-reconciliation/practice driven. It has minimal direct linkage to acute renal perfusion failure or evolving AKI.
13_24h_amlodipine_dose_total_12h,1,Continuation of amlodipine mainly reflects baseline hypertension management and clinician preference rather than renal injury physiology. Weak and nonspecific for predicting creatinine ratio.
25_36h_amlodipine_dose_total_12h,1,"Late amlodipine use still primarily encodes chronic BP treatment rather than AKI pathways, and may even be withheld in unstable patients (introducing behavior confounding). Overall low renal specificity and low prognostic proximity."
0_12h_ampicillin_dose_total_12h,1,Ampicillin use reflects infection prophylaxis/treatment decisions and is not a typical nephrotoxin compared with other antibiotics. In 0–12h it is mostly a care-process marker with little direct renal relevance.
13_24h_ampicillin_dose_total_12h,2,"Ampicillin in 13–24h may indicate suspected infection/sepsis, which can contribute to AKI via shock/inflammation. Still indirect and strongly influenced by clinician suspicion and culture practices."
25_36h_ampicillin_dose_total_12h,2,"Ampicillin in the 25–36h window can be a proxy for ongoing infection/sepsis closer to the outcome, which is relevant to AKI risk. However it remains nonspecific and not directly nephrotoxic, so only weak-to-moderate utility."
0_12h_angiotensin_ii_dose_total_12h,4,"Angiotensin II is a rescue vasopressor typically used in refractory vasodilatory shock, strongly signaling severe hypotension/vasoplegia that threatens renal perfusion. Even early post-op, needing this agent is a high-acuity marker with clear AKI linkage."
13_24h_angiotensin_ii_dose_total_12h,4,"Angiotensin II requirement in 13–24h suggests persistent shock and high vasopressor dependence, a strong precursor to AKI and rising creatinine. Dose over 12h captures sustained exposure rather than a brief transient."
25_36h_angiotensin_ii_dose_total_12h,5,"Angiotensin II use/dose in 25–36h is a near-term indicator of ongoing refractory shock and renal hypoperfusion immediately preceding the Hour-60 creatinine measurement. This has tight mechanistic linkage and strong temporal proximity, making it highly predictive."
0_12h_apixaban_dose_total_12h,1,"Apixaban exposure early post-op mainly reflects anticoagulation strategy/indication (e.g., AF) rather than renal physiology. Limited direct AKI linkage and strong clinician-behavior proxy; early window further reduces relevance."
13_24h_apixaban_dose_total_12h,1,"Apixaban dosing in this window is primarily a care-process marker (anticoagulation choice and bleeding/thrombosis risk). Only weak, indirect renal relevance (dose adjustment in CKD) and not a kidney injury signal."
