value,importance,reason
0_12h_po2_mean,2,"Sustained hypoxemia can contribute to systemic stress and renal ischemia, but early post-op oxygenation is often ventilator/FiO2-managed and transient. Mean values may dilute brief but important desaturations."
13_24h_po2_mean,2,"Ongoing lower average PaO2 may reflect pulmonary dysfunction and overall severity of illness, indirectly increasing AKI risk. Mean PaO2 is less sensitive than extremes for acute hypoxemic insults."
25_36h_po2_mean,3,"At 25–36h, persistently low average PaO2 suggests unresolved respiratory failure and higher illness severity, which correlates with AKI risk. Still an indirect predictor rather than a kidney-specific biomarker."
0_12h_po2_max,1,High PaO2 maxima usually reflect high FiO2/ventilator settings rather than a pathologic trigger for AKI. Extremes here are more about management than renal perfusion (and 0–12h is highly transient).
13_24h_po2_max,1,PaO2 maxima are largely driven by supplemental oxygen and do not directly indicate renal hypoperfusion or injury. Provides limited incremental AKI signal compared with hypoxemia measures.
25_36h_po2_max,1,High PaO2 peaks at 25–36h typically indicate oxygen therapy intensity rather than a causal AKI mechanism. Not a reliable predictor of creatinine rise compared with hypotension/oliguria/renal labs.
0_12h_po2_min,2,"Low PaO2 can reflect hypoxemia and overall physiologic stress that may worsen renal oxygen delivery, but it is an indirect AKI driver and often transient immediately post-op (0–12h cap)."
13_24h_po2_min,2,"Persistent hypoxemia may contribute to systemic hypoxia and hemodynamic instability, indirectly increasing AKI risk, but PaO2 is not a direct renal biomarker."
25_36h_po2_min,3,"Later sustained or recurrent hypoxemia closer to outcome can signal ongoing cardiopulmonary failure/shock physiology that can impair renal perfusion, making it a more relevant leading indicator."
0_12h_po2_measured,1,"Measurement frequency mainly reflects monitoring intensity/acuity rather than a physiologic mechanism for AKI, especially in the immediate post-op period."
13_24h_po2_measured,1,More frequent PaO2 checks indicate clinician concern/instability but do not directly cause or specifically predict AKI.
25_36h_po2_measured,2,"Increased PaO2 measurement frequency late may proxy ongoing respiratory/hemodynamic instability and higher illness severity, but remains an indirect behavioral marker."
0_12h_potassium_mean,2,"Potassium abnormalities can accompany renal dysfunction and acid-base shifts, but the mean blunts clinically important extremes and early post-op shifts are common/transient."
13_24h_potassium_mean,2,"Average potassium may reflect evolving renal handling, but it is less informative than peak hyperkalemia for AKI risk and is influenced by supplementation/insulin/diuretics."
25_36h_potassium_mean,2,"Later mean potassium can correlate with reduced renal excretion, but extremes (max) better capture clinically meaningful renal impairment; capped to reduce collinearity."
0_12h_potassium_max,3,"Peak hyperkalemia can be an early signal of impaired renal excretion or severe tissue injury/hemolysis after surgery, but in 0–12h it may be transient and treatment-responsive (cap 3)."
13_24h_potassium_max,4,Hyperkalemia peak in the trajectory phase more strongly suggests evolving renal dysfunction and is clinically linked to AKI severity and need for renal support.
25_36h_potassium_max,4,Late peak hyperkalemia close to hour-60 is a strong indicator of reduced renal clearance and worsening AKI physiology (more informative than mean/min).
0_12h_potassium_min,1,Hypokalemia is usually driven by diuretics/insulin shifts and is not a typical trigger or marker of AKI; early post-op variability is common.
13_24h_potassium_min,1,"Low potassium more often reflects treatment effects or redistribution rather than intrinsic renal injury, offering little specific prognostic value for AKI."
25_36h_potassium_min,1,Even late hypokalemia is generally not a direct AKI marker and is often iatrogenic; it is less pathophysiologically tied to creatinine rise than hyperkalemia.
0_12h_potassium_measured,1,"Frequency of potassium checks reflects monitoring intensity and clinician concern rather than a direct physiologic pathway to AKI, especially immediately post-op."
13_24h_potassium_measured,2,Measurement frequency reflects clinician concern for electrolyte/renal issues but is not a physiologic driver of AKI. In the 13–24h window it is only an indirect acuity marker.
25_36h_potassium_measured,2,"More frequent potassium checks may indicate evolving renal dysfunction or instability, but it remains a behavioral proxy rather than a direct predictor. Closest window increases relevance slightly but still capped for _measured."
0_12h_total_bilirubin_mean,2,"Hyperbilirubinemia can correlate with hepatic congestion/low-flow states that also predispose to AKI, but early post-op averages are nonspecific. Mean is less informative than extremes for acute insult and capped for collinearity."
0_12h_total_bilirubin_max,3,"An early bilirubin spike can reflect hemolysis/ischemic hepatitis or low cardiac output after bypass, which is associated with AKI risk. In 0–12h derangements are common/transient so score is conservatively capped."
0_12h_total_bilirubin_min,1,The minimum bilirubin in the immediate post-op period is not clinically meaningful for AKI risk and does not capture pathologic insult. Provides little incremental information versus max/mean.
0_12h_total_bilirubin_measured,1,Ordering frequency of bilirubin early post-op mainly reflects routine post-cardiac surgery labs or nonspecific concern. It is not a direct physiologic marker of AKI.
13_24h_total_bilirubin_measured,1,"Repeat bilirubin checks may reflect concern for hepatic dysfunction/hemolysis, but measurement frequency is an indirect acuity signal. Not a primary AKI predictor."
25_36h_total_bilirubin_measured,2,"Later repeated bilirubin testing can indicate ongoing low-flow or cholestasis that often co-tracks with multiorgan dysfunction including AKI, but remains a behavioral proxy. Therefore kept low per _measured rule."
0_12h_rbc_count_mean,2,"Anemia/hemodilution can reduce oxygen delivery and contribute to renal ischemia, but early post-bypass values are heavily influenced by dilution/transfusion. Mean is less informative than nadir for ischemic risk and capped for collinearity."
13_24h_rbc_count_mean,2,"Sustained anemia may contribute to renal hypoxia, but the mean blunts clinically important nadirs and is often confounded by transfusion. Thus only an indirect predictor."
25_36h_rbc_count_mean,2,"Persistent anemia closer to outcome may relate to ongoing bleeding/hemodilution and reduced oxygen delivery, but mean remains less pathophysiologically specific than the minimum. Capped to avoid redundancy with min/max."
0_12h_rbc_count_max,1,Higher RBC count is not a typical trigger for AKI in this context and may reflect hemoconcentration without clear causal link. Does not capture the anemia-related risk signal.
13_24h_rbc_count_max,1,RBC maxima are not clinically informative for AKI prediction compared with anemia/nadir measures. Limited physiologic linkage.
25_36h_rbc_count_max,1,A high RBC count late is not a recognized direct AKI risk factor and is less relevant than low RBC/hemoglobin for renal oxygen delivery. Minimal incremental prognostic value.
0_12h_rbc_count_min,3,"The nadir RBC count captures acute anemia/hemodilution/bleeding and reduced oxygen delivery, which can contribute to renal ischemia after cardiac surgery. In 0–12h this is common and transient so conservatively capped at 3."
13_24h_rbc_count_min,3,"A low RBC nadir during 13–24h suggests persistent anemia/bleeding and impaired oxygen delivery, which is associated with AKI risk. More informative than mean/max but not a definitive biomarker."
25_36h_rbc_count_min,2,"Low RBC count reflects anemia/bleeding/hemodilution which can worsen renal oxygen delivery, but it is an indirect and nonspecific AKI predictor. Using the minimum captures the worst oxygen-carrying capacity in the closest window."
0_12h_rbc_count_measured,1,Measurement frequency mainly reflects monitoring intensity after surgery rather than a physiologic driver of AKI. Early (0–12h) ordering is routine post-cardiac surgery.
13_24h_rbc_count_measured,1,Repeat CBC ordering in this phase is common ICU practice and is a weak behavioral proxy for acuity rather than renal injury. Not a direct mechanism for creatinine rise.
25_36h_rbc_count_measured,2,"More frequent RBC checks late may indicate ongoing bleeding/transfusion needs or instability, which can correlate with AKI risk, but remains indirect. As a _measured feature it should stay low."
0_12h_d_dimer_measured,1,D-dimer ordering reflects clinician concern for thrombosis/PE/DIC rather than kidney perfusion directly. In the immediate post-op window it is often nonspecific and protocol-driven.
13_24h_d_dimer_measured,2,"Ordering D-dimer in this trajectory phase may signal evolving thrombotic/DIC concerns that can contribute to renal microthrombi, but it is still an indirect behavioral marker. Therefore kept low."
25_36h_d_dimer_measured,2,"Late D-dimer testing may indicate suspected thrombosis/DIC/sepsis which can be associated with AKI, but the feature is still only a proxy for suspicion. Not a direct renal biomarker."
0_12h_teg_activated_clotting_time_measured,1,"TEG ACT measurement frequency reflects perioperative coagulation management and transfusion guidance, not renal physiology. In 0–12h it is commonly protocolized after cardiac surgery."
13_24h_teg_activated_clotting_time_measured,1,Ongoing TEG ACT checks suggest continued coagulation management but do not directly predict creatinine rise. As a _measured variable it should remain minimal importance.
25_36h_teg_activated_clotting_time_measured,2,"Late TEG ACT monitoring may indicate persistent bleeding/coagulopathy requiring transfusion/vasoactive support, which can correlate with AKI risk, but remains indirect. Capped due to being a measurement-frequency proxy."
0_12h_percent_immature_granulocyte_mean,1,Immature granulocytes reflect inflammatory/stress response; early post-op elevations are common and nonspecific. Mean value smooths peaks and is less informative than extremes for acute inflammatory insult.
13_24h_percent_immature_granulocyte_mean,2,"Sustained inflammation/infection risk can contribute to AKI via sepsis physiology, but the mean is a diluted signal compared with maxima. Moderately relevant in the trajectory phase but not strong."
0_12h_percent_immature_granulocyte_max,2,"A high peak immature granulocyte percentage may indicate early systemic inflammation or occult infection, which can predispose to AKI, but immediate post-bypass inflammation is common. Max is preferred over mean/min for capturing the insult in this window."
13_24h_percent_immature_granulocyte_max,3,"A rising/peaking immature granulocyte fraction in 13–24h can signal evolving infection/SIRS, which is an established contributor to AKI through vasodilation and microcirculatory dysfunction. Max best captures the inflammatory surge."
0_12h_percent_immature_granulocyte_min,1,The minimum immature granulocyte percentage is not clinically meaningful for AKI risk and does not represent a pathologic trigger. Also redundant given max/mean options.
13_24h_percent_immature_granulocyte_min,1,Low/minimum immature granulocytes do not indicate a mechanism for AKI and add little beyond max/mean. Not a useful predictor compared with inflammatory peaks.
0_12h_percent_immature_granulocyte_measured,1,Measurement frequency reflects clinician concern for infection/inflammation rather than renal physiology. Early post-op ordering is common and not specific for AKI risk.
13_24h_percent_immature_granulocyte_measured,1,Test-order frequency is a behavioral proxy for acuity and is not a direct driver of kidney injury. It is nonspecific for predicting creatinine rise.
25_36h_percent_immature_granulocyte_measured,2,"More frequent monitoring late may indicate evolving sepsis/SIRS, which can contribute to AKI, but it remains an indirect and nonspecific proxy. Not a physiologic biomarker of renal injury."
0_12h_teg_fibrinolysis_measured,1,Whether TEG fibrinolysis was measured mainly reflects bleeding/coagulopathy evaluation rather than renal perfusion. In the immediate post-op window it is not informative for AKI prediction.
13_24h_teg_fibrinolysis_measured,1,Ordering TEG fibrinolysis is a care-process marker for hemostasis management and is not mechanistically linked to AKI. Any association would be indirect via severity of illness.
25_36h_teg_fibrinolysis_measured,2,"Late TEG testing may signal ongoing bleeding/transfusion needs and hemodynamic instability, which can increase AKI risk. Still indirect and not kidney-specific."
0_12h_creatinine_ratio_mean,2,"Early mean creatinine ratio can be influenced by dilution/fluids and perioperative kinetics, making it less specific in 0–12h. Also redundant with extremes that better capture early injury signal."
13_24h_creatinine_ratio_mean,2,Average creatinine ratio over 13–24h smooths important rises and is collinear with max values that better reflect evolving AKI. Provides limited incremental signal versus extremes.
25_36h_creatinine_ratio_mean,2,"Although closer to the outcome, the mean still dilutes clinically meaningful upward excursions; max is the better pathology-capturing aggregation for AKI trajectory. Kept low to reduce collinearity."
0_12h_creatinine_ratio_max,3,An early peak in creatinine ratio may indicate immediate renal insult (CPB-related hypoperfusion/hemolysis) but can be transient and affected by perioperative fluid shifts. Capped by the 0–12h epoch rule.
13_24h_creatinine_ratio_max,4,A rising/peaking creatinine ratio in the trajectory phase is a strong indicator of evolving AKI and predicts continued worsening by 60h. Max captures the clinically relevant deterioration better than mean/min.
25_36h_creatinine_ratio_max,5,A high creatinine ratio peak close to hour 60 is essentially an early biomarker of the same process being predicted (ongoing AKI). It directly reflects impaired renal function and strongly forecasts the 60h ratio.
0_12h_creatinine_ratio_min,1,A low minimum creatinine ratio early is often due to hemodilution and does not represent kidney injury. It is not a trigger or marker for AKI.
13_24h_creatinine_ratio_min,1,Minimum creatinine ratio is generally uninformative for AKI risk and may reflect dilution or lab variability rather than renal dysfunction. Max is the relevant direction for injury.
25_36h_creatinine_ratio_min,1,"Even late, the minimum value does not capture the pathologic rise that defines AKI and is largely redundant/noisy. It is not a meaningful predictor compared with the maximum."
0_12h_creatinine_ratio_measured,2,"More frequent creatinine checks early may reflect clinician concern for renal function or instability, but it is a process-of-care proxy rather than physiology. In 0–12h it is common post-op monitoring and only weakly predictive."
13_24h_creatinine_ratio_measured,2,Measurement frequency reflects clinician concern and monitoring intensity rather than renal physiology. It may weakly proxy evolving AKI suspicion in the trajectory phase but is not a direct predictor.
25_36h_creatinine_ratio_measured,2,"More frequent creatinine checks closer to hour 60 can indicate rising concern for AKI, but it remains a behavioral/acuity marker rather than a physiologic driver. Kept low per _measured rule."
0_12h_x25_percent_albumin_dose_total_12h,2,"Hyperoncotic albumin is often given for hypotension/low oncotic pressure and may correlate with hemodynamic instability, but early post-op use is common and nonspecific. In 0–12h, transient resuscitation limits prognostic specificity."
13_24h_x25_percent_albumin_dose_total_12h,3,"Need for 25% albumin in 13–24h can signal ongoing vasoplegia/capillary leak or low effective circulating volume, which can impair renal perfusion. Still an indirect marker and practice-pattern dependent."
25_36h_x25_percent_albumin_dose_total_12h,3,"Continued 25% albumin requirement at 25–36h suggests persistent intravascular depletion/third spacing or hemodynamic fragility, increasing AKI risk via reduced renal perfusion. It is an indirect severity/resuscitation marker rather than a biomarker."
0_12h_albumin_5_percent_dose_total_12h,2,"5% albumin is a volume expander and may reflect early resuscitation needs, but immediate post-bypass fluid shifts make it nonspecific for later AKI. Primarily an indirect marker of illness/resuscitation intensity."
13_24h_albumin_5_percent_dose_total_12h,3,"Ongoing colloid resuscitation in 13–24h can indicate persistent hypotension/low effective arterial volume, which is a known contributor to AKI risk. Still indirect and influenced by local fluid strategy."
25_36h_albumin_5_percent_dose_total_12h,3,"Requirement for 5% albumin at 25–36h suggests continued hemodynamic/volume issues close to the outcome window, plausibly linking to renal hypoperfusion and AKI. Not a direct renal injury marker."
0_12h_acetaminophen_codeine_dose_total_12h,1,Analgesic use is not a direct driver of AKI in typical dosing; codeine may cause mild hypotension/sedation but is not an established AKI predictor. Early post-op administration is routine.
13_24h_acetaminophen_codeine_dose_total_12h,1,Primarily reflects pain management rather than renal perfusion or nephrotoxicity. Any association with AKI would be weak and confounded by overall care intensity.
25_36h_acetaminophen_codeine_dose_total_12h,1,Not a known nephrotoxin at standard doses and does not directly indicate renal injury. More likely reflects ongoing analgesia needs than AKI risk.
0_12h_acetaminophen_dose_total_12h,1,Acetaminophen is generally kidney-safe at therapeutic doses and is routine post-op. It has no meaningful mechanistic link to AKI prediction here.
13_24h_acetaminophen_dose_total_12h,1,Represents standard analgesia/antipyresis rather than renal physiology. Any relationship to AKI would be minimal and indirect.
25_36h_acetaminophen_dose_total_12h,1,Therapeutic acetaminophen dosing is not an established AKI risk factor and does not serve as a renal biomarker. Likely reflects routine symptom control.
0_12h_allopurinol_dose_total_12h,1,Allopurinol use mainly reflects pre-existing gout/hyperuricemia management and is not a typical acute post-cardiac surgery AKI driver. Early dosing is unlikely to add prognostic value beyond comorbidity.
13_24h_allopurinol_dose_total_12h,1,Continuation of allopurinol is not a direct marker of renal hypoperfusion or tubular injury and is not commonly implicated in perioperative AKI. Any association would be weak and confounded by baseline comorbidity.
25_36h_allopurinol_dose_total_12h,1,Allopurinol use is not a typical perioperative driver of AKI after cardiac surgery and is not a direct marker of renal hypoperfusion or injury. Dose in this window more likely reflects chronic gout management than evolving kidney failure.
0_12h_aminocaproic_acid_dose_total_12h,2,"Aminocaproic acid is used for bleeding control and is not directly nephrotoxic, but may correlate with complex surgery/bleeding and transfusion burden that can increase AKI risk. In the immediate 0–12h period, it is a weak indirect severity marker."
13_24h_aminocaproic_acid_dose_total_12h,2,"Ongoing need for antifibrinolytic can indicate continued bleeding risk or re-exploration concern, indirectly associated with hemodynamic instability and AKI. Still not a direct renal mechanism."
25_36h_aminocaproic_acid_dose_total_12h,2,"Late use may reflect persistent bleeding/ongoing operative complexity, which can contribute to renal hypoperfusion and inflammatory injury. However, the medication itself is not a strong causal predictor of creatinine rise."
0_12h_amiodarone_dose_total_12h,2,"Amiodarone use early post-op is usually for atrial/ventricular arrhythmias and may indirectly signal hemodynamic instability that can reduce renal perfusion. In 0–12h, arrhythmias are common/transient, so prognostic value is limited."
13_24h_amiodarone_dose_total_12h,3,"Need for amiodarone in 13–24h suggests persistent arrhythmia burden and potential low cardiac output episodes, which are established contributors to AKI risk. It remains an indirect marker rather than a renal biomarker."
25_36h_amiodarone_dose_total_12h,3,"Continued amiodarone requirement at 25–36h can indicate ongoing atrial fibrillation/instability and impaired forward flow, increasing risk of renal hypoperfusion and congestion-related AKI. Still not directly measuring kidney injury."
0_12h_amlodipine_dose_total_12h,1,Amlodipine is a chronic antihypertensive and is rarely a key determinant of early post-cardiac surgery AKI. Administration in 0–12h is uncommon and not a direct indicator of renal injury.
13_24h_amlodipine_dose_total_12h,1,Resumption of amlodipine generally reflects routine blood pressure management rather than evolving renal dysfunction. It has minimal direct relationship to postoperative creatinine rise.
25_36h_amlodipine_dose_total_12h,1,Amlodipine use in this later window is still mainly maintenance antihypertensive therapy and not a recognized predictor of AKI trajectory. Any association would be weak and confounded by overall stability.
0_12h_ampicillin_dose_total_12h,1,"Ampicillin is not typically nephrotoxic and perioperative antibiotics are standard-of-care, offering little specific signal for AKI risk. Early administration mainly reflects prophylaxis or infection coverage."
13_24h_ampicillin_dose_total_12h,2,"Continuation may indicate suspected infection, which can contribute to AKI via inflammation and hypotension, but the drug itself is not a strong renal toxin. Thus it is an indirect acuity marker."
25_36h_ampicillin_dose_total_12h,2,"Ongoing antibiotics at 25–36h can reflect infection concern/sepsis risk, which is associated with AKI. Ampicillin itself has low nephrotoxicity, so predictive value is mostly indirect."
0_12h_angiotensin_ii_dose_total_12h,3,"Angiotensin II use indicates vasodilatory shock requiring high-level vasopressor support, a known context for renal hypoperfusion and AKI. In 0–12h, shock can be transient post-bypass, so cap at moderate importance."
13_24h_angiotensin_ii_dose_total_12h,4,"Requirement for angiotensin II in 13–24h suggests persistent vasoplegia/shock and high vasopressor burden, strongly linked to subsequent AKI. This reflects ongoing hemodynamic failure rather than routine care."
25_36h_angiotensin_ii_dose_total_12h,5,"Angiotensin II use at 25–36h is a leading indicator of refractory shock/vasoplegia close to the outcome window, a major driver of ischemic tubular injury and creatinine rise. It is a strong proxy for severe hemodynamic collapse with high AKI risk."
0_12h_apixaban_dose_total_12h,1,Apixaban is not directly nephrotoxic and early post-op dosing mainly reflects anticoagulation strategy rather than renal perfusion. Any association with creatinine rise would be indirect (bleeding/hemodynamics) and weak in this immediate 0–12h window.
13_24h_apixaban_dose_total_12h,2,Ongoing apixaban use may proxy atrial fibrillation or thromboembolic risk and could relate indirectly to bleeding/transfusion needs that affect renal perfusion. It is not an established direct predictor of AKI.
25_36h_apixaban_dose_total_12h,2,"Later apixaban dosing can reflect clinical stability and anticoagulation decisions, with only indirect links to AKI via bleeding or hemodynamic consequences. No direct renal injury mechanism is expected."
0_12h_aspirin_dose_total_12h,1,Aspirin at typical post-cardiac surgery doses is not a primary driver of AKI and is usually routine care. In the immediate 0–12h period it provides little specific prognostic information for creatinine rise.
13_24h_aspirin_dose_total_12h,1,Continued aspirin is standard post-op antiplatelet therapy and has minimal direct impact on renal function at usual doses. Any AKI association would be weak and confounded by overall illness severity.
25_36h_aspirin_dose_total_12h,1,Aspirin dosing in this window is largely protocol-driven and not a sensitive marker of renal hypoperfusion or tubular injury. It is unlikely to add meaningful predictive signal for creatinine_ratio.
0_12h_atorvastatin_dose_total_12h,1,"Statins are not typical precipitants of AKI in the perioperative ICU setting and are often continued as routine therapy. Rare rhabdomyolysis-related AKI is unlikely to be captured by dose alone, especially early."
13_24h_atorvastatin_dose_total_12h,1,Atorvastatin continuation mainly reflects baseline cardiovascular management rather than evolving renal physiology. It has no strong direct relationship to postoperative creatinine rise.
25_36h_atorvastatin_dose_total_12h,1,"Later statin dosing remains a routine medication signal with minimal mechanistic link to AKI. Any association would be indirect and weak compared with hemodynamics, fluids, and renal labs."
0_12h_bisacodyl_dose_total_12h,1,Bisacodyl use reflects bowel regimen practices and does not meaningfully affect renal perfusion or tubular injury. It is not a plausible predictor of creatinine_ratio.
13_24h_bisacodyl_dose_total_12h,1,Bowel regimen administration is largely unrelated to AKI pathophysiology. It provides little to no prognostic information for postoperative creatinine changes.
25_36h_bisacodyl_dose_total_12h,1,Bisacodyl remains a non-specific care marker without a direct renal mechanism. Any correlation with AKI would be incidental.
0_12h_bivalirudin_dose_total_12h,2,"Bivalirudin use early post-op may indicate HIT concern or complex anticoagulation needs, which can correlate with higher acuity and bleeding risk affecting renal perfusion. It is not directly nephrotoxic, and 0–12h scoring is capped conservatively."
