value,importance,reason
0_12h_r_oxygen_device_none_measured,1,Measurement frequency for 'no oxygen device' in 0–12h is primarily documentation/monitoring behavior. It is not a physiologic biomarker and is unlikely to add unique predictive value for creatinine ratio.
13_24h_r_oxygen_device_none_measured,1,How often 'no oxygen device' is recorded in 13–24h mainly reflects charting patterns and care intensity. As a proxy variable it is weak and dominated by actual device status features.
25_36h_r_oxygen_device_none_measured,2,"Documentation frequency of no-device status at 25–36h may weakly reflect stability vs frequent reassessment, but remains largely a clinician-behavior proxy. Slightly more temporally relevant, yet still low priority for sparse selection."
0_12h_r_oxygen_device_low_flow_mean,2,Mean time on low-flow oxygen in the first 12h reflects early respiratory support needs after surgery. This is an indirect illness-severity marker and early-window noise limits its unique value for predicting 60h creatinine ratio.
13_24h_r_oxygen_device_low_flow_mean,2,Represents average use of low-flow oxygen in the 13–24h window (a respiratory support/trajectory marker). It is an indirect illness-severity proxy for AKI risk and is likely redundant with the later 25–36h oxygen-support features.
25_36h_r_oxygen_device_low_flow_mean,3,"Represents average low-flow oxygen use in the 25–36h window, closer to the Hour-60 creatinine outcome. Still indirect for renal dysfunction, but timing makes it a better sparse-model candidate than earlier windows as a marker of ongoing cardiopulmonary instability."
0_12h_r_oxygen_device_low_flow_max,1,"Indicates whether low-flow oxygen was used at any point in the immediate 0–12h post-op period. This is early, noisy, and largely reflects routine post-extubation care rather than a unique renal hypoperfusion signal."
13_24h_r_oxygen_device_low_flow_max,2,"Indicates any low-flow oxygen use during 13–24h. It is a weak, indirect severity marker and is dominated by the more proximal 25–36h oxygen-support indicators for sparse selection."
25_36h_r_oxygen_device_low_flow_max,3,"Indicates any low-flow oxygen use during 25–36h, capturing persistent need for supplemental oxygen near the prediction horizon. While still a proxy, it may add some unique information about ongoing instability compared with earlier epochs."
0_12h_r_oxygen_device_low_flow_min,1,Binary minimum for low-flow oxygen in 0–12h effectively reflects whether there was any time without low-flow oxygen (often routine transitions). It is poorly specific for renal risk and redundant with other low-flow indicators.
13_24h_r_oxygen_device_low_flow_min,1,Binary minimum for low-flow oxygen in 13–24h is hard to interpret clinically and mostly reflects device switching patterns. It is unlikely to survive sparse selection given redundancy and weak linkage to AKI physiology.
25_36h_r_oxygen_device_low_flow_min,2,Binary minimum for low-flow oxygen in 25–36h may weakly indicate continuous oxygen requirement vs intermittent weaning. Still largely a care-pattern proxy and less informative than a direct marker like high-flow use.
0_12h_r_oxygen_device_low_flow_measured,1,"Counts/reflects frequency of documenting low-flow oxygen in 0–12h, mainly a monitoring/workflow intensity proxy. Early post-op documentation frequency is unlikely to add unique predictive value for Hour-60 creatinine ratio."
13_24h_r_oxygen_device_low_flow_measured,1,"Measurement frequency of low-flow oxygen in 13–24h primarily reflects charting intensity and clinician attention. This is indirect and typically dominated by actual support level (e.g., high-flow use) and more proximal physiology."
25_36h_r_oxygen_device_low_flow_measured,2,Measurement frequency of low-flow oxygen in 25–36h may weakly proxy ongoing respiratory management complexity near the outcome window. Still a clinician-behavior/monitoring proxy and generally low priority for sparse selection.
0_12h_r_oxygen_device_high_flow_mean,2,"Represents high-flow oxygen use in 0–12h, suggesting early respiratory compromise. However, the immediate post-op period is noisy and this remains an indirect severity marker for AKI risk."
13_24h_r_oxygen_device_high_flow_mean,3,"Represents high-flow oxygen use in 13–24h, indicating more significant respiratory support needs beyond the immediate post-op phase. It can proxy persistent cardiopulmonary dysfunction that correlates with AKI risk, though still indirect."
25_36h_r_oxygen_device_high_flow_mean,4,"Represents high-flow oxygen use in 25–36h, a strong marker of ongoing respiratory failure/instability close to the Hour-60 creatinine outcome. Within this batch it is one of the most informative severity signals and less redundant than low-flow indicators."
0_12h_r_oxygen_device_high_flow_max,2,"Indicates any high-flow oxygen use in 0–12h, capturing an early extreme of respiratory support. Timing limits reliability for Hour-60 creatinine prediction and it is likely superseded by later high-flow features."
13_24h_r_oxygen_device_high_flow_max,3,"Indicates any high-flow oxygen use in 13–24h, capturing an extreme support requirement beyond immediate post-op noise. It is a reasonable sparse-model candidate but still somewhat redundant with the 25–36h high-flow mean as the more proximal summary."
25_36h_r_oxygen_device_high_flow_max,2,"Represents whether high-flow oxygen was used in the 25–36h window (max over the window). It is a late marker of respiratory support/illness severity that may correlate with AKI risk, but is indirect and likely dominated by hemodynamics/renal-specific features in a sparse model."
0_12h_r_oxygen_device_high_flow_min,1,"Indicates high-flow oxygen use early (0–12h) using the minimum over the window. Early post-op oxygen device status is noisy and indirect for renal outcomes, and the 'min' aggregation is not very informative for a binary exposure."
13_24h_r_oxygen_device_high_flow_min,1,Indicates high-flow oxygen use in 13–24h using the minimum over the window. Still an indirect severity proxy and the 'min' version is redundant/less informative than later or 'max' exposure summaries for sparse selection.
25_36h_r_oxygen_device_high_flow_min,1,"Indicates high-flow oxygen use in 25–36h using the minimum over the window. Redundant with the 25–36h max indicator and less likely to capture clinically meaningful exposure, so low priority for a sparse model."
0_12h_r_oxygen_device_high_flow_measured,1,Counts/reflects how often high-flow oxygen device status was recorded in 0–12h. This is primarily a monitoring/workflow proxy rather than physiology and is unlikely to add unique predictive value for creatinine ratio.
13_24h_r_oxygen_device_high_flow_measured,1,"Measurement frequency of high-flow oxygen device status in 13–24h. Mostly reflects documentation intensity/acuity rather than a direct renal signal, so it is a weak sparse-model candidate."
25_36h_r_oxygen_device_high_flow_measured,1,"Measurement frequency of high-flow oxygen device status in 25–36h. Despite being closer to the outcome, it remains a clinician-behavior proxy and is redundant with the actual high-flow use indicators."
0_12h_r_heart_block_type_degree_1_measured,1,"Frequency of documentation of first-degree AV block in 0–12h. This is a monitoring/ECG-label proxy with weak and indirect linkage to renal dysfunction, especially in the immediate post-op noise window."
13_24h_r_heart_block_type_degree_1_measured,1,Frequency of documentation of first-degree AV block in 13–24h. Still largely a documentation proxy and unlikely to survive sparse selection versus direct perfusion/renal markers.
25_36h_r_heart_block_type_degree_1_measured,1,"Frequency of documentation of first-degree AV block in 25–36h. Even though later, it remains indirect and redundant with more informative hemodynamic/arrhythmia burden variables (if present), so low priority."
0_12h_r_heart_block_type_degree_23_measured,2,"Frequency of documentation of higher-grade (2nd/3rd degree) AV block in 0–12h. High-grade block can imply low cardiac output and renal hypoperfusion risk, but 'measured' is a proxy and early timing is noisy, limiting sparse-model value."
13_24h_r_heart_block_type_degree_23_measured,2,"Frequency of documentation of higher-grade AV block in 13–24h. Potentially reflects clinically significant conduction issues affecting perfusion, but as a measurement-frequency proxy it is still indirect and likely dominated by direct hemodynamic/vasopressor features."
25_36h_r_heart_block_type_degree_23_measured,3,"Frequency of documentation of higher-grade AV block in 25–36h. This later window is closer to Hour 60 and may capture persistent conduction-related low output risk, but it remains a proxy measure and thus only moderately competitive for sparse selection."
0_12h_r_heart_block_type_bundle_branch_block_measured,1,Frequency of documentation of bundle branch block in 0–12h. BBB is often chronic or perioperative and not tightly linked to evolving AKI; 'measured' further makes it a documentation proxy with low unique predictive value.
13_24h_r_heart_block_type_bundle_branch_block_measured,1,"Frequency of documentation of bundle branch block in 13–24h. Mostly reflects ECG labeling/monitoring rather than a direct renal or perfusion insult signal, so low priority in a sparse model."
25_36h_r_heart_block_type_bundle_branch_block_measured,1,"Frequency of documentation of bundle branch block in 25–36h. Even in the later window it is typically nonspecific and proxy-heavy, and is unlikely to add unique predictive value for creatinine ratio."
0_12h_ionized_calcium_mean,2,Average ionized calcium in the immediate post-op window reflects transfusion/citrate load and replacement practices more than evolving renal dysfunction. Likely noisy early and dominated by later/min-extreme summaries for sparse selection.
13_24h_ionized_calcium_mean,2,"Mean ionized calcium during 13–24h may reflect ongoing critical illness and supplementation but is an indirect AKI signal. Somewhat more stable than 0–12h, yet still redundant with min/max and later epoch values."
25_36h_ionized_calcium_mean,3,"Mean ionized calcium at 25–36h is closer to the outcome and may capture sustained metabolic derangements associated with organ dysfunction. Still indirect for kidney injury and typically less informative than extremes, so moderate priority."
0_12h_ionized_calcium_max,1,"Peak ionized calcium in 0–12h is often driven by bolus calcium administration during/after bypass rather than renal physiology. Early and treatment-confounded, so low unique value for predicting 60h creatinine ratio."
13_24h_ionized_calcium_max,2,"Maximum ionized calcium in 13–24h can reflect replacement intensity and acid-base shifts, but it is not a direct renal marker. Likely redundant with other calcium summaries and weaker than hypocalcemia (min) as a stress signal."
25_36h_ionized_calcium_max,2,"Maximum ionized calcium at 25–36h is closer in time but still heavily influenced by clinician-driven supplementation. Provides limited unique information about impending AKI compared with hemodynamics/renal labs, so low-moderate priority."
0_12h_ionized_calcium_min,2,"Minimum ionized calcium early post-op may indicate citrate load, hemodilution, or severe illness, which can correlate with complications. However it is early and nonspecific, so unlikely to survive sparse selection if stronger renal/hypoperfusion features exist."
13_24h_ionized_calcium_min,3,"Minimum ionized calcium in 13–24h can capture persistent hypocalcemia associated with ongoing transfusion, inflammation, or organ dysfunction. More informative than mean/max and less confounded by immediate bypass effects, giving moderate sparse-model value."
25_36h_ionized_calcium_min,3,"Minimum ionized calcium at 25–36h is the most temporally proximate extreme and may reflect sustained physiologic stress linked to worse trajectories. Still an indirect AKI predictor and partly treatment-related, so moderate rather than high priority."
0_12h_ionized_calcium_measured,1,"Count/frequency of ionized calcium measurements in 0–12h is primarily a monitoring-intensity/complexity proxy. Early post-op protocols drive testing, so it adds little unique predictive signal."
13_24h_ionized_calcium_measured,1,Measurement frequency of ionized calcium in 13–24h reflects clinician concern and care patterns more than physiology. As a proxy variable it is unlikely to be retained in a sparse linear model.
25_36h_ionized_calcium_measured,2,"More frequent ionized calcium checks at 25–36h may indicate ongoing instability or transfusion needs, which can correlate with AKI risk. Still a behavior/monitoring proxy, so only slight priority."
0_12h_magnesium_mean,2,Average magnesium in 0–12h is influenced by perioperative replacement and dilutional effects and is not a direct renal function marker. Early timing and treatment confounding limit sparse-model usefulness.
13_24h_magnesium_mean,2,"Mean magnesium at 13–24h may reflect renal handling and supplementation but remains a weak, indirect AKI signal. Likely redundant with later magnesium summaries or more kidney-specific variables."
25_36h_magnesium_mean,3,"Mean magnesium at 25–36h is closer to the outcome and can reflect reduced renal clearance or ongoing replacement needs. Still nonspecific and treatment-influenced, but may add modest unique value if few renal markers are available."
0_12h_magnesium_max,1,"Peak magnesium in 0–12h is commonly driven by intra/post-op magnesium administration rather than evolving kidney dysfunction. Early and highly confounded, so very low sparse-selection priority."
13_24h_magnesium_max,2,Peak magnesium reflects supplementation/renal handling but is usually driven by replacement protocols rather than evolving AKI. Adds limited unique value versus stronger renal perfusion/acid–base signals and is not the closest window.
25_36h_magnesium_max,2,Later peak magnesium may weakly reflect reduced renal clearance or aggressive repletion. Still largely treatment-driven and typically redundant/low-signal for predicting creatinine ratio compared with hemodynamic/acid–base extremes.
0_12h_magnesium_min,1,Early low magnesium is common post-bypass/hemodilution and is rapidly corrected. High noise and weak mechanistic link to Hour-60 creatinine makes it a poor sparse-model candidate.
13_24h_magnesium_min,2,"Low magnesium can reflect ongoing losses or inadequate repletion, but is not a direct kidney injury marker. Some signal possible, yet likely dominated by more proximal perfusion/acid–base features."
25_36h_magnesium_min,2,"Later low magnesium may indicate persistent instability or diuretic effect, indirectly correlating with illness severity. Still not kidney-specific and often clinician-management dependent, limiting sparse selection priority."
0_12h_magnesium_measured,1,Measurement count mainly reflects monitoring intensity and routine post-op lab schedules. It is a clinician-behavior proxy with little direct physiologic information for AKI prediction.
13_24h_magnesium_measured,1,Frequency of magnesium checks is largely protocol/acuity driven rather than a renal biomarker. Unlikely to survive sparse selection when physiologic variables are available.
25_36h_magnesium_measured,1,Later measurement frequency remains a proxy for care intensity or electrolyte replacement practices. Provides minimal unique predictive value for creatinine ratio.
0_12h_base_excess_mean,2,"Average base excess reflects overall metabolic acid–base status and can correlate with shock/hypoperfusion. In the immediate post-op window it is noisy and the mean smooths short insults, reducing sparse-model value."
13_24h_base_excess_mean,3,"Mean base excess in 13–24h captures sustained metabolic acidosis/alkalosis, which can track ongoing hypoperfusion and AKI risk. Moderately useful but likely less informative than the corresponding minimum (worst acidosis)."
25_36h_base_excess_mean,3,"Closest-window mean base excess reflects persistent metabolic derangement near the prediction horizon. Useful as a trajectory marker, though still somewhat diluted compared with extreme (min) values for detecting acute hypoperfusion."
0_12h_base_excess_max,1,Maximum base excess (most alkalotic) early post-op often reflects ventilation/bicarbonate administration rather than renal hypoperfusion. Low specificity and early timing make it weak for sparse selection.
13_24h_base_excess_max,1,Higher (alkalotic) base excess is typically treatment/ventilation related and not a strong AKI precursor. Adds little unique predictive value versus acidosis-focused extremes.
25_36h_base_excess_max,2,"Later alkalosis may reflect diuresis/contraction or bicarbonate therapy and is only indirectly related to renal outcomes. Slightly more relevant due to timing, but still dominated by minimum base excess for AKI risk."
0_12h_base_excess_min,3,"Worst early metabolic acidosis can indicate hypoperfusion/lactate burden, a plausible AKI precursor. However, immediate post-op physiology is noisy, so it is less reliable than later-window extremes."
13_24h_base_excess_min,4,"Minimum base excess captures the worst metabolic acidosis in a more stable post-op period, reflecting ongoing hypoperfusion/shock physiology linked to AKI. Strong extreme-based signal with good sparse-model priority within this batch."
25_36h_base_excess_min,4,"Minimum base excess in the 25–36h window captures the worst metabolic acidosis, often reflecting hypoperfusion/shock that can precede AKI. Among base-excess variants here, this extreme and closest-timed summary is the most likely to add unique predictive value for Hour-60 creatinine rise."
0_12h_base_excess_measured,1,Count/frequency of base excess measurements in 0–12h is mainly a monitoring-intensity/clinician-concern proxy rather than physiology. Early post-op measurement frequency is noisy and unlikely to survive sparse selection.
13_24h_base_excess_measured,1,"Base excess measurement frequency in 13–24h reflects care intensity and instability rather than a direct renal signal. It is dominated by actual base-excess values (e.g., min) and is a weak sparse-model candidate."
25_36h_base_excess_measured,2,Base excess measurement frequency in 25–36h may weakly proxy ongoing metabolic derangement/ICU complexity closer to the target time. Still largely a clinician-behavior signal and redundant with the base-excess extreme itself.
0_12h_direct_bilirubin_measured,1,Direct bilirubin measurement frequency in 0–12h is primarily a proxy for monitoring/liver concern rather than kidney physiology. Early post-op ordering patterns add little unique value for predicting creatinine ratio.
13_24h_direct_bilirubin_measured,1,"Direct bilirubin measurement frequency in 13–24h reflects clinician suspicion of cholestasis/hemolysis or illness complexity, not a direct AKI precursor. Unlikely to be retained in a sparse linear model."
25_36h_direct_bilirubin_measured,2,"Direct bilirubin measurement frequency in 25–36h may indicate ongoing multi-organ dysfunction workup closer to Hour 60. Still indirect and behavior-driven, so only a low-priority sparse feature."
0_12h_wbc_mean,1,Mean WBC in 0–12h reflects early inflammatory/stress response after surgery and is often nonspecific. It is likely noisy and dominated by later windows and/or extremes.
13_24h_wbc_mean,2,"Mean WBC in 13–24h may capture evolving inflammation/infection risk that can contribute to AKI, but it is indirect. As a mean, it is also less sensitive than extremes and may be redundant with later WBC summaries."
25_36h_wbc_mean,3,"Mean WBC in 25–36h is closer to the outcome and may reflect sustained systemic inflammation/sepsis physiology that can worsen renal function. Still indirect for AKI, but the timing makes it a moderate sparse-model candidate among WBC features."
0_12h_wbc_max,1,Peak WBC in 0–12h is heavily influenced by immediate post-bypass stress and steroids and is nonspecific. Early extremes are less reliable for Hour-60 creatinine prediction and redundant with later WBC signals.
13_24h_wbc_max,2,"Peak WBC in 13–24h can flag stronger inflammatory response than the mean, but remains an indirect AKI predictor. It is likely dominated by the closest (25–36h) WBC extreme/trajectory."
25_36h_wbc_max,3,"Peak WBC in 25–36h captures the strongest inflammatory signal closest to the target and may correlate with infection/sepsis-related AKI risk. It can add value beyond the mean, though still a nonspecific severity marker."
0_12h_wbc_min,1,Minimum WBC in 0–12h is usually not a meaningful renal precursor and may reflect dilutional effects or lab variability early post-op. Low unique predictive value and likely redundant.
13_24h_wbc_min,1,Minimum WBC in 13–24h is generally less informative than max/mean for inflammatory burden and AKI risk. It is unlikely to survive sparse selection given indirectness and redundancy.
25_36h_wbc_min,2,"Minimum WBC in 25–36h could weakly reflect immunosuppression/hemodilution or marrow suppression in sicker patients, but it is not a direct AKI signal. Lower priority than WBC max/mean in the same window."
0_12h_wbc_measured,1,"Count of WBC lab draws in the first 12h is mainly a monitoring-intensity/acuity proxy. Weak direct linkage to AKI and dominated by physiologic/hemodynamic and renal markers, so low sparse-selection priority."
13_24h_wbc_measured,1,Frequency of WBC checks in 13–24h reflects clinician concern rather than kidney physiology. Adds little unique predictive value for Hour-60 creatinine ratio in a sparse model.
25_36h_wbc_measured,2,"Later (25–36h) WBC measurement frequency may better capture evolving complications prompting closer monitoring. Still a proxy variable and likely redundant with actual severity signals, so only modest value."
0_12h_prothrombin_time_mean,2,"Mean PT in 0–12h reflects early coagulopathy/hepatic dysfunction or dilutional effects post-bypass. Early window is noisy and mean blunts extremes, so it is a weak, indirect AKI predictor."
25_36h_prothrombin_time_mean,3,Mean PT at 25–36h captures more persistent coagulopathy/critical illness closer to the outcome window. Indirect for renal injury but may add some unique signal about ongoing organ dysfunction.
0_12h_prothrombin_time_max,2,"Peak PT in 0–12h captures worst early coagulopathy, which can correlate with shock/transfusion burden. However it is temporally early and often transient, limiting sparse-model priority."
25_36h_prothrombin_time_max,4,"Peak PT at 25–36h reflects the most severe ongoing coagulopathy near-term, often tracking persistent illness severity, bleeding/transfusion, or hepatic hypoperfusion that can precede AKI. Among PT summaries, this extreme and later epoch is the most informative and least redundant."
0_12h_prothrombin_time_min,1,Minimum PT in 0–12h is typically near-normal and not a plausible driver of renal dysfunction. Provides little incremental information versus max/mean and is likely noise.
25_36h_prothrombin_time_min,1,"Minimum PT in 25–36h mainly reflects best values rather than insult severity. Dominated by PT_max/mean for capturing pathologic signal, so low priority."
0_12h_prothrombin_time_measured,1,"Number of PT measurements in 0–12h is a clinician-behavior/monitoring proxy (bleeding concern, anticoagulation management). Not a direct renal signal and unlikely to survive sparse selection."
13_24h_prothrombin_time_measured,1,PT measurement frequency in 13–24h reflects care intensity rather than physiology. Adds minimal unique predictive value beyond actual PT values and other severity markers.
25_36h_prothrombin_time_measured,2,"More frequent PT checks at 25–36h may indicate ongoing bleeding/coagulopathy management and higher complexity closer to outcome. Still a proxy and generally redundant with PT_max itself, so modest score."
0_12h_nucleated_red_blood_cells_mean,2,"Mean NRBCs in 0–12h can indicate severe physiologic stress/hypoxemia or marrow response, sometimes associated with worse outcomes. Early timing and indirectness to kidney injury limit sparse-model value."
13_24h_nucleated_red_blood_cells_mean,2,NRBC mean in 13–24h reflects ongoing stress/critical illness rather than a renal-specific pathway. Potentially prognostic but likely dominated by more direct perfusion/renal markers.
25_36h_nucleated_red_blood_cells_mean,3,NRBC mean at 25–36h suggests persistent severe illness/hypoxemia closer to the creatinine outcome window. Indirect but may add unique prognostic signal in a sparse model if other severity markers are absent.
0_12h_nucleated_red_blood_cells_max,2,"Peak NRBCs in 0–12h captures an extreme stress signal, but it is early and may reflect transient peri-bypass effects. Less likely to add unique predictive value compared with later-epoch severity indicators."
13_24h_nucleated_red_blood_cells_max,2,"Peak nucleated RBCs reflect physiologic stress/inflammation or marrow response after major surgery. It is an indirect, non-renal marker and likely redundant with stronger severity/hemodynamic signals, so low sparse-selection priority."
25_36h_nucleated_red_blood_cells_max,2,"Later peak nucleated RBCs may indicate ongoing critical illness or hypoxemic/inflammatory stress closer to the outcome window. Still a weak, indirect proxy for AKI risk and unlikely to add unique value in a sparse linear model."
0_12h_nucleated_red_blood_cells_min,1,Minimum nucleated RBCs in the immediate post-op window is largely uninformative and often near zero. Early values are noisy and this aggregation is dominated by max/trajectory or other severity markers.
13_24h_nucleated_red_blood_cells_min,1,Minimum nucleated RBCs mainly reflects absence of the signal rather than injury burden. It is indirect for renal dysfunction and redundant with max measures if any NRBC signal matters.
