value,importance,reason
13_24h_magnesium_max,2,"Hypermagnesemia can reflect reduced renal clearance or heavy supplementation, but it is not a primary AKI driver. Use max over mean to capture impaired clearance; capped to limit collinearity."
25_36h_magnesium_max,3,Rising/max magnesium closer to outcome can indicate declining GFR (reduced excretion) and is a plausible early signal of evolving AKI. Still indirect and often confounded by replacement protocols.
0_12h_magnesium_min,2,Low magnesium early post-op is common from hemodilution/CPB and replacement practices and is not a direct AKI predictor. Early epoch capped (max 3) and min is only an indirect severity marker.
13_24h_magnesium_min,2,Hypomagnesemia may correlate with illness severity/diuretic use but does not directly predict creatinine rise. Min chosen as the more pathologic extreme but remains indirect.
25_36h_magnesium_min,2,Low magnesium in this window more often reflects ongoing diuresis or inadequate repletion than kidney injury itself. Weak/indirect relationship to creatinine_ratio.
0_12h_magnesium_measured,1,Measurement frequency mainly reflects routine ICU electrolyte monitoring and ordering behavior rather than renal physiology. Early post-op labs are commonly scheduled regardless of AKI risk.
13_24h_magnesium_measured,1,Number of magnesium checks is largely protocolized and a weak proxy for acuity. Not a mechanistic predictor of AKI.
25_36h_magnesium_measured,2,"More frequent magnesium checks may reflect clinician concern for instability/renal dysfunction or aggressive replacement, but remains a behavioral proxy. Kept low per measured-feature rule."
0_12h_base_excess_mean,2,Average base excess in the immediate post-op period is heavily influenced by transient CPB/anesthesia effects and resuscitation. Mean smooths extremes that better capture hypoperfusion-related AKI risk.
13_24h_base_excess_mean,2,"Sustained metabolic acidosis can relate to shock and renal hypoperfusion, but mean dilutes clinically important nadirs. Trajectory phase also reduces prognostic weight versus later window."
25_36h_base_excess_mean,3,"Persistently negative base excess closer to hour 60 suggests ongoing metabolic acidosis from hypoperfusion/lactate or renal acid retention, both associated with AKI risk. Mean is still less specific than the minimum."
0_12h_base_excess_max,1,High/positive base excess (metabolic alkalosis) is not a typical trigger for AKI and often reflects bicarbonate administration or ventilation changes. Early epoch further limits relevance.
13_24h_base_excess_max,1,Positive base excess is generally not a direct marker of renal hypoperfusion or tubular injury. Limited predictive value for creatinine rise.
25_36h_base_excess_max,1,Metabolic alkalosis is usually treatment-related (diuretics/bicarbonate) and not a strong AKI predictor compared with acidemia. Max provides little pathologic signal for renal injury.
0_12h_base_excess_min,3,"A low (more negative) base excess captures acute metabolic acidosis from hypoperfusion/shock, a known contributor to AKI, but early post-op derangements are often transient. Capped at 3 due to 0–12h rule."
13_24h_base_excess_min,4,"More negative base excess in 13–24h suggests persistent metabolic acidosis and ongoing hypoperfusion/low-flow state, strongly linked to subsequent AKI. Minimum is the most informative aggregation for this pathology."
25_36h_base_excess_min,4,A very negative base excess near 36h reflects significant metabolic acidosis (often from hypoperfusion/lactic acidosis) which is strongly associated with renal ischemia and subsequent AKI. The minimum captures the worst insult and is more prognostic than the mean.
0_12h_base_excess_measured,1,Measurement frequency mainly reflects ordering behavior in the immediate post-op period and is not a direct physiologic driver of AKI. Early post-CPB ABG/VBG checks are routine.
13_24h_base_excess_measured,1,Count of base excess measurements is a care-intensity proxy rather than a mechanism for kidney injury. In this epoch it may reflect instability but remains nonspecific.
25_36h_base_excess_measured,2,"More frequent acid-base checks late (25–36h) can indicate clinician concern for ongoing shock/poor perfusion, which correlates with AKI risk. Still, it is indirect and behavioral rather than physiologic."
0_12h_direct_bilirubin_measured,1,Direct bilirubin measurement frequency is largely driven by routine post-op labs and does not directly reflect renal perfusion or tubular injury. Early ordering is common and nonspecific.
13_24h_direct_bilirubin_measured,1,This is an ordering-frequency feature and only weakly reflects evolving hepatic dysfunction/hemolysis. It is not a primary predictor of creatinine rise.
25_36h_direct_bilirubin_measured,2,"Late repeated bilirubin checks may signal concern for cholestasis/low-flow state or hemolysis, which can co-occur with AKI in critically ill post-cardiac surgery patients. Still indirect and nonspecific."
0_12h_wbc_mean,2,"Average WBC in the first 12h is heavily influenced by surgical stress response and steroids, making it a weak and nonspecific AKI predictor. Mean also smooths extremes that would better capture acute inflammatory insult."
13_24h_wbc_mean,2,"Persistently elevated mean WBC may reflect ongoing inflammation/infection that can contribute to AKI, but it is indirect and nonspecific. Mean is less informative than extremes for acute deterioration."
25_36h_wbc_mean,3,"Sustained leukocytosis by 25–36h can indicate evolving infection/SIRS, which increases AKI risk via inflammatory and hemodynamic pathways. Still indirect and less specific than hemodynamic/renal biomarkers."
0_12h_wbc_max,3,"A high peak WBC early can reflect a strong inflammatory response (or early infection) associated with AKI risk, though immediate post-op leukocytosis is common. Max captures the acute extreme better than mean in this window (capped by 0–12h rule)."
13_24h_wbc_max,3,"A high WBC peak in the trajectory phase suggests persistent inflammation or infection, which is associated with AKI through cytokine-mediated injury and hemodynamic effects. Max is more informative than mean for acute worsening."
25_36h_wbc_max,4,"A very high WBC peak close to the outcome window can indicate sepsis/SIRS, a strong clinical driver of AKI via shock, microvascular dysfunction, and nephrotoxic exposures. Max captures the most pathologic inflammatory burden."
0_12h_wbc_min,2,Low WBC early may reflect hemodilution or transient leukopenia and is not a typical direct AKI driver in this setting. The immediate post-op period is noisy and nonspecific.
13_24h_wbc_min,2,"Leukopenia can be a marker of severe infection or bone marrow suppression, which may correlate with critical illness and AKI, but it is indirect. Minimum WBC is less consistently predictive than high peaks."
25_36h_wbc_min,3,"Leukopenia by 25–36h can signal severe sepsis or profound physiologic stress, conditions that strongly predispose to AKI. It remains an indirect marker compared with direct renal/hemodynamic variables."
0_12h_wbc_measured,1,Measurement frequency mainly reflects clinician monitoring intensity rather than a renal mechanism. Early post-op labs are routine and weakly specific for AKI risk.
13_24h_wbc_measured,1,Ordering frequency is a behavioral proxy for acuity and is not a direct driver of AKI. Still largely routine in the first post-op day.
25_36h_wbc_measured,2,"More frequent WBC checks may reflect evolving infection/SIRS, which can contribute to AKI risk, but it remains an indirect, non-physiologic proxy."
0_12h_prothrombin_time_mean,2,"Coagulopathy can correlate with hepatic dysfunction/bleeding/transfusion and overall severity, indirectly affecting renal perfusion. In the immediate 0–12h window it is often transient post-CPB, so prognostic value is limited."
25_36h_prothrombin_time_mean,2,"Sustained elevation may indicate ongoing illness (hepatic congestion, shock, anticoagulation effects) associated with AKI, but mean is less informative than extremes for acute insults."
0_12h_prothrombin_time_max,3,"A high PT early can signal significant coagulopathy/bleeding risk and potential hypoperfusion/transfusion burden, which are established AKI risk factors. Capped by the 0–12h epoch where abnormalities are common post-bypass."
25_36h_prothrombin_time_max,3,"A late high PT suggests persistent coagulopathy/critical illness and possible ongoing bleeding or hepatic dysfunction, which can worsen renal perfusion. Max captures the worst derangement better than mean/min for AKI-relevant severity."
0_12h_prothrombin_time_min,1,Low/normal PT is not a plausible trigger for AKI and is generally not pathologic. The minimum adds little beyond redundancy with other PT summaries.
25_36h_prothrombin_time_min,1,A low/normal PT does not indicate renal injury risk and is not mechanistically linked to AKI. Minimum is unlikely to capture relevant pathology compared with elevated PT extremes.
0_12h_prothrombin_time_measured,1,PT measurement frequency reflects monitoring/anticoagulation management rather than kidney physiology. In the immediate post-op period it is routine and weakly predictive of AKI.
13_24h_prothrombin_time_measured,1,Ordering frequency is a nonspecific proxy for acuity and anticoagulation/bleeding surveillance. It does not directly capture renal hypoperfusion or tubular injury.
25_36h_prothrombin_time_measured,2,"More frequent PT checks late may indicate ongoing bleeding, liver dysfunction, or anticoagulation complexity associated with higher illness severity and AKI risk, but remains indirect."
0_12h_nucleated_red_blood_cells_mean,2,"NRBCs can reflect hypoxemia, inflammation, or severe physiologic stress, which are indirectly associated with AKI. Mean in 0–12h is less specific and often influenced by perioperative stress/transfusion."
13_24h_nucleated_red_blood_cells_mean,2,"Persistent NRBCs suggest ongoing critical illness/hypoxia that can contribute to renal injury, but the mean is a smoothed measure and not a direct renal marker."
25_36h_nucleated_red_blood_cells_mean,3,"Ongoing NRBC presence closer to outcome can indicate sustained hypoperfusion/hypoxemia or systemic inflammation, which are established contributors to AKI. Still indirect and less informative than an extreme value would be."
0_12h_nucleated_red_blood_cells_max,3,"A high NRBC peak can mark severe hypoxia/shock physiology and overall severity, which increases AKI risk. Capped by the 0–12h epoch where transient perioperative derangements are common."
13_24h_nucleated_red_blood_cells_max,2,"NRBCs reflect physiologic stress/hypoxemia/inflammation and overall illness severity, which can correlate with AKI risk. Max is the most relevant aggregation, but this is still an indirect marker (and 13–24h capped)."
25_36h_nucleated_red_blood_cells_max,3,"Persistently elevated NRBCs closer to hour 60 suggest ongoing hypoxia/low-flow or severe systemic stress, which increases AKI risk. Max best captures the insult and is more informative in the 25–36h window."
0_12h_nucleated_red_blood_cells_min,1,The minimum NRBC value is not pathophysiologically informative for AKI and is largely redundant with max/trajectory. Early post-op (0–12h) values are also commonly transient.
13_24h_nucleated_red_blood_cells_min,1,NRBC minimum does not capture the stress signal; absence/low values are not predictive of AKI. Prefer max to avoid collinearity.
25_36h_nucleated_red_blood_cells_min,1,Minimum NRBC provides little clinical signal for renal injury compared with elevated extremes. Kept low to avoid redundancy with the more meaningful max feature.
0_12h_nucleated_red_blood_cells_measured,1,"Measurement frequency mainly reflects ordering behavior/acuity rather than a renal mechanism. In the immediate post-op period, labs are often routine and not specific for impending AKI."
13_24h_nucleated_red_blood_cells_measured,1,NRBC measurement count is a weak proxy for clinician concern/illness severity and not a direct AKI driver. Limit to 1 per the _measured rule.
25_36h_nucleated_red_blood_cells_measured,2,"More frequent NRBC checks late may indicate escalating concern for hypoxia/critical illness, which can co-occur with AKI. Still a behavioral proxy, so capped at 2."
0_12h_glucose_mean,2,"Stress hyperglycemia is associated with worse outcomes and may correlate with AKI risk, but mean smooths peaks and early post-op dysglycemia is often transient. Capped in 0–12h window."
13_24h_glucose_mean,2,"Sustained dysglycemia can reflect ongoing stress/inflammation and is associated with complications including AKI, but mean is less informative than extremes. Kept low to reduce collinearity with max/min."
25_36h_glucose_mean,2,"Persistent hyperglycemia later may indicate ongoing critical illness and is linked to AKI risk, but average values dilute clinically important excursions. Prefer max/min for capturing harmful extremes."
0_12h_glucose_max,3,"Peak hyperglycemia reflects acute stress response and is associated with adverse post-cardiac surgery outcomes including AKI. Max is the most relevant aggregation, but 0–12h is capped at 3."
13_24h_glucose_max,3,Ongoing hyperglycemic peaks in the trajectory phase suggest persistent stress/catecholamine exposure and correlate with AKI risk. Max captures the pathologic excursion better than mean.
25_36h_glucose_max,3,Late hyperglycemic spikes can indicate persistent critical illness and are associated with higher AKI risk after cardiac surgery. Max best captures the harmful excursion; still an indirect predictor rather than a renal biomarker.
0_12h_glucose_min,2,"Hypoglycemia can signal overtreatment, hepatic dysfunction, or severe illness and is associated with worse outcomes, but early post-op lows may be iatrogenic/transient. Min is the relevant aggregation for this risk."
13_24h_glucose_min,2,"Hypoglycemic episodes during 13–24h may reflect instability or aggressive insulin therapy and are linked to morbidity, with indirect association to AKI. Min captures the clinically relevant extreme; kept modest to avoid redundancy."
25_36h_glucose_min,2,"Hypoglycemia can reflect critical illness, hepatic dysfunction, or excess insulin and may correlate with instability, but it is not a primary mechanistic driver of post-cardiac surgery AKI. As an extreme it can mark acute stress, yet its link to creatinine rise is indirect."
0_12h_glucose_measured,1,"Measurement frequency mainly reflects ICU protocol intensity (e.g., insulin drip monitoring) rather than renal physiology. In the immediate 0–12h post-op period it is routine and weakly specific for impending AKI."
13_24h_glucose_measured,1,Glucose check frequency is largely a care-process marker (glycemic control) and not a direct predictor of renal injury. It may reflect acuity but is nonspecific for AKI.
25_36h_glucose_measured,2,"More frequent glucose monitoring can indicate ongoing instability (vasopressors, insulin infusion, sepsis concern) closer to the outcome window, which can correlate with AKI risk. Still, it is a behavioral proxy and not a physiologic biomarker."
0_12h_platelets_mean,2,"Thrombocytopenia after CPB is common and often transient; mean platelet level in 0–12h is a nonspecific marker of inflammation/consumption that can correlate with severity. Because extremes better capture pathologic thrombocytopenia, the mean is capped for collinearity."
13_24h_platelets_mean,2,"Persistently lower platelets can reflect ongoing inflammation, bleeding/consumption, or sepsis and is associated with worse outcomes including AKI, but it remains indirect. Extremes (min) are more informative than the mean, so importance is limited."
25_36h_platelets_mean,2,"Later sustained thrombocytopenia can track with critical illness and microvascular dysfunction that accompanies AKI risk, but platelet mean is still an indirect marker. Platelet minimum is the more pathologically relevant aggregation, so the mean is kept low to reduce redundancy."
0_12h_platelets_max,1,A higher platelet maximum is rarely a trigger for AKI and is usually not clinically meaningful post-op. In 0–12h it adds little beyond other platelet summaries.
13_24h_platelets_max,1,Platelet maximum does not capture the clinically relevant pathology for AKI (which is typically thrombocytopenia/consumption). It is unlikely to add prognostic value.
25_36h_platelets_max,1,"Even close to the outcome window, platelet maximum is not a recognized driver or biomarker of AKI. It is generally uninformative compared with platelet minimum."
0_12h_platelets_min,3,"Early platelet nadir can reflect CPB-related consumption, bleeding, or inflammatory activation and is associated with postoperative organ dysfunction including AKI. However, in the immediate 0–12h window it can be transient, so the score is conservatively capped."
13_24h_platelets_min,3,"A low platelet nadir in 13–24h suggests persistent consumption/inflammation or evolving sepsis/bleeding, which correlates with higher AKI risk. It is an established severity marker but not a direct renal biomarker."
25_36h_platelets_min,4,"A low platelet nadir close to hour 60 can indicate ongoing systemic inflammation, microvascular dysfunction, or sepsis/DIC physiology that strongly tracks with subsequent AKI. As an extreme value, it better captures clinically relevant pathology than mean/max."
0_12h_platelets_measured,1,Platelet measurement frequency is largely protocol-driven after cardiac surgery (bleeding surveillance) and is not a physiologic mechanism for AKI. In 0–12h it is especially routine and nonspecific.
13_24h_platelets_measured,1,More frequent platelet checks reflect clinician concern for bleeding/consumption but are a care-process proxy rather than a direct predictor of renal injury. Specificity for AKI is low.
25_36h_platelets_measured,2,"Increased platelet monitoring later may indicate ongoing bleeding, transfusion needs, or suspected sepsis/DIC, which can co-occur with AKI risk. Still, it is a behavioral marker and should remain low importance."
0_12h_mean_corpuscular_hemoglobin_mean,1,Mean corpuscular hemoglobin (MCH) is not a meaningful physiologic driver or marker of postoperative AKI; it mainly reflects RBC indices. Early postoperative shifts are common and not kidney-specific (0–12h capped low).
13_24h_mean_corpuscular_hemoglobin_mean,1,MCH has no established link to renal hypoperfusion or tubular injury and is unlikely to add prognostic value for creatinine rise.
25_36h_mean_corpuscular_hemoglobin_mean,1,"Even close to the outcome window, MCH is not a kidney-relevant biomarker and is typically unrelated to AKI trajectory."
0_12h_mean_corpuscular_hemoglobin_max,1,An extreme high MCH is rarely clinically meaningful in the ICU and does not capture an AKI mechanism; also likely redundant with mean.
13_24h_mean_corpuscular_hemoglobin_max,1,"MCH maxima do not reflect renal perfusion, nephrotoxicity, or intrinsic kidney injury and are not expected to predict creatinine_ratio."
25_36h_mean_corpuscular_hemoglobin_max,1,Late-window MCH extremes remain non-specific and not mechanistically tied to postoperative AKI.
0_12h_mean_corpuscular_hemoglobin_min,1,Low MCH reflects chronic microcytosis/iron deficiency rather than acute renal insult; not a useful AKI predictor in the immediate post-op period.
13_24h_mean_corpuscular_hemoglobin_min,1,MCH minima are not established risk factors for AKI and are unlikely to track postoperative renal deterioration.
25_36h_mean_corpuscular_hemoglobin_min,1,"Low MCH near 36h is still not a direct or indirect marker of kidney injury compared with hemodynamics, urine output, or creatinine/BUN."
0_12h_mean_corpuscular_hemoglobin_measured,1,Measurement frequency of MCH is largely driven by routine CBC ordering rather than specific AKI concern; behavioral proxy only.
13_24h_mean_corpuscular_hemoglobin_measured,1,"CBC/MCH rechecks typically reflect standard ICU monitoring or anemia/bleeding evaluation, not targeted suspicion of impending AKI."
25_36h_mean_corpuscular_hemoglobin_measured,1,"Even later, MCH measurement count is not a strong indicator of renal risk and should be treated as low-value behavioral signal."
0_12h_sodium_mean,2,Mean sodium reflects overall fluid balance and neurohormonal stress but is not a direct AKI biomarker; early post-op values are often transient (0–12h capped).
13_24h_sodium_mean,2,"Persistent dysnatremia can correlate with illness severity and fluid management that may affect renal perfusion, but it is an indirect and non-specific AKI predictor."
25_36h_sodium_mean,3,"By 25–36h, sustained hypernatremia/hyponatremia may better reflect ongoing fluid imbalance/diuretic effect or renal concentrating dysfunction, indirectly associating with AKI risk."
0_12h_sodium_max,2,"Sodium extremes can indicate significant free-water deficit or hypertonic exposure, but in the immediate post-op window they are often iatrogenic/transient and not a primary AKI driver (also avoid redundancy with mean)."
13_24h_sodium_max,2,"Hypernatremia can reflect free-water deficit/diuresis or hypertonic therapy and correlates with illness severity, but it is not a direct AKI driver. Max is more informative than mean, yet still an indirect signal in this epoch."
25_36h_sodium_max,2,"Later hypernatremia may indicate ongoing dehydration, osmotic diuresis, or aggressive diuresis, which can worsen renal perfusion indirectly. Still not a specific biomarker for AKI."
0_12h_sodium_min,2,Early hyponatremia is common post-op from hemodilution and fluids and is often transient. It may reflect volume status/heart failure risk but is not a strong direct predictor; capped by early-epoch conservatism.
13_24h_sodium_min,2,"Hyponatremia in this phase can reflect fluid overload, low effective arterial volume, or SIADH, which may accompany renal hypoperfusion. It remains an indirect marker rather than a primary AKI predictor."
25_36h_sodium_min,2,"Persistent/worsening hyponatremia closer to outcome can signal ongoing fluid overload or low effective circulating volume, both associated with AKI risk. However sodium itself is nonspecific for intrinsic kidney injury."
0_12h_sodium_measured,1,Measurement frequency mainly reflects routine ICU electrolyte monitoring and general acuity rather than a renal mechanism. In the immediate post-op window it is standard-of-care.
13_24h_sodium_measured,1,"Ordering frequency is largely driven by protocolized labs and overall instability, not specifically impending AKI. Weak behavioral proxy."
25_36h_sodium_measured,1,More frequent sodium checks may reflect ongoing electrolyte management but is not specific to kidney injury prediction. Primarily a care-intensity marker.
0_12h_teg_platelet_aggregation_measured,1,"TEG platelet aggregation testing reflects bleeding/thrombosis management and antiplatelet effect, not renal perfusion or tubular injury. In this early window it is often driven by surgical hemostasis concerns."
13_24h_teg_platelet_aggregation_measured,1,Continued TEG platelet aggregation testing indicates coagulation/bleeding evaluation rather than AKI pathophysiology. At most a nonspecific severity marker.
25_36h_teg_platelet_aggregation_measured,1,Late TEG platelet aggregation testing still primarily reflects hemostasis/antiplatelet management and is not a direct AKI predictor. Weak indirect association via overall illness severity only.
0_12h_mean_corpuscular_hemoglobin_concentration_mean,1,MCHC is not a clinically meaningful driver of renal injury and is minimally informative compared with hemoglobin/hematocrit or hemolysis markers. Mean aggregation further dilutes any weak signal; capped in early epoch.
13_24h_mean_corpuscular_hemoglobin_concentration_mean,1,MCHC changes are typically due to lab/volume effects and do not track renal hypoperfusion or nephrotoxicity. Mean value offers little prognostic value for AKI.
25_36h_mean_corpuscular_hemoglobin_concentration_mean,1,"Even close to outcome, MCHC is not an established AKI predictor and is largely unrelated to kidney perfusion or tubular injury. Mean aggregation provides no acute-insult information."
0_12h_mean_corpuscular_hemoglobin_concentration_max,1,"An elevated MCHC max can occur with spherocytosis, cold agglutinins, or analytic artifact and is not a typical post-cardiac surgery AKI signal. Early post-op values are especially nonspecific."
13_24h_mean_corpuscular_hemoglobin_concentration_max,1,"MCHC max remains a weak, nonspecific hematology metric with little mechanistic link to AKI compared with hemodynamics, lactate, or creatinine/urine output. Not a useful predictor in sparse linear modeling."
25_36h_mean_corpuscular_hemoglobin_concentration_max,2,"MCHC extremes are not a direct AKI marker; changes usually reflect hemolysis, transfusion effects, or lab artifact rather than renal perfusion. As a max value it may capture acute hemoconcentration but is an indirect signal at best."
0_12h_mean_corpuscular_hemoglobin_concentration_min,1,"Early postoperative low MCHC is common from hemodilution/transfusion and is not a specific driver of AKI. In the 0–12h epoch, transient shifts further limit prognostic value."
13_24h_mean_corpuscular_hemoglobin_concentration_min,1,Low MCHC in this window remains a nonspecific anemia/hemodilution indicator and is not an established predictor of AKI. It provides little mechanistic information about renal hypoperfusion or nephrotoxicity.
25_36h_mean_corpuscular_hemoglobin_concentration_min,2,"Persistently low MCHC may correlate with ongoing bleeding/hemodilution and illness severity, which can indirectly relate to AKI risk. However it is not a direct renal biomarker and is weaker than hemodynamics/creatinine/urine output."
0_12h_mean_corpuscular_hemoglobin_concentration_measured,1,Measurement frequency reflects ordering behavior (CBC frequency) rather than renal physiology. In the immediate post-op period this is routine monitoring and not specific for impending AKI.
