value,importance,reason
age,3,"Advanced age is an established risk factor for post-cardiac surgery AKI due to reduced renal reserve, vascular disease burden, and higher susceptibility to ischemia-reperfusion injury."
gender,2,Sex has an inconsistent and generally modest association with CSA-AKI compared with hemodynamics and baseline kidney disease; it may act as a proxy for body size and comorbidity patterns.
race_caucasian,1,Race category is not a direct physiologic driver of AKI and is mainly a proxy for social/healthcare factors; it adds limited mechanistic signal for creatinine rise after surgery.
race_black,2,"Black race can correlate with higher CKD and hypertension prevalence and may influence creatinine generation, but it is not a direct perioperative mechanism of AKI."
race_asian,1,This is not a direct physiologic predictor of postoperative AKI; any association is typically indirect via comorbidity patterns and baseline kidney function.
race_native_am,2,"May indirectly reflect higher baseline CKD/diabetes burden in some populations, but it is not a direct perioperative driver of renal hypoperfusion or nephrotoxicity."
race_native_pacific,2,"Potential indirect association through comorbidity prevalence (e.g., diabetes, CKD), but limited direct mechanistic linkage to acute postoperative creatinine rise."
race_other,1,Heterogeneous category with no specific mechanistic relationship to AKI; likely low incremental predictive value beyond measured comorbidities and labs.
ethnicity,1,Ethnicity is not a direct physiologic determinant of AKI and mainly serves as a proxy for population-level differences that are better captured by comorbidities and perioperative physiology.
height_cm,1,"Height has minimal direct relationship to AKI risk; it may weakly proxy body size but does not capture renal perfusion, nephrotoxins, or kidney injury."
weight_kg,2,"Higher weight can reflect obesity and dosing/volume distribution issues and is associated with increased perioperative risk, but it is an indirect predictor compared with hemodynamics and renal labs."
family_history_premature_cardiac_death,1,Family history is not a direct driver of postoperative AKI and provides little incremental information beyond the patient’s own cardiovascular disease and perioperative course.
diabetes,4,"Diabetes is a strong established risk factor for CSA-AKI via microvascular disease, baseline nephropathy, and increased susceptibility to ischemic and inflammatory renal injury."
diab_ctrl,2,"Glycemic control status may modestly relate to baseline microvascular/renal vulnerability, but it is an indirect and often noisy proxy compared with perioperative hemodynamics and renal function measures."
pre_op_dyslipidemia,1,Dyslipidemia is not a direct predictor of acute postoperative creatinine rise; its effect is largely mediated through atherosclerotic burden already reflected by other comorbidities.
hypertension,3,"Hypertension is an established AKI risk factor through chronic nephrosclerosis and impaired renal autoregulation, increasing vulnerability to perioperative hypotension and low cardiac output."
endocarditis_history,2,"Prior endocarditis can be associated with chronic inflammation, embolic phenomena, and more complex surgery, which can indirectly increase AKI risk. It is not a direct perioperative driver of creatinine rise compared with hemodynamics and nephrotoxins."
chronic_lung_disease,3,"COPD/chronic lung disease is associated with higher perioperative risk, hypoxemia/hypercapnia, and greater likelihood of vasopressors/ventilation, which can impair renal perfusion. It is a common comorbidity linked to worse postoperative outcomes including AKI."
pre_op_home_oxygen,3,"Home oxygen is a marker of advanced pulmonary disease and limited physiologic reserve, often correlating with perioperative hypoxemia and hemodynamic instability that can precipitate AKI. It is an indirect but established risk marker."
bronchodilator_therapy,2,Bronchodilator use mainly reflects underlying obstructive lung disease severity and perioperative respiratory management. It has only an indirect association with AKI through illness severity and ventilation needs.
pre_op_sleep_apnea,2,"Sleep apnea is associated with cardiovascular comorbidity and intermittent hypoxemia, which may increase perioperative risk. However, it is not a strong standalone predictor of postoperative creatinine rise after cardiac surgery."
pneumonia,3,"Pneumonia increases systemic inflammation, hypoxemia, and sepsis risk, all of which can reduce renal perfusion and increase AKI risk. It also often leads to nephrotoxic antibiotic exposure and higher ICU acuity."
iv_drug_abuse,2,"IV drug use can be associated with infections, endocarditis, and chronic comorbidities that increase perioperative complexity. Its link to AKI is indirect and less predictive than perioperative hemodynamics and renal labs."
depression,1,Depression has no direct physiologic mechanism linking it to postoperative renal hypoperfusion or tubular injury. Any association is likely confounded by overall health status and care patterns.
alcohol,2,"Alcohol use can contribute to liver disease, malnutrition, and hemodynamic instability, which may indirectly increase AKI risk. By itself it is not a strong or specific predictor of creatinine rise."
liver_dis,4,"Liver disease is strongly associated with circulatory dysfunction, susceptibility to hypotension, inflammation, and hepatorenal physiology, all of which increase postoperative AKI risk. It also correlates with coagulopathy and complex perioperative courses."
imm_supp,3,"Immunosuppression increases infection/sepsis risk and may involve nephrotoxic agents (e.g., calcineurin inhibitors), both of which can drive AKI. It is a meaningful comorbidity-level risk factor but not a direct biomarker."
mediast_rad,2,"Prior mediastinal radiation can indicate complex cardiac pathology and technically challenging surgery, potentially increasing bypass time and hemodynamic stress. The relationship to AKI is indirect."
cancer,2,"Cancer is a marker of frailty and may be associated with prior nephrotoxic chemotherapy or chronic inflammation. However, it is not a strong direct predictor of postoperative creatinine ratio compared with renal perfusion variables."
peripheral_artery_disease,4,"PAD reflects systemic atherosclerosis and microvascular disease, which reduces renal reserve and increases susceptibility to ischemic AKI during hypotension/CPB. It is a well-established risk factor for postoperative AKI."
pre_op_thoracic_aorta_disease,4,"Thoracic aortic disease often implies more complex surgery (e.g., circulatory arrest, longer CPB) and higher embolic/ischemic risk, both strongly linked to AKI. It is a strong preoperative predictor of postoperative renal injury."
syncope,1,Syncope is nonspecific and does not directly reflect renal reserve or perioperative renal perfusion. Any association with AKI is likely weak and mediated by underlying cardiac disease captured elsewhere.
unresponsive_state_history,2,"History of unresponsiveness is an indirect marker of frailty/neurologic comorbidity and may correlate with overall illness severity, but it is not a direct driver of postoperative renal hypoperfusion or nephrotoxicity."
cerebrovascular_disease,3,"Cerebrovascular disease reflects systemic atherosclerosis and vascular stiffness, which often co-tracks with renal microvascular disease and higher AKI risk after cardiac surgery."
pre_op_hemoglobin,3,Preoperative anemia reduces oxygen delivery and increases transfusion likelihood; both are associated with cardiac-surgery–associated AKI via renal medullary hypoxia and inflammatory/hemolysis effects.
total_albumin_before_surgery,3,"Low albumin is a marker of malnutrition/inflammation and lower oncotic pressure, associated with worse postoperative outcomes and higher AKI risk, though not kidney-specific."
total_bilirubin_before_surgery,3,"Elevated bilirubin suggests hepatic dysfunction or congestive hepatopathy, which often accompanies venous congestion/low cardiac output states that predispose to postoperative AKI."
a1c_lvl,3,"Higher HbA1c indicates diabetes and chronic glycemic exposure, a well-established risk factor for perioperative AKI due to baseline nephropathy and microvascular vulnerability."
pre_op_heparin_induced_thrombocytopenia_antibodies,2,"HIT antibodies mainly affect anticoagulation strategy and thrombotic risk; any AKI link is indirect (e.g., thrombosis/complex perioperative course) rather than a primary renal predictor."
meld_scr,4,"A higher MELD score captures significant hepatic dysfunction and includes creatinine, reflecting baseline renal vulnerability and systemic illness that strongly increases risk of postoperative creatinine rise."
bnp,4,Elevated BNP indicates heart failure/volume overload and higher filling pressures; postoperative renal dysfunction is strongly linked to low forward flow and venous congestion in this population.
five_m_walk_test,2,"Poor 5-meter walk performance is a frailty marker associated with complications and prolonged ICU course, but it is only indirectly related to renal perfusion or nephrotoxic exposure."
previous_cardiovascular_intervention,2,"Prior interventions suggest advanced cardiovascular disease, which can correlate with AKI risk, but the variable is nonspecific and not a direct physiologic determinant."
previous_coronary_bypass_graft,3,"Prior CABG implies severe coronary disease and possible redo sternotomy complexity, both associated with longer bypass times/hemodynamic instability that increase AKI risk."
previous_surgery_cardiac_value,3,"History of prior cardiac surgery increases operative complexity and risk of low cardiac output or prolonged cardiopulmonary bypass, which are established contributors to postoperative AKI."
previous_percutaneous_coronary_intervention,2,Prior PCI is a marker of coronary disease burden; its association with AKI is indirect and weaker than direct hemodynamic/renal markers.
previous_percutaneous_coronary_intervention_this_episode_of_care,3,"PCI during the same episode often implies recent contrast exposure and acute coronary syndrome physiology, both of which can increase susceptibility to postoperative AKI."
previous_percutaneous_coronary_intervention_stent,2,Presence of a stent mainly reflects prior coronary disease and antiplatelet management; it has no direct renal mechanism and only an indirect association with AKI risk.
time_since_previous_cardiac_intervention,2,"Short interval since a prior cardiac intervention can proxy higher baseline cardiovascular disease burden and perioperative complexity, which indirectly increases AKI risk. It is not a direct renal perfusion or nephrotoxin marker."
past_cardiac_interventions,2,"History of prior cardiac interventions suggests advanced atherosclerotic disease and potentially more complex redo surgery, indirectly raising AKI risk. The link is mediated through hemodynamics/CPB exposure rather than kidney-specific injury."
pre_op_ace_inhibitor_within_48_hours,3,"ACE inhibitors can reduce efferent arteriolar tone and impair renal autoregulation during perioperative hypotension/low cardiac output, increasing AKI susceptibility. Effect size is context-dependent but clinically recognized."
pre_op_adp_inhibitor_within_5_days,2,"Recent P2Y12 inhibitor use mainly increases bleeding/transfusion risk, which can secondarily contribute to AKI via hypotension and inflammation. It is not a primary renal insult by itself."
pre_op_amiodarone,1,Amiodarone is not typically nephrotoxic and has no strong direct mechanistic link to postoperative AKI. It mainly reflects arrhythmia history rather than renal risk.
pre_op_anticoagulants,2,"Pre-op anticoagulation can increase perioperative bleeding and transfusion needs, indirectly worsening renal perfusion and inflammatory load. Direct anticoagulant-related nephropathy is uncommon in this setting."
pre_op_aspirin,1,Aspirin at antiplatelet doses has minimal direct nephrotoxicity and is routine in cardiac patients. Any AKI association is largely confounded by comorbidity and bleeding risk.
pre_op_beta_blockers,2,"Beta-blockers can contribute to perioperative bradycardia/low cardiac output in some patients, indirectly affecting renal perfusion. More often they reflect underlying cardiac disease rather than being a direct AKI driver."
pre_op_beta_blocker_therapy_for_2_weeks,2,"Chronic beta-blocker therapy is a marker of cardiovascular disease severity and may influence perioperative hemodynamics, indirectly affecting AKI risk. It is not a direct renal injury marker."
pre_op_calcium_channel_blocker_therapy_for_2_weeks,1,Chronic calcium channel blocker use has no consistent direct association with postoperative AKI and is not typically nephrotoxic. It mainly reflects hypertension/angina management.
pre_op_glycoprotein_inhibitor,2,"GP IIb/IIIa inhibitor use suggests recent ACS/PCI and increases bleeding/transfusion risk, which can secondarily contribute to AKI. The medication itself is not a primary renal toxin."
pre_op_inotropic_agents,4,"Need for pre-op inotropes indicates severe cardiac dysfunction/low output state, a strong predictor of perioperative renal hypoperfusion and subsequent AKI. This is a high-risk hemodynamic phenotype."
pre_op_lipid_lowering_med,1,Statins/lipid-lowering therapy are not direct AKI triggers and may even be protective in some contexts. Use largely reflects baseline cardiovascular risk rather than imminent renal injury.
pre_op_long_acting_nitrate_therapy_for_2_weeks,1,Chronic nitrate therapy is primarily a marker of angina and does not directly predict AKI. Any association would be indirect via coronary disease burden.
pre_op_iv_nitrates,3,"IV nitrates pre-op often indicate active ischemia/heart failure and can contribute to hypotension, both of which can reduce renal perfusion. This is a meaningful hemodynamic risk marker though not kidney-specific."
pre_op_other_antianginal_therapy_for_2_weeks,1,Other chronic antianginal therapies are not typically nephrotoxic and mainly reflect underlying coronary disease. Their relationship to AKI is indirect and weak.
pre_op_steroid_usage,2,"Chronic or recent steroid use can reflect frailty/inflammation and may worsen glycemic control and infection risk, indirectly increasing AKI risk. Not a direct renal perfusion marker and effects are heterogeneous."
pre_op_thrombin_inhibitor_within_24_hours,1,"Primarily affects perioperative bleeding/transfusion strategy rather than renal perfusion directly. Any AKI association is indirect via bleeding, hypotension, or transfusion needs."
pre_op_warfarin_within_5_days,1,Warfarin exposure mainly influences bleeding risk and perioperative management; it is not a direct driver of postoperative AKI. Renal effects would be indirect through hemodynamic instability or transfusion.
pre_op_factor_xa_inhibitor_within_5_days,1,Factor Xa inhibitors are not intrinsically nephrotoxic in this context; relevance is largely perioperative bleeding risk. Any link to AKI is indirect and inconsistent.
pre_op_thrombin_inhibitor_within_5_days,1,"Similar to other anticoagulants, the main impact is bleeding/transfusion risk rather than kidney injury mechanisms. Not an established independent predictor of postoperative creatinine rise."
pre_op_lipid_lowering_med_is_statin,2,"Statin use may be a proxy for atherosclerotic burden and cardiovascular comorbidity, which correlates with AKI risk. Potential pleiotropic protective effects exist, but overall it is not a strong direct predictor."
cardiac_catheterization_performed,3,"Recent catheterization can imply contrast exposure and higher coronary disease severity, both associated with postoperative AKI risk. The signal is indirect but clinically plausible, especially if close to surgery."
cor_anat_dis_known,2,"Known coronary anatomy/disease reflects baseline vascular disease and operative complexity, which can increase AKI risk via perfusion vulnerability. It is a proxy variable rather than a direct renal insult."
number_of_diseased_coronary_vessels,3,"Greater coronary disease burden correlates with systemic atherosclerosis and higher likelihood of complex surgery/CPB time and hemodynamic instability, increasing AKI risk. Still indirect compared with postoperative hemodynamics and renal labs."
aortic_valve_disease,3,Severe aortic stenosis/regurgitation can predispose to perioperative low cardiac output and renal hypoperfusion and often entails complex surgery. It is an established risk factor but not a direct biomarker.
mitral_valve_disease,2,"Mitral disease can be associated with heart failure/pulmonary hypertension and perioperative hemodynamic instability, indirectly increasing AKI risk. Predictive strength is moderate and mediated by postoperative perfusion variables."
tricuspid_valve_disease,3,"Tricuspid disease often reflects right-sided failure and venous congestion, which can impair renal perfusion pressure and promote cardiorenal AKI. This is a clinically meaningful risk factor though not definitive alone."
pulmonic_valve_disease,1,Pulmonic valve disease is uncommon and typically less directly tied to renal hypoperfusion in adult cardiac surgery cohorts. Any association with AKI would be indirect via right heart dysfunction severity.
n_past_cardiac_surgeries,3,"Redo sternotomy/reoperative cardiac surgery increases operative complexity, bleeding/transfusion, CPB time, and risk of low cardiac output, all linked to AKI. A solid baseline risk factor but not a direct renal marker."
status,2,"If this encodes operative urgency or preoperative clinical status, it can proxy severity of illness and hemodynamic reserve, which relate to AKI risk. Without clear definition it is treated as a moderate indirect predictor."
current_case_canceled,1,Case cancellation is an administrative/operational outcome and not a physiological driver of postoperative creatinine rise. Any relationship to AKI would be incidental or confounded.
operative_approach_converted,3,"Conversion (e.g., minimally invasive to open) is a proxy for intraoperative complexity/instability, longer bypass/ischemia time, bleeding, and vasopressor exposure, all of which increase AKI risk. It is indirect and heterogeneous, so not definitive alone."
robotic,2,"Robotic/minimally invasive approaches may reduce surgical trauma and transfusion needs, potentially lowering AKI risk, but the relationship is indirect and confounded by patient selection. Not a direct renal physiology marker."
op_cab,3,"CABG is associated with cardiopulmonary bypass exposure (if on-pump), hemodynamic swings, and atheroembolism risk, all established contributors to postoperative AKI. Procedure type is a moderate, not definitive, predictor without bypass/instability details."
op_valve,3,"Valve surgery often entails longer cross-clamp/bypass times and higher risk of low cardiac output syndrome, both linked to renal hypoperfusion and AKI. Procedure category is an established but nonspecific risk factor."
other_cardiac_procedure_completed,3,"Additional cardiac procedures generally indicate greater operative complexity and longer ischemic/bypass exposure, increasing AKI risk via inflammation and hypoperfusion. It is a proxy variable with variable mechanisms."
a_fib_proc,2,"Concomitant AF procedures (e.g., Maze) add operative time and may increase inflammation, but typically have a weaker and indirect link to AKI compared with hemodynamics, perfusion, and nephrotoxins. Mostly a complexity marker."
aort_proc,4,"Aortic procedures carry high AKI risk due to prolonged circulatory arrest/bypass, embolic burden, and profound hemodynamic perturbations leading to renal ischemia-reperfusion injury. This is a strong procedure-level predictor in cardiac surgery populations."
other_non_cardiac_procedure_done,2,"Non-cardiac concomitant procedures may reflect increased operative duration and physiologic stress, but the renal impact is variable and indirect. Limited specificity for kidney injury mechanisms."
appropriate_antibiotic_selection,1,Appropriate prophylactic antibiotic choice is standard-of-care and not a direct driver of postoperative creatinine rise. Any AKI association would be weak and confounded unless nephrotoxic agents are specifically captured.
appropriate_antibiotic_administration_timing,1,Timing of prophylactic antibiotics primarily affects surgical site infection risk rather than renal perfusion or tubular injury. It has no meaningful direct link to AKI prediction in this context.
antibiotic_discontinuation_ordered,1,Discontinuation orders reflect protocol adherence and stewardship rather than renal physiology. It is unlikely to add prognostic value for creatinine ratio beyond other clinical severity markers.
additional_intraoperative_prophylactic_antibiotic_dose,2,"An extra intraoperative dose often indicates prolonged surgery or high blood loss, indirectly increasing AKI risk via complexity and hemodynamic stress. The antibiotic exposure itself is usually not the primary nephrotoxic driver in prophylaxis dosing."
operative_lowest_core_temperature,3,"Lower nadir temperature can reflect deep hypothermia/circulatory arrest and longer bypass, which are associated with renal ischemia-reperfusion injury and AKI. It is a moderate predictor but partly a surrogate for procedure type and duration."
operative_lowest_hemoglobin,4,"Low intraoperative hemoglobin indicates anemia/hemodilution/bleeding and reduced oxygen delivery, which can precipitate renal medullary hypoxia and AKI, especially in elderly cardiac surgery patients. It is a strong, mechanistically plausible predictor."
high_intra_glu,2,"Intraoperative hyperglycemia correlates with stress response and worse outcomes, and may contribute to endothelial dysfunction, but its direct causal link to AKI is weaker than perfusion/hemoglobin/vasopressors. More of an illness-severity marker."
cardiopulmonary_coronary_perfused_used,2,Use of specialized perfusion strategies suggests complex coronary pathology or operative technique and may correlate with longer bypass or hemodynamic manipulation. The renal link is indirect and likely confounded by case complexity.
arterial_cannulation_site_aortic,2,Aortic cannulation is common and usually reflects standard CPB setup; it has only an indirect link to AKI via overall surgical complexity and embolic risk.
arterial_cannulation_site_femoral,3,"Femoral cannulation can indicate more complex/urgent cases and may increase atheroembolism/malperfusion risk, which can contribute to postoperative AKI."
arterial_cannulation_site_axillary,2,Axillary cannulation is often chosen for aortic pathology and cerebral protection strategies; renal impact is indirect and largely mediated by case complexity and perfusion management.
arterial_cannulation_site_innominate,2,Innominate cannulation typically reflects arch/aortic procedures and perfusion strategy; association with AKI is indirect through operative complexity and hemodynamic instability.
arterial_cannulation_site_other,2,"Nonstandard arterial cannulation sites generally proxy unusual anatomy or high-complexity surgery, which can raise AKI risk indirectly but is not a direct renal biomarker."
venous_cannulation_site_femoral,2,Femoral venous cannulation may reflect minimally invasive or complex access; renal relevance is indirect and mainly via overall procedural complexity and perfusion adequacy.
venous_cannulation_site_jugular,2,Jugular venous cannulation is uncommon and may indicate special access needs; any AKI relationship is indirect through case complexity rather than renal physiology.
venous_cannulation_site_right_atrial,1,Right atrial venous cannulation is standard for many CPB cases and does not specifically predict renal injury beyond baseline surgical risk.
venous_cannulation_site_left_atrial,2,Left atrial cannulation is procedure-specific and may indicate complex intracardiac surgery; AKI linkage is indirect via operative complexity and hemodynamics.
venous_cannulation_site_pulmonary,2,Pulmonary venous/arterial cannulation is uncommon and suggests specialized procedures; renal risk is indirect and not a direct driver of creatinine rise.
venous_cannulation_site_bicaval,2,Bicaval cannulation is used for certain valve/congenital-type exposures and can correlate with longer/complex CPB; AKI association is indirect.
venous_cannulation_site_other,2,Other venous cannulation sites are a proxy for atypical or complex operations; they may correlate with AKI risk indirectly but are not mechanistic predictors.
cardiopulmonary_bypass_time,4,"Longer CPB time is a strong, well-established predictor of postoperative AKI via inflammation, hemolysis, nonpulsatile flow, and higher likelihood of hypotension/transfusion."
circulatory_arrest,4,"Circulatory arrest implies profound systemic hypoperfusion/ischemia risk and high operative complexity, both strongly associated with subsequent AKI."
deep_hypothermic_circulatory_arrest_time,5,"Longer DHCA time directly increases duration of global hypoperfusion/ischemia, a potent trigger for ischemic ATN and postoperative creatinine rise."
cerebral_perfusion_utilized,2,Use of cerebral perfusion mainly reflects arch surgery strategy and complexity; renal implications are indirect and depend more on systemic perfusion and arrest duration.
cerebral_perfusion_time,2,"Longer selective cerebral perfusion often reflects complex arch surgery and prolonged bypass exposure, which indirectly increases AKI risk. It is not a direct renal perfusion measure."
intraop_circulatory_arrest_time,4,"Circulatory arrest implies global hypoperfusion/ischemia and typically longer CPB/complexity, which strongly increases postoperative AKI risk. Longer arrest time correlates with ischemic tubular injury risk."
