value,importance,reason
25_36h_potassium_measured,2,Frequency of potassium measurement in the closest window (25–36h) may weakly proxy evolving AKI/arrhythmia risk and ICU intensity. Still largely clinician-behavior/monitoring signal and dominated by true renal/hemodynamic biomarkers.
0_12h_total_bilirubin_mean,2,"Average bilirubin in the immediate post-op window reflects hepatic congestion/hemolysis and overall illness severity. Early mean values are noisy and indirect for AKI, and likely redundant with stronger later/extreme organ-dysfunction signals."
0_12h_total_bilirubin_max,3,"Peak bilirubin early post-op can capture acute hepatic hypoperfusion/congestion and systemic insult that correlates with later AKI risk. Max is the most informative aggregation within this bilirubin family, but timing is early and still indirect for creatinine rise."
0_12h_total_bilirubin_min,1,Minimum bilirubin in 0–12h is typically near baseline and not a meaningful marker of organ dysfunction. Provides little unique predictive value and is dominated by max/trajectory measures.
0_12h_total_bilirubin_measured,1,Number of bilirubin measurements in 0–12h is primarily a monitoring/ordering behavior proxy. Low direct physiologic content and unlikely to survive sparse feature selection.
13_24h_total_bilirubin_measured,1,"Measurement frequency of bilirubin in 13–24h reflects clinician concern/complexity more than hepatic or renal function itself. Weak, indirect, and redundant with actual lab values if available."
25_36h_total_bilirubin_measured,2,Later bilirubin check frequency (25–36h) may modestly indicate ongoing organ dysfunction workup closer to the outcome window. Still a proxy variable and generally lower priority than physiologic extremes/values.
0_12h_rbc_count_mean,2,"Mean RBC count early post-op reflects anemia/hemodilution/transfusion effects, which can relate to renal oxygen delivery but is nonspecific. Early mean is noisy and redundant with later values and more direct perfusion/hemolysis markers."
13_24h_rbc_count_mean,2,Average RBC count in 13–24h captures ongoing anemia/hemodilution that may contribute to AKI risk via reduced oxygen delivery. Still indirect and likely dominated by more proximal (25–36h) or extreme anemia measures.
25_36h_rbc_count_mean,3,Mean RBC count in 25–36h is the closest sustained anemia signal to Hour-60 creatinine and may add some independent predictive value. However it remains an indirect severity/transfusion proxy rather than a direct renal marker.
0_12h_rbc_count_max,1,Maximum RBC count in 0–12h is rarely pathologic and often reflects hemoconcentration or lab variability rather than a renal-relevant insult. Low unique value and dominated by anemia (min) measures.
13_24h_rbc_count_max,1,Peak RBC count in 13–24h is not a typical driver of AKI and is less informative than anemia extremes. Likely redundant/noisy for sparse modeling.
25_36h_rbc_count_max,1,Maximum RBC count in 25–36h similarly provides little renal-specific information and is not an established AKI precursor. Lower priority than minimum/mean anemia measures.
0_12h_rbc_count_min,3,"Minimum RBC count in 0–12h captures worst early anemia/hemodilution/transfusion-related nadir, which can relate to renal hypoxia risk. Min is the most pathophysiologically relevant RBC aggregation, but early timing reduces reliability for Hour-60 prediction."
13_24h_rbc_count_min,4,"Minimum RBC count in 13–24h captures clinically meaningful anemia after initial post-op shifts, a plausible contributor/proxy for renal hypoperfusion and transfusion burden. Stronger sparse-model candidate than early nadir and more informative than mean/max within this batch."
25_36h_rbc_count_min,2,"Low RBC count reflects anemia/bleeding/hemodilution and can correlate with overall illness and transfusion exposure. It is an indirect, nonspecific AKI signal and likely redundant with stronger hemodynamic/renal-perfusion features, though the late-window minimum is the most informative RBC summary here."
0_12h_rbc_count_measured,1,"Indicates whether/ how often RBC count was checked early post-op, mainly reflecting monitoring intensity and routine post-cardiac surgery labs. This is a clinician-behavior proxy with little unique physiologic information for Hour-60 creatinine ratio."
13_24h_rbc_count_measured,1,"Measurement frequency of RBC count in 13–24h is largely a proxy for care intensity or concern rather than a direct renal signal. Unlikely to survive sparse selection versus actual values (e.g., anemia) or renal/hemodynamic markers."
25_36h_rbc_count_measured,2,"Late-window RBC measurement frequency may reflect evolving instability/bleeding prompting closer monitoring. Still primarily a proxy variable and generally dominated by physiologic extremes/values, but timing closer to Hour 60 gives slightly more potential signal than earlier epochs."
0_12h_d_dimer_measured,1,Whether D-dimer was measured early post-op reflects clinician suspicion for thrombosis/PE/DIC rather than kidney physiology. Early timing and proxy nature make it a weak sparse-model candidate.
13_24h_d_dimer_measured,1,"D-dimer measurement in 13–24h is mostly a workup/monitoring indicator and not a direct precursor of AKI. Adds little unique predictive value for creatinine ratio compared with hemodynamics, lactate, urine output, or creatinine trends."
25_36h_d_dimer_measured,2,"Late D-dimer measurement may mark complications (thrombosis, inflammation, DIC) that can co-occur with AKI. Still a clinician-behavior proxy and likely redundant with more direct severity/organ dysfunction features, but timing makes it slightly more informative than earlier epochs."
0_12h_teg_activated_clotting_time_measured,1,TEG ACT measurement early post-op mainly reflects bleeding/coagulopathy evaluation and transfusion management. It is a monitoring/procedure proxy with limited direct linkage to Hour-60 renal dysfunction.
13_24h_teg_activated_clotting_time_measured,1,TEG ACT measurement in 13–24h indicates ongoing coagulation assessment rather than renal perfusion or function. Unlikely to add unique value in a sparse model beyond direct hemodynamic/renal markers.
25_36h_teg_activated_clotting_time_measured,2,"Late TEG ACT measurement suggests persistent bleeding/coagulopathy or re-exploration risk, which can associate with AKI via shock/transfusion burden. Still primarily a clinician-action proxy and generally dominated by direct physiologic variables, but closer timing modestly increases relevance."
0_12h_percent_immature_granulocyte_mean,1,"Mean immature granulocyte percentage reflects early inflammatory/stress response and possible infection. In the immediate 0–12h window it is noisy post-bypass and is an indirect AKI predictor, likely dominated by later or more direct organ-perfusion signals."
13_24h_percent_immature_granulocyte_mean,2,"Sustained immature granulocytosis in 13–24h can indicate evolving infection/inflammation that increases AKI risk. The mean is less sensitive than extremes and remains an indirect severity marker, so it is a weaker sparse-selection candidate."
0_12h_percent_immature_granulocyte_max,2,"Peak immature granulocyte percentage captures an early inflammatory surge that can correlate with complications and AKI risk. However, 0–12h values are often transient post-op and still indirect, limiting sparse-model priority."
13_24h_percent_immature_granulocyte_max,3,"A higher 13–24h maximum immature granulocyte percentage may better capture pathologic inflammation/infection beyond immediate post-op noise. Among IG summaries here, this extreme is the most informative and could add modest unique value as a complication signal linked to AKI."
0_12h_percent_immature_granulocyte_min,1,The minimum immature granulocyte percentage is not clinically meaningful for AKI risk and mainly reflects baseline/measurement variability. It is dominated by max-based summaries and provides little unique predictive information.
13_24h_percent_immature_granulocyte_min,1,Minimum immature granulocyte percentage in 13–24h is unlikely to encode a relevant pathophysiologic insult and is largely redundant/noisy. Extremes on the high end (max) are the more informative aggregation for complication-related AKI risk.
0_12h_percent_immature_granulocyte_measured,1,"Measurement frequency of immature granulocyte % is mainly a monitoring/acuity proxy rather than a renal physiology signal. Early (0–12h) and highly indirect for predicting Hour-60 creatinine ratio, so low sparse-selection priority."
13_24h_percent_immature_granulocyte_measured,1,"Counts how often immature granulocyte % was checked, reflecting clinician concern/infection workup intensity more than kidney function. Adds little unique value for AKI prediction versus direct renal/hemodynamic features."
25_36h_percent_immature_granulocyte_measured,2,"Later measurement frequency may weakly proxy evolving complications (e.g., sepsis) that can contribute to AKI. Still indirect and behavior-driven, so unlikely to survive sparse selection unless few other severity markers exist."
0_12h_teg_fibrinolysis_measured,1,"Whether TEG fibrinolysis was measured reflects bleeding/coagulopathy evaluation and practice patterns. It is not a direct renal signal and is early/noisy post-op, so minimal unique predictive value for creatinine ratio."
13_24h_teg_fibrinolysis_measured,1,TEG fibrinolysis measurement is a clinician-behavior proxy for hemostasis concerns rather than kidney injury. Unlikely to add independent signal beyond transfusion/bleeding/hemodynamics in a sparse model.
25_36h_teg_fibrinolysis_measured,2,"Late TEG measurement may indicate ongoing bleeding/transfusion needs that can secondarily affect renal perfusion. Still indirect and dominated by more proximal renal/hemodynamic variables, so only weak priority."
0_12h_creatinine_ratio_mean,3,"Average early post-op creatinine ratio captures immediate renal response but is susceptible to dilution and bypass-related noise. Useful, but dominated by later windows and by extreme/trajectory summaries for sparse selection."
13_24h_creatinine_ratio_mean,4,"Mean creatinine ratio at 13–24h reflects early AKI trajectory after initial post-op noise settles. Strong predictor of later (Hour-60) creatinine ratio, though somewhat redundant with max in the same/nearer window."
25_36h_creatinine_ratio_mean,5,Mean creatinine ratio at 25–36h is the closest available direct renal function marker to the Hour-60 target and captures sustained dysfunction. High unique predictive value and likely to survive sparse screening.
0_12h_creatinine_ratio_max,3,Peak early creatinine ratio can capture an acute renal insult but may reflect transient peri-bypass effects and fluid shifts. Informative yet less reliable than later peaks/means for Hour-60 prediction.
13_24h_creatinine_ratio_max,4,"Peak creatinine ratio at 13–24h captures worsening AKI signal better than the mean and is temporally closer to the outcome. Strong candidate, though partially redundant with 25–36h creatinine summaries."
25_36h_creatinine_ratio_max,5,"Peak creatinine ratio at 25–36h is a near-direct indicator of evolving AKI immediately preceding the prediction horizon. Extremes often outperform means for capturing injury, making this a top sparse-model feature."
0_12h_creatinine_ratio_min,1,Minimum early creatinine ratio is often driven by hemodilution and perioperative fluid shifts rather than improved renal function. Provides little actionable signal for later AKI compared with max/mean measures.
13_24h_creatinine_ratio_min,1,Minimum creatinine ratio in 13–24h is less pathophysiologically aligned with AKI risk than rising/peak values. Likely redundant/noisy and unlikely to be selected in a sparse model.
25_36h_creatinine_ratio_min,2,"Minimum creatinine ratio at 25–36h may reflect dilution or recovery, but it is generally less predictive of subsequent worsening than mean/max. Some potential trajectory information, yet dominated by max/mean in the same window."
0_12h_creatinine_ratio_measured,2,Frequency of creatinine measurement early post-op is mostly a monitoring-intensity proxy (sicker patients get checked more). It may add weak severity information but is indirect and redundant with actual creatinine values.
13_24h_creatinine_ratio_measured,2,"Count/frequency of creatinine ratio measurements in 13–24h, mainly reflecting monitoring intensity/clinician concern. Weak, indirect proxy and likely redundant with actual creatinine values/trajectory, so low sparse-selection priority."
25_36h_creatinine_ratio_measured,2,"Frequency of creatinine ratio measurements in 25–36h, closer to the Hour-60 target but still a monitoring-intensity proxy. May add a small signal of evolving AKI concern, yet dominated by physiologic/lab features, so remains low priority."
0_12h_x25_percent_albumin_dose_total_12h,2,"Whether hyperoncotic (25%) albumin was given in the immediate 0–12h post-op period, often for hypotension/third spacing. Early and largely a clinician-behavior/severity proxy with confounding by indication, so weak unique value."
13_24h_x25_percent_albumin_dose_total_12h,3,"Indicator of 25% albumin use in 13–24h, suggesting ongoing hemodynamic/volume management issues that can relate to renal hypoperfusion. Still confounded and proxy-like, but more temporally informative than 0–12h."
25_36h_x25_percent_albumin_dose_total_12h,3,"Indicator of 25% albumin use in 25–36h, closest window and may mark persistent instability/diuretic resistance relevant to AKI risk. However it is treatment-driven and overlaps with other severity/hemodynamic signals, so moderate priority."
0_12h_albumin_5_percent_dose_total_12h,2,"Total dose of 5% albumin in 0–12h, reflecting early resuscitation/oncotic support after surgery. Early post-op fluid shifts and strong confounding by indication limit unique predictive value for Hour-60 creatinine ratio."
13_24h_albumin_5_percent_dose_total_12h,3,"Total 5% albumin dose in 13–24h, capturing ongoing volume support needs that may correlate with renal hypoperfusion or capillary leak. Still largely a management proxy and potentially redundant with net fluid balance/hemodynamics, so moderate."
25_36h_albumin_5_percent_dose_total_12h,3,"Total 5% albumin dose in 25–36h, temporally closest and may reflect persistent intravascular depletion/vasoplegia relevant to AKI evolution. Confounding by clinician choice and overlap with other resuscitation markers keep it from top-tier."
0_12h_acetaminophen_codeine_dose_total_12h,1,"Analgesic (acetaminophen-codeine) dose in 0–12h, primarily reflecting pain control and sedation strategy. Minimal mechanistic link to AKI and likely noise/redundant with general care patterns."
13_24h_acetaminophen_codeine_dose_total_12h,1,"Acetaminophen-codeine dose in 13–24h, a pain-management variable with weak and indirect relation to renal outcomes. Unlikely to survive sparse selection given stronger physiologic predictors."
25_36h_acetaminophen_codeine_dose_total_12h,1,"Acetaminophen-codeine dose in 25–36h, still mainly a comfort/step-down care marker rather than renal physiology. Any association would be confounded by recovery trajectory and not uniquely predictive."
0_12h_acetaminophen_dose_total_12h,1,"Total acetaminophen dose in 0–12h, reflecting routine post-op analgesia/antipyresis. Little direct renal signal and high redundancy with general care intensity."
13_24h_acetaminophen_dose_total_12h,1,"Total acetaminophen dose in 13–24h, largely protocol-driven and not a meaningful AKI precursor. Very low sparse-model value compared with hemodynamics/labs."
25_36h_acetaminophen_dose_total_12h,1,"Total acetaminophen dose in 25–36h, more reflective of comfort care and ability to take non-opioid analgesia than kidney injury. Weak, indirect, and likely non-robust predictor."
0_12h_allopurinol_dose_total_12h,1,"Allopurinol dose in 0–12h, typically continuation of chronic gout therapy rather than an acute ICU intervention. Minimal near-term relationship to postoperative creatinine trajectory and likely sparse-model discard."
13_24h_allopurinol_dose_total_12h,1,"Allopurinol dose in 13–24h, again mostly a home-med continuation marker. Weak, indirect association with AKI risk and unlikely to add unique predictive value."
25_36h_allopurinol_dose_total_12h,1,"Allopurinol use in this window mainly reflects chronic gout/hyperuricemia management rather than acute renal physiology. It is a weak, indirect proxy and unlikely to add unique predictive value for Hour-60 creatinine ratio in a sparse model."
0_12h_aminocaproic_acid_dose_total_12h,2,Aminocaproic acid is an antifibrinolytic typically tied to intra/post-op bleeding risk and surgical practice patterns. In the immediate 0–12h window it is mostly a clinician-behavior/procedure proxy and only weakly linked to later AKI risk.
13_24h_aminocaproic_acid_dose_total_12h,2,"Continued aminocaproic acid suggests ongoing bleeding concern or re-exploration risk, which can correlate with illness severity and transfusion exposure. Still indirect and likely dominated by more direct hemodynamic/renal markers, so low sparse-selection priority."
25_36h_aminocaproic_acid_dose_total_12h,2,"Late aminocaproic acid use may indicate persistent bleeding/complex course closer to the target time. It remains an indirect proxy (practice/bleeding) rather than a renal signal, so only modest value even with better timing."
0_12h_amiodarone_dose_total_12h,2,"Amiodarone use early post-op reflects atrial/ventricular arrhythmia prophylaxis or treatment and overall instability. In 0–12h it is noisy and indirect for renal outcomes, and likely redundant with direct hemodynamic/vasopressor features."
13_24h_amiodarone_dose_total_12h,2,Amiodarone in 13–24h suggests ongoing arrhythmia burden that can affect cardiac output and renal perfusion. Still a downstream treatment proxy and typically weaker than direct perfusion/pressors/lactate signals for sparse selection.
25_36h_amiodarone_dose_total_12h,3,"Amiodarone closer to Hour 60 may capture persistent arrhythmias/low-output physiology that can contribute to evolving AKI. Among the amiodarone epochs this is the most temporally relevant, but it remains indirect and treatment-driven."
0_12h_amlodipine_dose_total_12h,1,"Amlodipine administration is usually continuation of chronic antihypertensive therapy and not an acute renal biomarker. Early post-op dosing is inconsistent and largely unrelated to AKI trajectory, so minimal sparse-model value."
13_24h_amlodipine_dose_total_12h,1,Amlodipine in this window mainly reflects medication reconciliation/ability to take PO rather than renal physiology. It is a weak proxy and unlikely to survive sparse feature selection.
25_36h_amlodipine_dose_total_12h,1,"Late amlodipine use may indicate clinical stability and resumption of home meds, but that is a nonspecific proxy. It provides little unique information about impending creatinine rise compared with direct renal/perfusion variables."
0_12h_ampicillin_dose_total_12h,1,Ampicillin use is driven by infection prophylaxis/empiric therapy choices rather than kidney function. In 0–12h it is mostly practice-pattern noise and not a strong predictor of Hour-60 creatinine ratio.
13_24h_ampicillin_dose_total_12h,2,"Ongoing ampicillin may reflect suspected infection/sepsis, which can increase AKI risk via inflammation and hypotension. Still indirect and treatment-driven, so low priority unless infection variables are otherwise absent."
25_36h_ampicillin_dose_total_12h,2,"Ampicillin closer to the target may indicate evolving infection, a plausible contributor to AKI risk. However it remains a nonspecific clinician-choice proxy and is typically dominated by direct hemodynamics, lactate, and renal labs."
0_12h_angiotensin_ii_dose_total_12h,3,"Angiotensin II use indicates refractory vasodilatory shock and severe hemodynamic compromise, which is relevant to renal hypoperfusion. In 0–12h it may be confounded by immediate post-bypass instability, but still a strong severity signal."
13_24h_angiotensin_ii_dose_total_12h,4,"Angiotensin II requirement in 13–24h suggests persistent vasoplegia/shock, a key precursor to AKI and creatinine rise. This is a relatively unique high-severity vasopressor signal likely to survive sparse selection."
25_36h_angiotensin_ii_dose_total_12h,5,"Angiotensin II use in 25–36h is a near-term marker of ongoing refractory shock and renal hypoperfusion close to the Hour-60 outcome. Within this batch it is the strongest, most temporally aligned indicator of high AKI risk and adds unique predictive value."
0_12h_apixaban_dose_total_12h,1,Early postoperative apixaban exposure mainly reflects anticoagulation strategy/bleeding-thrombosis risk rather than renal physiology. In a sparse AKI model it is an indirect clinician-behavior proxy and likely low-prevalence/noisy in the first 12h.
13_24h_apixaban_dose_total_12h,2,"Apixaban dosing in this window may weakly proxy recovery trajectory (able to take/receive anticoagulation) and renal dosing considerations. Still indirect and typically dominated by direct hemodynamics/renal markers, so low sparse-selection priority."
25_36h_apixaban_dose_total_12h,2,Later apixaban exposure is closer to the outcome and may reflect stability and renal function sufficient for anticoagulation decisions. However it remains a treatment/selection proxy with limited unique signal versus direct kidney perfusion and lab features.
0_12h_aspirin_dose_total_12h,1,Immediate postoperative aspirin use is largely protocol-driven (graft patency) and not a direct AKI precursor. Early timing and high routine use make it unlikely to add unique predictive value in a sparse model.
13_24h_aspirin_dose_total_12h,1,Aspirin dosing here mostly reflects standard post-cardiac surgery care rather than evolving renal dysfunction. Minimal expected incremental signal for creatinine_ratio beyond stronger physiologic variables.
25_36h_aspirin_dose_total_12h,1,Later aspirin administration remains largely routine and weakly connected to kidney injury mechanisms at this horizon. Low uniqueness and high redundancy with general care pathways argue against inclusion.
0_12h_atorvastatin_dose_total_12h,1,"Early statin administration reflects chronic therapy continuation and institutional practice, not acute renal hypoperfusion or injury. Any association with AKI is indirect and unlikely to survive sparse selection."
13_24h_atorvastatin_dose_total_12h,1,Atorvastatin dosing in this window is a weak proxy for overall stability/med reconciliation rather than kidney trajectory. Low expected marginal predictive value for Hour-60 creatinine ratio.
25_36h_atorvastatin_dose_total_12h,1,Later statin dosing still primarily indicates routine secondary prevention rather than AKI evolution. Not a direct renal signal and likely redundant with broader severity indicators.
0_12h_bisacodyl_dose_total_12h,1,Bisacodyl use is a bowel regimen marker and mainly reflects sedation/immobility and nursing practice. It is an indirect care-pattern proxy with little mechanistic link to creatinine rise.
13_24h_bisacodyl_dose_total_12h,1,Bisacodyl administration here continues to reflect supportive care rather than renal perfusion or injury. Unlikely to add unique predictive information in a sparse linear model.
25_36h_bisacodyl_dose_total_12h,1,Later bisacodyl use may weakly correlate with prolonged ICU stay but remains a nonspecific clinician-behavior proxy. Low priority versus direct renal/hemodynamic features.
0_12h_bivalirudin_dose_total_12h,2,"Bivalirudin use early may indicate HIT concern/ECMO or complex anticoagulation, which correlates with higher illness severity and AKI risk. Still largely a treatment/complexity proxy and early window is noisy."
13_24h_bivalirudin_dose_total_12h,3,"Ongoing bivalirudin in 13–24h can mark persistent high-acuity support (e.g., mechanical circulatory support/HIT) associated with renal hypoperfusion and AKI. It may contribute unique severity information compared with routine meds, though still indirect."
25_36h_bivalirudin_dose_total_12h,3,"Bivalirudin use closest to the outcome can signal sustained critical illness/advanced support, which is strongly associated with subsequent creatinine rise. While not a direct biomarker, it may add unique high-acuity signal within this medication-heavy batch."
0_12h_bumetanide_dose_total_12h,4,"Early bumetanide dosing reflects diuretic requirement/diuretic responsiveness and attempts to manage volume status, which are closely tied to renal perfusion and evolving AKI. Despite some confounding by clinician behavior, it is a relatively kidney-adjacent signal and one of the strongest candidates in this batch."
13_24h_bumetanide_dose_total_12h,3,"Loop diuretic exposure reflecting diuretic resistance/volume overload management, which often co-tracks with evolving AKI. Moderately useful but partly a clinician-behavior proxy and dominated by the closer 25–36h window."
25_36h_bumetanide_dose_total_12h,4,"Loop diuretic dose in the closest window to the outcome, capturing ongoing oliguria/volume overload and attempts to manage worsening renal function. Strong sparse-model candidate as a near-term marker of evolving AKI/diuretic resistance, though still partly treatment-driven."
0_12h_calcium_acetate_dose_total_12h,1,"Phosphate binder use, typically reflecting pre-existing CKD/ESRD rather than acute postoperative renal trajectory. Early post-op timing and low prevalence make it a weak, mostly redundant comorbidity proxy for sparse selection."
13_24h_calcium_acetate_dose_total_12h,2,Continued phosphate binder use suggests underlying CKD and possibly hyperphosphatemia management. Some signal for baseline renal disease but largely redundant with baseline creatinine/CKD features and not a direct AKI marker.
