value,importance,reason
13_24h_ionized_calcium_measured,1,Ordering frequency for ionized calcium is typically protocolized in ICU care and not specific to renal injury risk. At most it reflects general instability rather than kidney-specific concern.
25_36h_ionized_calcium_measured,2,"More frequent ionized calcium checks late may indicate ongoing instability, transfusion, or vasopressor/CRRT consideration, which can correlate with AKI risk. Still a behavioral proxy, so capped low."
0_12h_magnesium_mean,1,Mean magnesium in the immediate post-op period is heavily influenced by routine repletion and dilutional effects and is not a direct AKI predictor. Early averages are particularly nonspecific.
13_24h_magnesium_mean,1,"Magnesium mean is not an established driver of AKI; abnormalities more often reflect supplementation, diuretics, or overall illness. Limited renal-specific prognostic value in this epoch."
25_36h_magnesium_mean,2,"Abnormal magnesium closer to outcome can reflect reduced renal clearance (hypermagnesemia) or ongoing losses/diuretics (hypomagnesemia), both correlating with severity and renal dysfunction. Mean remains less informative than extremes for detecting evolving renal impairment."
0_12h_magnesium_max,2,"An early magnesium peak can occur with aggressive replacement or reduced clearance and may weakly signal impaired renal handling. In 0–12h it is often iatrogenic/transient, so predictive value is limited."
13_24h_magnesium_max,1,"Hypermagnesemia is usually iatrogenic (replacement/renal clearance) and is not a primary driver of AKI; in this mid window it is a weak, nonspecific marker."
25_36h_magnesium_max,2,"Later hypermagnesemia can reflect reduced renal clearance and thus emerging kidney dysfunction, but it is indirect and often confounded by supplementation."
0_12h_magnesium_min,1,Early hypomagnesemia is common after CPB/diuresis and replacement practices; it has little direct mechanistic link to subsequent creatinine rise.
13_24h_magnesium_min,1,Mid-course low magnesium mainly reflects shifts/diuretics and treatment patterns rather than renal hypoperfusion or tubular injury.
25_36h_magnesium_min,1,Low magnesium late is still more consistent with diuresis/nutrition/repletion variability than a direct AKI signal; not a strong predictor of creatinine ratio.
0_12h_magnesium_measured,1,Measurement frequency is largely routine post-cardiac surgery electrolyte monitoring and is a weak behavioral proxy for acuity.
13_24h_magnesium_measured,1,Repeat magnesium checks in this phase are common ICU practice and do not specifically indicate impending AKI.
25_36h_magnesium_measured,1,"Even late, magnesium ordering frequency is nonspecific and more reflective of protocolized monitoring than targeted AKI concern."
0_12h_base_excess_mean,2,"Average base excess early is influenced by CPB, ventilation, and transfusion; it is an indirect marker of global perfusion/acid-base status with limited specificity for AKI."
13_24h_base_excess_mean,2,"Persistently abnormal mean base excess suggests ongoing metabolic acidosis and possible hypoperfusion, but averaging blunts the prognostic value versus extremes."
25_36h_base_excess_mean,3,"Sustained metabolic acidosis closer to hour 60 can reflect ongoing shock/poor perfusion and is an established risk context for AKI, though still indirect."
0_12h_base_excess_max,1,Alkalosis (high base excess) early is often due to ventilation/bicarbonate and is not a typical trigger for AKI; also less informative than acidosis extremes.
13_24h_base_excess_max,1,Higher base excess in this window is generally treatment/ventilation related and has weak linkage to renal injury compared with low base excess.
25_36h_base_excess_max,1,Late alkalosis is not a strong mechanistic predictor of AKI and is less relevant than low base excess (metabolic acidosis) for hypoperfusion-related injury.
0_12h_base_excess_min,3,"Early severe negative base excess captures acute metabolic acidosis from hypoperfusion/lactate during/after CPB, a known AKI risk context, though often transient in the first 12h."
13_24h_base_excess_min,3,"A low base excess minimum in the trajectory phase indicates episodic or persistent metabolic acidosis/hypoperfusion, which is an established risk factor for subsequent AKI."
25_36h_base_excess_min,4,"A very negative base excess in the 25–36h window reflects ongoing metabolic acidosis from hypoperfusion/lactate or shock, which is strongly linked to renal ischemia and subsequent AKI."
0_12h_base_excess_measured,1,Measurement frequency mainly reflects routine post-op ABG monitoring in the immediate period rather than a specific renal injury mechanism.
13_24h_base_excess_measured,1,"Ordering frequency is a weak behavioral proxy and is commonly protocol-driven in this phase, with limited specific signal for AKI risk."
25_36h_base_excess_measured,2,"More frequent ABGs late may indicate clinician concern for persistent shock/acid-base derangements, indirectly increasing AKI risk, but it is not a physiologic marker itself."
0_12h_direct_bilirubin_measured,1,Direct bilirubin ordering frequency early is typically routine post-op surveillance and is not a direct predictor of creatinine rise.
13_24h_direct_bilirubin_measured,1,Test frequency reflects monitoring behavior more than physiology; hepatic labs are not primary AKI drivers in this context.
25_36h_direct_bilirubin_measured,2,"Late increased bilirubin monitoring can signal evolving hepatic dysfunction/low-flow state (cardiorenal/hepatorenal physiology), which indirectly relates to AKI risk."
0_12h_wbc_mean,2,Early leukocytosis is common after cardiopulmonary bypass and stress; it has only an indirect association with AKI via inflammation/sepsis risk.
13_24h_wbc_mean,2,"Sustained leukocytosis may reflect ongoing inflammation or infection, which can contribute to AKI, but mean values are nonspecific."
25_36h_wbc_mean,3,"In the 25–36h window, persistent elevation suggests infection/SIRS or complications that can precipitate AKI, though it remains indirect and nonspecific."
0_12h_wbc_max,2,Peak WBC early is often a transient post-bypass inflammatory response; it is a weak-to-indirect predictor of later creatinine rise.
13_24h_wbc_max,2,"A higher peak WBC may indicate infection/inflammation, but in this mid-phase it is still nonspecific and not a direct renal marker."
25_36h_wbc_max,3,"A high WBC peak close to the outcome can indicate evolving sepsis or severe inflammation, which is a recognized contributor to AKI risk."
0_12h_wbc_min,1,Low WBC early is uncommon and often reflects baseline variation or dilution; it has little direct mechanistic link to AKI in this setting.
13_24h_wbc_min,1,WBC nadir is generally not a meaningful driver of renal hypoperfusion or nephrotoxicity and is a weak predictor of AKI.
25_36h_wbc_min,2,"A low WBC late could reflect severe illness/immunosuppression or marrow suppression and may correlate with infection risk, but the link to AKI is indirect."
0_12h_wbc_measured,1,"Measurement frequency mainly reflects routine post-op monitoring or nonspecific concern for infection/inflammation, not a direct AKI mechanism. Early (0–12h) ordering is common after cardiac surgery and weakly discriminative."
13_24h_wbc_measured,1,Ordering frequency is a behavioral proxy and is not a physiologic driver of renal injury. In 13–24h it may reflect evolving infection/SIRS concern but remains nonspecific for predicting creatinine rise.
25_36h_wbc_measured,2,"More frequent WBC checks late may indicate clinician concern for sepsis/SIRS, which can precipitate AKI via hypotension and inflammation. Still indirect and behavioral, so capped low."
0_12h_prothrombin_time_mean,2,"Coagulopathy can correlate with hepatic dysfunction, massive transfusion, or systemic illness that may accompany renal hypoperfusion, but PT itself is not a direct AKI marker. In the immediate post-bypass period, transient PT prolongation is common, limiting specificity."
25_36h_prothrombin_time_mean,3,"Persistently prolonged PT by 25–36h suggests ongoing hepatic dysfunction, shock, or consumptive coagulopathy, which often co-tracks with multi-organ failure and AKI risk. Mean is less informative than extremes but sustained abnormality can matter late."
0_12h_prothrombin_time_max,2,"A high PT early may reflect bleeding/transfusion, hemodilution, or bypass-related coagulopathy and can be associated with hemodynamic instability that contributes to AKI. However, early extremes are often transient and nonspecific."
25_36h_prothrombin_time_max,3,"A markedly prolonged PT close to the outcome window can indicate ongoing shock, liver injury, or severe systemic illness, all of which increase AKI risk through hypoperfusion/inflammation. Max captures acute severity better than mean/min, so it is the most relevant PT aggregation here."
0_12h_prothrombin_time_min,1,Low/normal PT is not a plausible trigger for AKI and provides little prognostic information. The minimum value is unlikely to capture pathology relevant to renal injury.
25_36h_prothrombin_time_min,1,The minimum PT in the window generally reflects periods of normal coagulation and does not indicate AKI risk. It is also redundant when max/mean are available.
0_12h_prothrombin_time_measured,1,PT measurement frequency is largely protocolized after cardiac surgery and reflects monitoring rather than renal pathophysiology. As a behavioral feature it should be scored low.
13_24h_prothrombin_time_measured,1,"More PT checks may reflect bleeding/anticoagulation management but is not a direct predictor of AKI. Behavioral proxy only, so low importance."
25_36h_prothrombin_time_measured,2,"Late repeated PT testing may indicate ongoing bleeding, liver dysfunction, or clinical deterioration, which can co-occur with AKI. Still indirect and behavioral, so capped at 2."
0_12h_nucleated_red_blood_cells_mean,2,"NRBCs can reflect severe physiologic stress, hypoxemia, or systemic inflammation, which may accompany renal hypoperfusion. In 0–12h post-op, elevations can be transient and nonspecific, so conservative scoring."
13_24h_nucleated_red_blood_cells_mean,2,"Persistent NRBCs suggest ongoing critical illness and impaired oxygen delivery, which can increase AKI risk indirectly. Mean values are less sensitive to acute insults than maxima."
25_36h_nucleated_red_blood_cells_mean,3,"NRBC presence close to hour 60 can be a marker of sustained hypoxia/shock severity and multi-organ dysfunction, which strongly correlates with subsequent AKI. Mean is still less specific than max but sustained elevation late is clinically concerning."
0_12h_nucleated_red_blood_cells_max,2,"An early NRBC spike may indicate acute hypoxemia or major physiologic stress during/after bypass, which can contribute to renal ischemia. However, in the immediate post-op window it is often nonspecific and may not persist."
13_24h_nucleated_red_blood_cells_max,2,"Elevated NRBCs reflect physiologic stress/hypoxemia/inflammation and overall illness severity, which can correlate with AKI risk. In the 13–24h window it is an indirect marker rather than a renal-specific driver."
25_36h_nucleated_red_blood_cells_max,3,"Persistently high NRBCs closer to the outcome suggest ongoing hypoxemia/low-flow state or severe systemic stress, which is more plausibly linked to renal hypoperfusion and AKI. Still indirect and non-specific compared with hemodynamics/renal labs."
0_12h_nucleated_red_blood_cells_min,1,A low/normal NRBC minimum is not a meaningful mechanism for AKI and is largely uninformative. Early (0–12h) values are also heavily confounded by perioperative transient changes.
13_24h_nucleated_red_blood_cells_min,1,"NRBC minimum does not capture the pathologic signal (which is elevation), so it has weak relevance to AKI prediction. Any association would be incidental."
25_36h_nucleated_red_blood_cells_min,1,The minimum NRBC value is not a marker of renal injury or hypoperfusion severity; elevations (max) are the clinically meaningful direction. Kept low to avoid redundancy with NRBC max.
0_12h_nucleated_red_blood_cells_measured,1,"Measurement frequency mainly reflects ordering behavior/acuity rather than a physiologic pathway to AKI. In the immediate post-op period, labs are often routine, limiting specificity."
13_24h_nucleated_red_blood_cells_measured,1,"How often NRBCs are measured is a weak proxy for clinician concern and not a direct AKI mechanism. Typically bundled with CBCs, so it is not specific for impending renal dysfunction."
25_36h_nucleated_red_blood_cells_measured,2,"More frequent measurement late may reflect escalating concern for anemia/hemolysis/hypoxemia or overall deterioration, which can co-occur with AKI. Still primarily a behavioral proxy, not a biomarker."
0_12h_glucose_mean,2,"Stress hyperglycemia is associated with worse outcomes and may contribute to oxidative/inflammatory injury, but early post-op glucose is heavily influenced by surgery, insulin protocols, and dextrose. Mean values dilute short severe excursions that are more clinically relevant."
13_24h_glucose_mean,2,"Sustained dysglycemia can reflect severity of illness and is associated with AKI risk, but it remains indirect and confounded by insulin management. Mean is less informative than extremes for acute insult."
25_36h_glucose_mean,3,Persistent hyperglycemia closer to hour 60 may indicate ongoing stress/infection/catecholamine exposure and is associated with higher AKI risk. Still indirect and less specific than hemodynamics or renal labs.
0_12h_glucose_max,2,"Severe hyperglycemic spikes can signal high stress response and are linked to adverse outcomes, but in 0–12h they are common and protocol-driven after cardiac surgery. Scored conservatively due to early-window confounding."
13_24h_glucose_max,3,A high glucose maximum in 13–24h suggests persistent stress response or inadequate control and has a clearer association with complications including AKI than mean values. Max captures the acute excursion better than mean for collinearity control.
25_36h_glucose_max,3,"Late hyperglycemic peaks may reflect ongoing critical illness, vasopressor/catecholamine exposure, or infection, all of which increase AKI risk. Max is preferred over mean as the more pathologic signal."
0_12h_glucose_min,2,"Hypoglycemia can indicate overtreatment or hepatic dysfunction and is associated with higher mortality, but it is not a primary AKI mechanism and early post-op values are protocol-influenced. Minimum captures the potentially harmful extreme better than mean."
13_24h_glucose_min,2,"Hypoglycemic episodes in 13–24h may reflect instability or aggressive insulin therapy and correlate with overall severity, but the link to AKI is indirect. Kept modest to avoid redundancy with glucose max/mean."
25_36h_glucose_min,2,"Hypoglycemia can reflect critical illness, hepatic dysfunction, or overly aggressive insulin therapy and is associated with worse outcomes, but it is not a direct driver/biomarker of AKI. As an extreme value close to the outcome window it may weakly signal instability."
0_12h_glucose_measured,1,Measurement frequency mainly reflects ICU protocol and clinician attention immediately post-op rather than renal physiology. In the 0–12h period it is especially routine after cardiac surgery.
13_24h_glucose_measured,1,Glucose check frequency is a behavioral/protocol marker and only weakly related to AKI risk. In 13–24h it still largely reflects standard glycemic management rather than kidney injury.
25_36h_glucose_measured,2,"More frequent glucose monitoring may indicate ongoing hemodynamic instability, high-dose insulin, or sepsis concern, which can co-occur with AKI risk. Still primarily a clinician-behavior proxy, so capped low."
0_12h_platelets_mean,2,"Thrombocytopenia can correlate with CPB-related inflammation/consumption and overall illness severity, indirectly relating to AKI risk. Mean values in the immediate 0–12h window are often transient and diluted by perioperative effects."
13_24h_platelets_mean,2,"Persistently lower platelets may reflect ongoing inflammation/consumption and severity of illness, which can accompany AKI. Mean aggregation is less informative than nadir for acute consumptive processes."
25_36h_platelets_mean,2,"Platelet trends later may reflect systemic inflammation or complications that co-occur with AKI, but platelets are not a direct renal biomarker. Mean is still less specific than the minimum for capturing clinically relevant thrombocytopenia."
0_12h_platelets_max,1,A high platelet maximum is rarely mechanistically linked to AKI and is often non-informative post-op. Also redundant given other platelet summaries.
13_24h_platelets_max,1,Platelet maxima do not capture the consumptive/thrombotic pathology most relevant to postoperative complications and AKI. Limited physiologic linkage and redundant with other platelet features.
25_36h_platelets_max,1,"Even close to the outcome window, a platelet maximum is not a meaningful predictor of renal hypoperfusion or tubular injury. Nadir/low platelets would be more clinically relevant."
0_12h_platelets_min,3,"A low platelet nadir can indicate CPB-related consumption, bleeding/transfusion burden, or early DIC-like physiology, which are associated with AKI risk. Scored conservatively because early post-op thrombocytopenia is common and may be transient."
13_24h_platelets_min,3,"A continued low platelet nadir in 13–24h suggests ongoing consumption/inflammation or complications, which correlates with higher AKI risk. Minimum captures pathology better than mean/max, so it is prioritized."
25_36h_platelets_min,4,"Late (25–36h) thrombocytopenia nadir is a stronger marker of ongoing systemic illness (e.g., sepsis, DIC, major bleeding/transfusion) that can directly worsen renal perfusion and contribute to AKI. As an extreme close to hour 60, it is a stronger leading indicator than mean/max."
0_12h_platelets_measured,1,"Platelet measurement frequency is largely routine post-cardiac surgery and reflects protocolized monitoring rather than kidney injury. Behavioral proxy only, especially in the immediate 0–12h period."
13_24h_platelets_measured,1,"More frequent platelet checks may reflect concern for bleeding or coagulopathy but is still a weak, non-specific behavioral marker for AKI. Capped low per measurement-frequency rule."
25_36h_platelets_measured,2,"Increased platelet monitoring late may indicate evolving bleeding/coagulopathy or sepsis concern, which can co-occur with AKI risk. Still primarily a clinician-suspicion proxy, so kept low."
0_12h_mean_corpuscular_hemoglobin_mean,1,Mean corpuscular hemoglobin (MCH) is not a direct marker of renal perfusion or tubular injury and is usually stable over short ICU timeframes. In the immediate 0–12h post-op period it adds little AKI-specific signal.
13_24h_mean_corpuscular_hemoglobin_mean,1,"MCH has minimal physiologic linkage to AKI risk compared with hemodynamics, urine output, creatinine, or nephrotoxins. The 13–24h mean is unlikely to reflect an actionable renal insult."
25_36h_mean_corpuscular_hemoglobin_mean,1,"Even close to the outcome window, MCH is not a recognized predictor of postoperative AKI and changes are more related to anemia/chronic indices than kidney injury. The mean aggregation further reduces any weak signal."
0_12h_mean_corpuscular_hemoglobin_max,1,An elevated MCH maximum is not a known trigger or marker of AKI after cardiac surgery. Extreme values are more likely analytic/hematologic variation than renal-pathophysiology.
13_24h_mean_corpuscular_hemoglobin_max,1,"MCH max does not capture a renal insult mechanism (e.g., hypotension, congestion, nephrotoxins). Any association would be indirect and likely confounded."
25_36h_mean_corpuscular_hemoglobin_max,1,"Near-term MCH maxima still lack a plausible direct pathway to creatinine rise at 60h. Prefer other extremes (MAP, lactate, creatinine, urine output) for AKI prediction."
0_12h_mean_corpuscular_hemoglobin_min,1,Low MCH reflects microcytosis/iron deficiency rather than acute postoperative renal hypoperfusion or injury. In 0–12h it is unlikely to change meaningfully or predict AKI.
13_24h_mean_corpuscular_hemoglobin_min,1,MCH minimum is not an established AKI risk factor; anemia severity is better captured by hemoglobin/hematocrit rather than MCH. Thus it provides weak incremental prognostic value.
25_36h_mean_corpuscular_hemoglobin_min,1,"Even as a leading indicator window, MCH min is not mechanistically tied to postoperative creatinine rise. Any signal would be redundant with broader anemia/bleeding variables."
0_12h_mean_corpuscular_hemoglobin_measured,1,"Measurement frequency mainly reflects CBC ordering patterns rather than renal physiology. In early post-op care CBCs are routine, so this is a weak acuity proxy."
13_24h_mean_corpuscular_hemoglobin_measured,1,"CBC/MCH rechecks are common post-cardiac surgery and usually driven by bleeding/anemia surveillance, not impending AKI. As a behavioral proxy it should be low importance."
25_36h_mean_corpuscular_hemoglobin_measured,1,More frequent MCH measurements do not specifically indicate renal concern and are typically bundled with routine CBCs. As a _measured feature it is at most a weak acuity marker.
0_12h_sodium_mean,2,"Dysnatremias can reflect fluid shifts, diuretic use, and neurohormonal stress, which correlate indirectly with illness severity and renal risk. However, in 0–12h post-op sodium changes are often transient/dilutional, so the mean is only weakly informative."
13_24h_sodium_mean,2,"Persistently abnormal sodium may indicate ongoing free-water imbalance, diuresis, or volume overload, indirectly relating to AKI risk. The mean aggregation and mid-epoch timing limit specificity for renal injury."
25_36h_sodium_mean,3,"By 25–36h, sustained hypo/hypernatremia more likely reflects ongoing fluid management issues (overload, aggressive diuresis) and severity that can accompany evolving AKI. Still indirect (not a kidney injury biomarker), but closer temporal proximity increases relevance."
0_12h_sodium_max,2,"A sodium maximum may capture hypernatremia from free-water deficit or hypertonic exposures, which can accompany hemodynamic stress and AKI risk. In the immediate post-op window it is often iatrogenic/transient, so importance remains modest."
13_24h_sodium_max,2,"Hypernatremia can reflect free-water deficit/diuresis and overall illness severity, which may correlate with AKI risk, but it is not a direct renal injury marker. In the 13–24h epoch it is a weaker, indirect signal."
25_36h_sodium_max,2,"Later hypernatremia may indicate ongoing dehydration, osmotic diuresis, or inadequate free-water replacement, which can worsen renal perfusion. Still, sodium is nonspecific for intrinsic AKI, so keep modest importance."
0_12h_sodium_min,2,Early hyponatremia post-cardiac surgery is often dilutional from bypass/fluids and not a specific AKI driver. It may weakly track severity/volume status but is conservative in the 0–12h window.
13_24h_sodium_min,2,"Hyponatremia can reflect fluid overload/low effective arterial volume and neurohormonal activation, which can accompany AKI risk. However it remains indirect and nonspecific in this mid-epoch."
25_36h_sodium_min,2,"Persistent or worsening hyponatremia closer to outcome may indicate ongoing fluid overload or low effective circulating volume, both associated with renal hypoperfusion. Still not a direct biomarker of AKI, so moderate-low."
0_12h_sodium_measured,1,"Measurement frequency mainly reflects routine ICU electrolyte monitoring immediately post-op rather than specific AKI physiology. As a behavioral proxy in 0–12h, it is unlikely to add meaningful signal."
13_24h_sodium_measured,1,Sodium checks are common standard-of-care and usually not ordered specifically for impending AKI. Frequency here is more workflow/acuity noise than renal-pathway information.
25_36h_sodium_measured,1,"Even late, sodium measurement frequency is typically routine and not a targeted response to suspected AKI compared with creatinine/urine output monitoring. Therefore minimal incremental prognostic value."
0_12h_teg_platelet_aggregation_measured,1,"Ordering TEG platelet aggregation primarily reflects bleeding/thrombosis management and antiplatelet effect assessment, not renal perfusion or nephrotoxicity. In the immediate post-op window it is not informative for creatinine rise."
13_24h_teg_platelet_aggregation_measured,1,"This test order indicates coagulation/platelet management rather than kidney injury risk. Any association with AKI would be indirect via overall complexity/bleeding, so very low importance."
25_36h_teg_platelet_aggregation_measured,1,Late ordering still reflects hemostasis/antiplatelet concerns and is not mechanistically linked to AKI. As a behavioral proxy it is weak and nonspecific.
0_12h_mean_corpuscular_hemoglobin_concentration_mean,1,MCHC is a red cell index with little direct relationship to renal perfusion or tubular injury; perioperative shifts are often lab/volume related. Mean values in 0–12h are unlikely to predict AKI.
13_24h_mean_corpuscular_hemoglobin_concentration_mean,1,MCHC does not capture anemia severity as well as hemoglobin/hematocrit and has no established link to AKI. The averaged value further reduces any potential signal.
25_36h_mean_corpuscular_hemoglobin_concentration_mean,1,"Even close to outcome, MCHC is not a recognized AKI predictor and is largely orthogonal to renal pathophysiology. Keep minimal importance."
0_12h_mean_corpuscular_hemoglobin_concentration_max,1,"An extreme MCHC is more likely due to measurement artifact, transfusion/hemoconcentration effects, or RBC morphology rather than kidney injury. In 0–12h it is not a meaningful AKI signal."
