value,importance,reason
13_24h_r_saturated_venous_o2_max,1,A high maximum venous O2 saturation is generally not a direct marker of renal hypoperfusion and is nonspecific. It is unlikely to improve prediction compared with low extremes.
0_12h_r_saturated_venous_o2_min,6,"A low minimum venous O2 saturation captures acute episodes of inadequate oxygen delivery/low cardiac output that can precipitate renal ischemia. Even in 0–12h this is a clinically meaningful insult, but capped by early-epoch conservatism."
13_24h_r_saturated_venous_o2_min,8,"Low minimum venous O2 saturation in 13–24h strongly suggests ongoing low cardiac output or shock physiology, a well-established driver of postoperative AKI. The minimum best captures the harmful hypoperfusion extreme and is close enough to reflect trajectory."
0_12h_r_saturated_venous_o2_measured,2,"More frequent SvO2 checks can reflect clinician concern for low output/shock, indirectly associated with AKI risk, but it is not a physiologic mechanism. As a _measured feature it should remain low."
13_24h_r_saturated_venous_o2_measured,2,"Increased measurement frequency may indicate hemodynamic instability prompting closer monitoring, which can correlate with AKI risk, but remains an indirect behavioral proxy. Therefore it should be kept low (1–3)."
25_36h_r_saturated_venous_o2_measured,3,"Measurement frequency reflects clinician concern/acuity (e.g., low cardiac output/shock workup) rather than a direct renal mechanism. As a _measured proxy it should stay low despite being in the closest epoch."
0_12h_r_maintenance_iv_volume_mean,3,"Average maintenance IV volume early post-op is common and often protocol-driven; it is an indirect proxy for volume status. Mean is less informative than extremes for renal hypoperfusion/overload, and 0–12h is highly transient."
13_24h_r_maintenance_iv_volume_mean,4,"Ongoing maintenance fluids may reflect evolving hemodynamics and attempts to support perfusion, but mean volume is still a blunt, treatment-driven signal. Extremes would better capture clinically meaningful under/over-resuscitation."
25_36h_r_maintenance_iv_volume_mean,4,"Closer to the outcome window, sustained maintenance fluid needs can correlate with instability and AKI risk, but mean volume remains collinear with max/min and is not a direct biomarker. Prefer extremes for capturing harmful fluid strategies."
0_12h_r_maintenance_iv_volume_max,5,High peak maintenance fluid rates can indicate aggressive resuscitation/vasoplegia and contribute to fluid overload and renal venous congestion. Still capped by early (0–12h) transient physiology and treatment confounding.
13_24h_r_maintenance_iv_volume_max,6,"A high peak maintenance fluid rate in the trajectory phase suggests persistent instability or ongoing resuscitation, which is associated with AKI via congestion and hemodilution/third spacing. Max better captures the insult than mean."
25_36h_r_maintenance_iv_volume_max,7,"Late high peak maintenance fluid rates suggest ongoing shock/vasoplegia or inability to wean support, often correlating with renal hypoperfusion and fluid overload. As an extreme close to hour 60, it is a stronger leading indicator."
0_12h_r_maintenance_iv_volume_min,2,"Low minimum maintenance fluid early post-op is often routine (e.g., keep-vein-open) and not a reliable marker of renal hypoperfusion. In 0–12h, transient practice variation dominates signal."
13_24h_r_maintenance_iv_volume_min,3,"A very low minimum maintenance rate could reflect fluid restriction or improved stability, but it is weakly linked to AKI and heavily practice-dependent. Min is generally less informative than max for capturing harmful fluid-related insults."
25_36h_r_maintenance_iv_volume_min,3,Late low minimum maintenance fluids may reflect restriction/diuresis strategies or stability; association with AKI is indirect and confounded by clinician intent. Min is not a strong physiologic trigger compared with hypotension/oliguria markers.
0_12h_r_maintenance_iv_volume_measured,1,"Measurement frequency is a documentation/ordering artifact rather than a physiologic driver of AKI. Early post-op charting is routine, so it provides minimal prognostic value."
13_24h_r_maintenance_iv_volume_measured,1,"How often maintenance IV volume is recorded mainly reflects workflow and monitoring intensity, not renal pathophysiology. As a _measured feature it should remain very low."
25_36h_r_maintenance_iv_volume_measured,2,"More frequent recording may indicate higher acuity or active titration of fluids, indirectly correlating with AKI risk, but it is still a behavioral proxy. Therefore it should remain low (within the 1–3 range)."
0_12h_r_an_pap_systolic_measured,2,"Having PAP monitoring measured suggests invasive hemodynamic monitoring for RV failure/PH/low output, which can relate to renal hypoperfusion, but it is not itself physiologic. As a measured/monitoring proxy in 0–12h, keep low."
13_24h_r_an_pap_systolic_measured,3,"Continued PAP monitoring in the trajectory phase can indicate persistent cardiopulmonary instability (e.g., RV dysfunction) that increases AKI risk via low cardiac output and venous congestion. Still a behavioral proxy, so capped low."
25_36h_r_an_pap_systolic_measured,3,"PAP monitoring persisting into 25–36h often reflects ongoing hemodynamic compromise, which is associated with AKI risk, but the feature is measurement presence rather than PAP value. As a _measured proxy it should remain in the 1–3 range."
0_12h_r_an_pap_diastolic_measured,2,"Measurement frequency mainly reflects monitoring intensity (e.g., PA catheter use) rather than renal physiology. Early post-op period is highly protocol-driven and transient."
13_24h_r_an_pap_diastolic_measured,2,Ordering/recording frequency is a weak proxy for acuity and does not directly encode renal perfusion or injury. Some association via shock concern is possible but indirect.
25_36h_r_an_pap_diastolic_measured,3,"Later continued PAP monitoring may reflect persistent hemodynamic instability/right heart dysfunction, which can contribute to renal congestion and AKI risk. Still a behavioral proxy, not a physiologic value."
0_12h_r_an_central_venous_pressure_measured,2,CVP measurement frequency reflects line presence and clinician concern rather than congestion itself. In the immediate post-op window it is often routine and not specific for AKI prediction.
13_24h_r_an_central_venous_pressure_measured,2,"More frequent CVP documentation may indicate ongoing hemodynamic management, but it is not a direct marker of renal hypoperfusion or injury. Thus only weak predictive value."
25_36h_r_an_central_venous_pressure_measured,3,"Persistent need to track CVP late may signal volume overload/right-sided failure and venous congestion, which is linked to AKI. However it remains a measurement-frequency proxy, so capped low."
0_12h_r_an_etco2_mean,3,"Mean EtCO2 is an indirect marker of ventilation/perfusion and cardiac output, but early post-op values are heavily influenced by ventilator settings and anesthesia. Not a primary AKI driver in this epoch."
13_24h_r_an_etco2_mean,4,"Sustained lower EtCO2 can reflect reduced pulmonary blood flow/cardiac output, which may reduce renal perfusion. Mean values still smooth extremes and are confounded by ventilation management."
25_36h_r_an_etco2_mean,5,"In the leading-indicator window, persistently low EtCO2 may better reflect ongoing low cardiac output/shock physiology relevant to renal hypoperfusion. Still indirect and influenced by ventilator changes."
0_12h_r_an_etco2_max,2,High EtCO2 extremes are more related to hypoventilation or increased CO2 production than AKI mechanisms. In the immediate post-op period this is commonly iatrogenic/transient.
13_24h_r_an_etco2_max,2,EtCO2 maxima are not a typical trigger or marker for AKI and are often driven by ventilator adjustments. Limited physiologic linkage to renal injury.
25_36h_r_an_etco2_max,2,"Even late, high EtCO2 is not a strong indicator of renal hypoperfusion or nephrotoxic exposure. It is generally less informative than low EtCO2 extremes for shock states."
0_12h_r_an_etco2_min,6,"Very low EtCO2 can indicate low cardiac output, pulmonary embolic physiology, or severe hypotension—states that can precipitate renal ischemia. Capped at 6 due to early post-op transient effects."
13_24h_r_an_etco2_min,7,Low EtCO2 extremes during the trajectory phase more plausibly reflect persistent low-flow states associated with AKI risk. Extremes capture acute insults better than means.
25_36h_r_an_etco2_min,8,"Low EtCO2 close to the outcome can be a strong indicator of ongoing low cardiac output/shock and impaired perfusion, which directly increases AKI risk. As an extreme, it captures clinically meaningful insults."
0_12h_r_an_etco2_measured,1,EtCO2 measurement frequency is largely routine for intubated patients and reflects monitoring practice rather than renal pathophysiology. Minimal specific signal for AKI prediction.
13_24h_r_an_etco2_measured,2,Measurement frequency mainly reflects monitoring intensity/acuity rather than a renal mechanism. ETCO2 checks may increase with ventilatory instability but are not specific for AKI.
25_36h_r_an_etco2_measured,2,"More frequent ETCO2 documentation suggests ongoing respiratory/hemodynamic concern but is a behavioral proxy, not a direct AKI driver. Kept low per _measured rule."
0_12h_r_an_fio2_mean,3,"Higher average FiO2 can reflect respiratory failure and overall illness severity, which correlates indirectly with AKI risk. Mean is less informative than extremes for acute hypoxemic insults and capped low to reduce redundancy."
0_12h_r_an_fio2_max,5,High peak FiO2 in the immediate postop period suggests significant hypoxemia/respiratory failure and systemic stress that can contribute to renal hypoperfusion. Scored conservatively due to 0–12h transient derangements (max 6).
0_12h_r_an_fio2_min,2,Low minimum FiO2 generally indicates periods of better oxygenation and is not a trigger for AKI. Provides limited pathologic signal compared with FiO2 max.
0_12h_r_an_fio2_measured,2,Frequency of FiO2 recording reflects ventilator management intensity rather than kidney injury physiology. Low importance per _measured rule.
13_24h_r_an_fio2_measured,2,More frequent FiO2 entries indicate ongoing respiratory management/acuity but are not specific predictors of creatinine rise. Low importance per _measured rule.
25_36h_r_an_fio2_measured,2,Represents clinician attention to oxygenation/ventilation rather than a direct renal insult. Low importance per _measured rule despite closer temporal proximity.
0_12h_r_an_tidal_volume_mean,2,"Average tidal volume is weakly related to AKI via ventilator-induced lung injury/inflammation and hemodynamic effects, but is not a primary driver. Mean is less informative than extremes and early postop values are often protocolized."
13_24h_r_an_tidal_volume_mean,3,"Sustained higher tidal volumes may reflect non-protective ventilation and greater systemic inflammation, indirectly increasing AKI risk. Mean remains a smoothed metric and thus modest importance."
25_36h_r_an_tidal_volume_mean,4,"Later sustained tidal volume may better reflect ongoing ventilatory strategy and severity, which can correlate with AKI through inflammation and venous congestion/hemodynamics. Still indirect and mean-based, so kept moderate."
0_12h_r_an_tidal_volume_max,4,"High peak tidal volumes can indicate aggressive ventilation or poor compliance, potentially contributing to inflammatory/hemodyamic stress linked to AKI. Scored conservatively due to 0–12h transient/protocol-driven ventilation (max 6)."
13_24h_r_an_tidal_volume_max,5,"Higher tidal volume peaks during the trajectory phase may signal ongoing lung injury or non-protective ventilation, indirectly associated with AKI. Extreme values are more informative than means for capturing injurious episodes."
25_36h_r_an_tidal_volume_max,6,"Late peaks in tidal volume may reflect persistent poor pulmonary mechanics or ventilator dyssynchrony requiring higher volumes, correlating with systemic stress and AKI risk. Extremes capture potentially injurious episodes better than mean."
0_12h_r_an_tidal_volume_min,1,"Low minimum tidal volume often reflects brief weaning, sedation changes, or measurement artifacts rather than a renal-relevant insult. Not a recognized AKI trigger."
13_24h_r_an_tidal_volume_min,2,Low minimum tidal volume may reflect weaning attempts or transient hypoventilation but has no strong direct link to AKI. Provides limited pathologic signal compared with tidal volume max.
25_36h_r_an_tidal_volume_min,3,"Low tidal volumes may reflect lung-protective ventilation or reduced respiratory drive rather than a direct renal insult. Ventilator strategy can influence venous return and renal perfusion indirectly, but tidal volume extremes are not a primary AKI driver."
0_12h_r_an_tidal_volume_measured,1,Measurement frequency is mainly a proxy for monitoring intensity and routine ventilator management in the immediate post-op period. It has no direct physiologic linkage to AKI.
13_24h_r_an_tidal_volume_measured,1,This reflects clinician monitoring/acuity rather than kidney perfusion or nephrotoxicity. It is unlikely to add specific prognostic information for creatinine rise.
25_36h_r_an_tidal_volume_measured,2,"More frequent ventilator documentation may indicate ongoing respiratory instability and higher illness severity, which can correlate with AKI risk. Still, it is a behavioral proxy and not a direct renal mechanism."
0_12h_r_an_abp_pulse_measured,2,ABP pulse measurement/documentation frequency reflects monitoring intensity early after surgery and is common in ICU care. It is not a direct marker of renal hypoperfusion.
13_24h_r_an_abp_pulse_measured,2,"More frequent ABP pulse monitoring may indicate hemodynamic concern, indirectly associated with AKI risk. As a measured feature, it remains a weak proxy rather than a physiologic driver."
25_36h_r_an_abp_pulse_measured,3,"In the later window, frequent ABP pulse monitoring can signal persistent hemodynamic instability requiring closer surveillance, which is associated with AKI. Still, it is an indirect behavioral indicator."
0_12h_r_an_heart_rate_measured,1,Heart rate measurement frequency is routine in the immediate post-op ICU period and mainly reflects standard monitoring. It does not directly capture renal perfusion or injury.
13_24h_r_an_heart_rate_measured,1,This is primarily a documentation/monitoring frequency variable rather than a physiologic exposure. It provides minimal specific signal for subsequent creatinine rise.
25_36h_r_an_heart_rate_measured,2,"Increased monitoring frequency may reflect ongoing instability (arrhythmias, shock) that can co-occur with AKI risk. As a measured feature, it remains a weak indirect proxy."
0_12h_r_an_abp_mean_measured,2,Frequent MAP documentation early post-op is common and reflects monitoring intensity rather than hypotension itself. It is only weakly informative as a proxy for hemodynamic concern.
13_24h_r_an_abp_mean_measured,2,"More frequent MAP checks may indicate clinician concern for hypotension/vasopressor needs, indirectly linked to AKI. As a measured feature, it should remain low importance."
25_36h_r_an_abp_mean_measured,3,"Closer MAP monitoring in the 25–36h window can indicate persistent hemodynamic instability, which is a strong AKI context even if this variable is only a proxy. It may modestly predict later creatinine rise via severity-of-illness signaling."
0_12h_anesthesia_respirations_measured,1,Respiration measurement frequency in the immediate post-op/anesthesia context is routine and not kidney-specific. It does not directly represent renal hypoperfusion or nephrotoxic exposure.
13_24h_anesthesia_respirations_measured,1,This is a monitoring/documentation frequency variable with minimal mechanistic connection to AKI. It is unlikely to add independent predictive value for creatinine_ratio.
25_36h_anesthesia_respirations_measured,2,"More frequent respiratory monitoring later may reflect ongoing critical illness (e.g., prolonged ventilation), which correlates with AKI risk. However, it remains an indirect behavioral proxy rather than a direct renal predictor."
0_12h_anesthesia_pulse_oximetry_measured,1,"Measurement frequency reflects routine monitoring rather than a renal mechanism. In the immediate 0–12h post-op period it mainly indicates standard ICU/anesthesia practice, not AKI risk."
13_24h_anesthesia_pulse_oximetry_measured,1,Ordering/recording frequency is a behavioral proxy and usually routine in ICU patients. It does not directly capture hypoxemia severity or renal perfusion.
25_36h_anesthesia_pulse_oximetry_measured,1,"Still a monitoring-frequency variable rather than oxygenation physiology. Even late, it is unlikely to add specific prognostic information for creatinine rise."
0_12h_r_tube_intake_measured,2,Tube intake documentation frequency may reflect feeding initiation or GI tolerance rather than kidney injury. Any link to AKI is indirect (overall illness severity) and early post-op is highly protocol-driven.
13_24h_r_tube_intake_measured,2,More frequent tube intake entries can reflect closer nursing attention/acuity but not renal physiology. Association with AKI would be weak and confounded by care patterns.
25_36h_r_tube_intake_measured,2,"Late documentation frequency may correlate with ongoing critical illness but remains an indirect, non-mechanistic proxy. Not a strong predictor of creatinine_ratio compared with hemodynamics/renal labs."
0_12h_r_maintenance_iv_bolus_volume_mean,4,Average bolus volume is a crude marker of resuscitation needs but smooths over hypotensive episodes and is collinear with extremes/total volume. Early post-op fluids are common and may not reflect sustained renal hypoperfusion.
0_12h_r_maintenance_iv_bolus_volume_max,6,"A large bolus requirement can indicate acute hemodynamic instability/vasoplegia with renal hypoperfusion risk. In 0–12h this is common post-CPB, but extreme resuscitation needs still signal higher AKI risk (capped at 6 by epoch rule)."
0_12h_r_maintenance_iv_bolus_volume_min,2,Minimum bolus volume is not clinically meaningful for AKI risk and largely reflects periods with no bolus given. It does not capture the pathologic insult (shock/resuscitation).
0_12h_r_maintenance_iv_bolus_volume_measured,2,Frequency of bolus documentation is a care-intensity proxy rather than a physiologic driver. It may weakly reflect instability but is heavily protocol- and workflow-dependent.
13_24h_r_maintenance_iv_bolus_volume_measured,2,Measurement frequency indicates ongoing resuscitation attention but not the magnitude of shock or fluid exposure. As a behavioral proxy it should remain low importance.
25_36h_r_maintenance_iv_bolus_volume_measured,3,"Late frequent bolus entries may suggest persistent instability closer to the 60h creatinine outcome, but it is still a non-mechanistic proxy. Kept low per measured-feature rule."
0_12h_r_pacemaker_mean,4,"Need for pacing can reflect conduction disease/low cardiac output states that reduce renal perfusion, but early post-op pacing is often transient and routine. Mean pacing over 0–12h is less informative than presence/peak need."
13_24h_r_pacemaker_mean,5,Persistent pacing requirement into 13–24h may indicate ongoing cardiac dysfunction or bradyarrhythmia affecting renal perfusion. Mean value still dilutes episodic dependence but has moderate relevance.
25_36h_r_pacemaker_mean,6,"Ongoing pacing requirement close to outcome suggests persistent hemodynamic compromise and potential low cardiac output, a known AKI driver after cardiac surgery. Mean pacing is moderately informative though not a direct renal biomarker."
0_12h_r_pacemaker_max,6,"Any peak/presence of pacing early post-op can mark significant conduction issues or low output requiring support, which can impair renal perfusion. In 0–12h this is common but still a strong signal of early instability (capped at 6 by epoch rule)."
13_24h_r_pacemaker_max,4,"Need for pacing suggests conduction disease/low cardiac output risk, which can reduce renal perfusion, but it is an indirect marker and not kidney-specific. In this mid window, it adds limited incremental AKI signal."
25_36h_r_pacemaker_max,5,"Ongoing pacing requirement closer to hour 60 can indicate persistent hemodynamic compromise (e.g., low output/bradyarrhythmia) that threatens renal perfusion. Still indirect and heterogeneous in meaning."
0_12h_r_pacemaker_min,3,"Immediate post-op pacing is common and often transient after cardiac surgery, so it is a weak, nonspecific proxy for renal hypoperfusion. Early window capped by transient physiology."
13_24h_r_pacemaker_min,4,"Continued pacing need into 13–24h may reflect failure to stabilize hemodynamics, which can contribute to AKI risk. However, it remains an indirect marker and not a direct renal insult."
25_36h_r_pacemaker_min,5,"Persistent pacing requirement in the 25–36h leading-indicator window can correlate with ongoing low cardiac output or bradycardia-related hypoperfusion, increasing AKI risk. Not definitive because pacing may be prophylactic or protocol-driven."
0_12h_r_pacemaker_measured,2,Measurement frequency reflects monitoring/acuity rather than a physiologic mechanism for AKI. Early post-op monitoring is routine and not specific for impending renal injury.
13_24h_r_pacemaker_measured,2,"More frequent documentation/measurement mainly indicates clinician attention and ICU complexity, not a direct driver of creatinine rise. Limited specificity for AKI."
25_36h_r_pacemaker_measured,3,"Increased measurement frequency late may reflect concern for instability, which can co-occur with AKI risk, but it remains a behavioral proxy. Kept low per measured-feature rule."
0_12h_r_sled_crrt_maintenance_blood_pump_rate_measured,3,"Ordering/recording CRRT/SLED pump parameters implies severe illness and possible early renal dysfunction, but this is still a measurement-frequency proxy. In 0–12h it may reflect perioperative instability rather than established AKI trajectory."
13_24h_r_sled_crrt_maintenance_blood_pump_rate_measured,3,"Documentation of SLED/CRRT maintenance suggests significant renal support consideration and high acuity, which correlates with later creatinine rise. Still not a physiologic value and scored low per rules."
25_36h_r_sled_crrt_maintenance_blood_pump_rate_measured,3,"Late-window recording of CRRT/SLED maintenance is a strong contextual clue of renal failure risk, but as a 'measured' feature it remains a behavioral/therapy proxy rather than a direct biomarker. Capped at 3."
0_12h_r_an_agents_sevoflurane_measured,1,"Sevoflurane exposure/recording is not a strong established predictor of postoperative AKI compared with hemodynamics, nephrotoxins, and renal labs. Measurement frequency largely reflects routine anesthesia documentation."
13_24h_r_an_agents_sevoflurane_measured,1,Sevoflurane is typically intraoperative/early post-op; later measurement is uncommon and not mechanistically linked to AKI prediction. Primarily documentation noise.
25_36h_r_an_agents_sevoflurane_measured,1,Sevoflurane measurement this late is unlikely to represent a meaningful renal risk factor and is not kidney-specific. Kept minimal per measured-feature rule.
0_12h_intravenous_intake_measured,2,Measurement frequency of IV intake reflects charting intensity and fluid management attention rather than a direct renal insult. Early post-op intake tracking is routine and nonspecific for AKI.
13_24h_intravenous_intake_measured,2,More frequent IV intake measurement indicates acuity/complex fluid management but does not itself capture fluid overload or hypovolemia (the physiologic drivers). Scored low as a measured feature.
25_36h_intravenous_intake_measured,2,"Measurement frequency reflects clinician attention/acuity rather than renal physiology; higher ordering may correlate with instability but is indirect. Per rules, _measured features should be low unless strongly AKI-specific."
0_12h_r_drain_output_measured,1,"Counting drain output measurements is a care-process marker and not a direct driver of renal injury. Early post-op (0–12h) also has many routine checks, further limiting specificity."
13_24h_r_drain_output_measured,1,Drain measurement frequency is not a physiologic AKI mechanism and mainly reflects routine monitoring or bleeding concern. As a _measured feature it should remain low.
25_36h_r_drain_output_measured,2,"More frequent drain checks late may indicate ongoing bleeding/hemodynamic concern that could secondarily affect renal perfusion, but it remains an indirect behavioral proxy. Kept low per _measured rule."
0_12h_slehs_r_arrival_time_measured,1,"Arrival time documentation/measurement is administrative and has no meaningful physiologic link to AKI. Also a _measured feature, so minimal importance."
13_24h_slehs_r_arrival_time_measured,1,This is an administrative/process variable rather than a renal perfusion or nephrotoxin exposure marker. No plausible direct relationship to creatinine rise.
25_36h_slehs_r_arrival_time_measured,1,Administrative timing/measurement does not capture kidney injury risk or hemodynamics. Not clinically informative for predicting creatinine_ratio.
0_12h_cardiac_rythym_normal_sinus_mean,3,"Sustained normal sinus rhythm may correlate with better cardiac output and renal perfusion, but mean rhythm status is an indirect proxy and early post-op arrhythmias are often transient. Capped lower to avoid redundancy with extreme/any-NSR indicators."
13_24h_cardiac_rythym_normal_sinus_mean,4,"Persistent non-sinus rhythm in this trajectory phase can reflect atrial fibrillation/low output states that may reduce renal perfusion, but mean aggregation is still indirect. Kept modest to reduce collinearity with max/min indicators."
