value,importance,reason
25_36h_base_excess_measured,3,"More frequent acid-base assessment late (25–36h) can indicate ongoing hemodynamic/respiratory instability that raises AKI risk, but it is still an indirect proxy. Scored higher than earlier epochs due to closer proximity to the creatinine outcome."
0_12h_direct_bilirubin_measured,1,Direct bilirubin measurement frequency is largely driven by routine post-op labs or hepatic concern and is not a direct AKI mechanism. In the immediate 0–12h period it is especially nonspecific.
13_24h_direct_bilirubin_measured,1,Ordering frequency reflects clinician suspicion of cholestasis/hemolysis rather than renal injury. It provides minimal incremental signal for AKI risk.
25_36h_direct_bilirubin_measured,2,"Late repeated bilirubin checks may indicate persistent multi-organ dysfunction (e.g., low-flow state) which correlates with AKI risk, but remains indirect. As a measured-count feature it is capped low."
0_12h_wbc_mean,3,Average leukocytosis early after cardiac surgery is common from stress/inflammation and is only indirectly linked to AKI via systemic inflammatory response. Mean values smooth peaks and are less informative than extremes.
13_24h_wbc_mean,4,"Persistently elevated mean WBC in the trajectory phase can suggest ongoing inflammation/infection, which increases AKI risk through sepsis physiology. Mean is still less specific than max/min."
25_36h_wbc_mean,5,"Sustained leukocytosis closer to hour 60 can reflect infection/SIRS and evolving organ dysfunction, both associated with AKI. Mean is moderately informative but less than extreme derangements."
0_12h_wbc_max,4,"A high peak WBC may indicate a stronger inflammatory response, which can contribute to AKI risk, but early post-op peaks are often transient and nonspecific. Max is preferred over mean for capturing acute insult, within the 0–12h score cap."
13_24h_wbc_max,6,A high WBC peak in 13–24h is more concerning for infection or significant inflammation than immediate post-op stress response and is linked to AKI via sepsis/hemodynamic effects. Max captures the clinically relevant extreme better than mean.
25_36h_wbc_max,7,"A high WBC peak in the 25–36h window is a strong marker of evolving infection/SIRS near the outcome time, which is a common pathway to AKI. Max captures the acute inflammatory extreme most relevant for risk."
0_12h_wbc_min,2,Low WBC early is uncommon and may reflect hemodilution or lab variability; it is not a primary AKI driver. Min is generally less informative here than max for AKI-related pathology.
13_24h_wbc_min,3,"Leukopenia can occur with severe infection or marrow suppression and may correlate with critical illness that predisposes to AKI, but it is indirect. Min is less specific than max for typical post-op AKI pathways."
25_36h_wbc_min,4,"Late leukopenia can be a marker of severe sepsis or profound illness, which increases AKI risk through shock and inflammation. Still an indirect predictor and generally weaker than WBC max."
0_12h_wbc_measured,2,Measurement frequency mainly reflects clinician concern/inflammation monitoring rather than a direct AKI mechanism; early post-op labs are routine. As a _measured feature it should stay low.
13_24h_wbc_measured,2,"Ordering frequency is a weak proxy for acuity/infection workup, which can relate indirectly to AKI via sepsis. Still behavioral and not physiologic, so low."
25_36h_wbc_measured,3,More frequent WBC checks late may reflect evolving infection/SIRS or clinical deterioration that can precipitate AKI. As a _measured feature it remains capped low.
0_12h_prothrombin_time_mean,3,"Coagulopathy early after CPB/transfusion is common and often transient; it is an indirect marker of severity/bleeding risk rather than renal injury. Mean is less informative than extremes for acute insults, so kept low."
25_36h_prothrombin_time_mean,4,"Persistently prolonged PT later can indicate hepatic dysfunction, ongoing critical illness, or massive transfusion/bleeding risk that may contribute to renal hypoperfusion. Mean is still less specific than the max for capturing pathologic coagulopathy."
0_12h_prothrombin_time_max,5,"A high PT peak early can reflect significant coagulopathy/bleeding/transfusion burden and overall shock severity, which can reduce renal perfusion. In 0–12h this is capped conservatively despite being the most relevant aggregation."
25_36h_prothrombin_time_max,6,"A high PT peak in the 25–36h window suggests ongoing coagulopathy/critical illness (e.g., hepatic congestion, DIC, continued bleeding) associated with hypotension/transfusion and AKI risk. Max best captures the pathologic extreme compared with mean/min."
0_12h_prothrombin_time_min,1,A low/normal PT minimum is not a plausible driver of AKI and mainly reflects periods without coagulopathy. Min does not capture the harmful physiology here.
25_36h_prothrombin_time_min,1,The minimum PT value is not clinically meaningful for AKI prediction compared with prolonged PT episodes. It adds redundancy without capturing the insult.
0_12h_prothrombin_time_measured,2,PT ordering frequency is largely routine post-cardiac surgery and reflects monitoring/transfusion management rather than renal physiology. As a _measured feature it should remain low.
13_24h_prothrombin_time_measured,2,"More frequent PT checks may indicate bleeding/coagulopathy management, indirectly linked to AKI via shock/transfusion. Still a behavioral proxy, so low."
25_36h_prothrombin_time_measured,3,"Late frequent PT monitoring can signal ongoing bleeding/coagulopathy or deterioration, which can co-occur with AKI risk. As a _measured feature it remains capped at 3."
0_12h_nucleated_red_blood_cells_mean,3,"NRBCs can reflect hypoxemia, systemic stress, or severe inflammation, which are indirectly associated with AKI risk. Early post-op elevations may be transient and mean is less sensitive than max."
13_24h_nucleated_red_blood_cells_mean,4,"Persistently elevated NRBCs in the trajectory phase suggest ongoing hypoxia/critical illness severity, which correlates with AKI risk. Mean remains an indirect marker and is less specific than extremes."
25_36h_nucleated_red_blood_cells_mean,5,"Sustained NRBC presence closer to the outcome can indicate ongoing hypoperfusion/hypoxemia or severe systemic illness, which increases AKI risk. Still indirect and mean may dilute short severe episodes."
0_12h_nucleated_red_blood_cells_max,5,"A high NRBC peak early can capture an acute hypoxic/low-flow insult or major physiologic stress, which is relevant to renal ischemia risk. In 0–12h it is scored conservatively due to common transient post-op derangements."
13_24h_nucleated_red_blood_cells_max,4,"Elevated NRBCs reflect severe physiologic stress/hypoxemia/inflammation and can correlate with worse outcomes, indirectly including AKI. As an extreme it’s more informative than mean, but it is not kidney-specific and is capped in the 13–24h epoch."
25_36h_nucleated_red_blood_cells_max,5,Persistently high NRBCs closer to the outcome suggests ongoing hypoxia/critical illness and is more prognostic than earlier epochs. Still an indirect marker rather than a direct renal biomarker.
0_12h_nucleated_red_blood_cells_min,1,A low/normal minimum NRBC value is not a plausible driver or marker of AKI. Early post-op values are often transient and non-specific.
13_24h_nucleated_red_blood_cells_min,1,The minimum NRBC in this window is generally uninformative for AKI risk compared with elevated extremes. It does not capture the pathologic signal.
25_36h_nucleated_red_blood_cells_min,1,"Minimum NRBC does not represent a physiologic insult relevant to kidney injury. Any prognostic value would come from elevations, not lows."
0_12h_nucleated_red_blood_cells_measured,1,Measurement frequency is mainly a proxy for ordering behavior and routine CBC monitoring post-cardiac surgery. It is not a direct physiologic mechanism for AKI.
13_24h_nucleated_red_blood_cells_measured,2,"More frequent CBC/NRBC reporting may reflect clinician concern or higher acuity, which can correlate with AKI risk. Still primarily a behavioral proxy, not a renal mechanism."
25_36h_nucleated_red_blood_cells_measured,2,"Increased measurement frequency late may indicate ongoing instability prompting closer monitoring, indirectly associated with AKI. Remains a non-physiologic proxy and thus low-scored."
0_12h_glucose_mean,3,Stress hyperglycemia is associated with worse postoperative outcomes and may contribute to AKI risk via inflammation/endothelial dysfunction. Mean glucose in the immediate 0–12h period is less informative than extremes and capped for early epoch conservatism.
13_24h_glucose_mean,4,Sustained dysglycemia during the trajectory phase can reflect ongoing stress/insulin resistance and is modestly associated with AKI risk. Mean is less specific than max/min for capturing harmful excursions.
25_36h_glucose_mean,5,Persistently elevated average glucose closer to hour 60 suggests ongoing critical illness and may worsen renal microvascular injury. Still an indirect predictor compared with hemodynamic/renal labs.
0_12h_glucose_max,5,"Peak hyperglycemia captures acute stress response and is more pathologic than mean for AKI association. Early post-op derangements are common, so the score is capped by the 0–12h maximum."
13_24h_glucose_max,6,"High glucose excursions in 13–24h may indicate persistent stress or poor control and are more prognostic than early transient peaks. Max better captures harmful extremes than mean, but is not kidney-specific."
25_36h_glucose_max,7,"Late hyperglycemic spikes can signal ongoing instability/infection/catecholamine exposure and are associated with higher AKI risk. As an extreme close to the outcome, it is more informative than mean/min."
0_12h_glucose_min,4,"Hypoglycemia is a marker of severe illness or overtreatment and can accompany hemodynamic compromise, indirectly increasing AKI risk. In the immediate post-op window it may be transient, so capped by epoch."
13_24h_glucose_min,5,Hypoglycemia during 13–24h suggests ongoing instability or aggressive insulin therapy and correlates with adverse outcomes including AKI. Minimum captures the harmful extreme better than mean.
25_36h_glucose_min,4,"Hypoglycemia can reflect critical illness or insulin overtreatment and may correlate with instability, but it is not a primary driver of AKI. Extremes are more informative than mean glucose, yet the link to creatinine rise is indirect."
0_12h_glucose_measured,2,"Measurement frequency mainly reflects ICU monitoring intensity and clinician concern rather than a renal mechanism. In the immediate 0–12h post-op period, frequent glucose checks are routine after cardiac surgery."
13_24h_glucose_measured,2,"More frequent glucose checks may indicate ongoing instability or insulin infusion, but it is still a behavioral proxy with weak specificity for AKI. Trajectory phase monitoring remains common in post-cardiac surgery care."
25_36h_glucose_measured,3,"Increased glucose measurement frequency closer to the outcome can reflect persistent critical illness or complications, which can co-occur with AKI. Still, it is a proxy variable and not a direct physiologic marker of renal injury."
0_12h_platelets_mean,4,"Thrombocytopenia after CPB/inflammation can correlate with severity and microvascular dysfunction, indirectly relating to AKI risk. However, in 0–12h this is often transient and mean values are less informative than nadir."
13_24h_platelets_mean,4,"Persistently lower platelets can indicate ongoing inflammation/consumption and higher illness severity, which is associated with AKI. Mean platelet count is still less specific than the minimum for capturing clinically relevant thrombocytopenia."
25_36h_platelets_mean,4,"Lower sustained platelet counts may track systemic inflammation/consumption and correlate with AKI risk, but the mean is collinear with and less pathologically specific than the platelet minimum. Prefer nadir for capturing the insult."
0_12h_platelets_max,2,"A higher platelet maximum is not a recognized trigger for AKI and is often clinically uninformative post-op. Extremes matter mainly when low (consumption/bleeding/inflammation), not when high."
13_24h_platelets_max,2,Platelet maxima generally do not reflect a renal injury mechanism and add little beyond other platelet summaries. AKI associations are driven more by thrombocytopenia than thrombocytosis.
25_36h_platelets_max,2,A high platelet maximum is not a direct predictor of AKI and is typically nonspecific. It is also redundant with other platelet features without capturing the relevant pathology.
0_12h_platelets_min,6,"Early postoperative platelet nadir can reflect CPB-related consumption, bleeding, inflammation, or early DIC-like physiology, which correlates with organ dysfunction including AKI. In 0–12h it is still partly expected/transient, so capped."
13_24h_platelets_min,7,"A low platelet nadir in the 13–24h window suggests persistent consumption/inflammation or ongoing bleeding/complications, which is strongly associated with subsequent AKI. The minimum captures the clinically relevant insult better than mean/max."
25_36h_platelets_min,8,"Thrombocytopenia closest to the outcome is a strong marker of ongoing systemic illness (sepsis, inflammation, bleeding/consumption) and microvascular dysfunction, which are tightly linked to AKI after cardiac surgery. The nadir is the most pathologically informative platelet aggregation."
0_12h_platelets_measured,2,Platelet measurement frequency is largely protocolized after cardiac surgery and reflects monitoring rather than renal physiology. As a proxy for acuity it has limited specificity for AKI.
13_24h_platelets_measured,2,"More frequent platelet checks may indicate concern for bleeding/consumption, but it remains a behavioral proxy with weak direct linkage to AKI. Many patients still receive routine CBC monitoring in this phase."
25_36h_platelets_measured,3,"Increased platelet measurement frequency at 25–36h may reflect clinician concern for ongoing bleeding/consumption or complications that co-occur with AKI. Still, it is not a physiologic biomarker and should remain low importance."
0_12h_mean_corpuscular_hemoglobin_mean,2,Mean corpuscular hemoglobin (MCH) is not a direct driver of renal perfusion or tubular injury; periop shifts are usually unrelated to AKI. Early (0–12h) values are also influenced by hemodilution/transfusion effects.
13_24h_mean_corpuscular_hemoglobin_mean,2,"MCH has minimal physiologic linkage to AKI risk compared with hemodynamics, nephrotoxins, and renal labs. Any association would be indirect via anemia/transfusion patterns rather than kidney injury itself."
25_36h_mean_corpuscular_hemoglobin_mean,2,"Even close to the outcome window, MCH is not an established predictor of postoperative creatinine rise. It may weakly reflect anemia/transfusion but is not a renal biomarker."
0_12h_mean_corpuscular_hemoglobin_max,1,An elevated MCH maximum is not a recognized trigger or marker of AKI. Extremes here are more likely analytic/volume-status artifacts than kidney-relevant physiology.
13_24h_mean_corpuscular_hemoglobin_max,1,MCH maxima do not capture a known AKI mechanism and add redundancy relative to other RBC indices. Any signal would be incidental rather than causal.
25_36h_mean_corpuscular_hemoglobin_max,1,Late-window MCH maximum remains clinically non-specific for renal hypoperfusion or nephrotoxic injury. It is unlikely to add predictive value for creatinine_ratio.
0_12h_mean_corpuscular_hemoglobin_min,2,"Low MCH can reflect chronic microcytic anemia, which may correlate with frailty but is not a direct AKI driver. In 0–12h it is also confounded by dilution and transfusion."
13_24h_mean_corpuscular_hemoglobin_min,2,A low MCH minimum is at best an indirect marker of anemia/nutrition and not a primary determinant of postoperative AKI. It is less informative than hemoglobin/hematocrit or hemodynamics.
25_36h_mean_corpuscular_hemoglobin_min,2,"Even as a leading indicator window, MCH minimum is not mechanistically tied to creatinine rise. Any association would be weak and mediated through overall illness severity."
0_12h_mean_corpuscular_hemoglobin_measured,1,"Measurement frequency mainly reflects routine CBC ordering in the immediate postoperative period rather than specific AKI concern. As a behavioral proxy, it should be low importance."
13_24h_mean_corpuscular_hemoglobin_measured,1,CBC/MCH rechecks are common ICU practice and not specific to impending AKI. Frequency is more about monitoring anemia/bleeding than renal injury.
25_36h_mean_corpuscular_hemoglobin_measured,1,"Repeated MCH measurement is not typically driven by renal deterioration suspicion. As a _measured feature, it is a weak behavioral signal at best."
0_12h_sodium_mean,3,Mean sodium in the first 12h is often influenced by fluids/CPB and is not a direct AKI marker; dysnatremias can correlate with severity but are nonspecific. Early transient shifts limit prognostic value (0–12h cap).
13_24h_sodium_mean,4,"Sustained sodium abnormalities can reflect ongoing fluid balance issues and neurohormonal stress that correlate with illness severity and renal risk, but remain indirect. Mean is less informative than extremes for acute insults, so importance is capped."
25_36h_sodium_mean,4,"Closer to hour 60, persistent dysnatremia may track with fluid management, diuretic use, and overall acuity, which can associate with AKI risk. However sodium is still an indirect marker and mean is less pathology-specific than extremes."
0_12h_sodium_max,4,"Hypernatremia extremes can indicate free-water deficit, aggressive diuresis, or high sodium load and may accompany renal hypoperfusion, but in 0–12h it is often transient and iatrogenic. As an extreme it is more relevant than mean, within the early-epoch cap."
13_24h_sodium_max,4,"Hypernatremia can reflect free-water deficit/diuresis and overall illness severity, which may correlate with AKI risk, but it is not a direct renal injury marker. Max is more relevant than mean for acute dysnatremia, but in 13–24h it remains an indirect signal."
25_36h_sodium_max,5,"Later hypernatremia may indicate ongoing hypovolemia, osmotic diuresis, or inadequate free-water replacement, which can worsen renal perfusion. Still an indirect predictor rather than a direct biomarker of AKI."
0_12h_sodium_min,3,"Early postoperative hyponatremia is common from hemodilution/CPB fluids and is often transient, making it a weak AKI predictor. Min captures the insult better than mean, but the 0–12h window is noisy."
13_24h_sodium_min,4,"Persistent or worsening hyponatremia can reflect fluid overload, heart failure physiology, or SIADH-like stress response, which may accompany renal dysfunction. It remains an indirect association rather than causal for AKI."
25_36h_sodium_min,5,"Hyponatremia closer to outcome may reflect ongoing volume overload/low effective arterial blood volume and neurohormonal activation, states linked to renal hypoperfusion and AKI. Still not a specific kidney injury marker."
0_12h_sodium_measured,2,"Measurement frequency mainly reflects monitoring intensity and clinician concern rather than a physiologic mechanism. In the immediate post-op period, frequent sodium checks are routine in many ICUs."
13_24h_sodium_measured,2,"More frequent sodium testing may indicate instability or fluid/electrolyte management complexity, but it is a weak behavioral proxy. Not specific for impending AKI."
25_36h_sodium_measured,3,"In the later window, increased sodium monitoring can reflect ongoing derangements (diuresis, hypernatremia, fluid shifts) and higher acuity, modestly correlating with AKI risk. Still a non-mechanistic proxy, so capped low."
0_12h_teg_platelet_aggregation_measured,2,"Ordering TEG platelet aggregation primarily reflects bleeding/coagulopathy evaluation and transfusion planning, not renal injury. Any AKI link is indirect via shock/transfusion burden and is nonspecific in 0–12h."
13_24h_teg_platelet_aggregation_measured,2,"Continued TEG platelet aggregation testing suggests ongoing bleeding/coagulopathy management, which may correlate with severity of illness but is not a direct AKI predictor. Behavioral proxy only."
25_36h_teg_platelet_aggregation_measured,3,Late need for TEG platelet aggregation implies persistent bleeding/coagulopathy and potential hemodynamic/transfusion stress that can contribute to AKI risk. Still indirect and primarily reflects clinician concern.
0_12h_mean_corpuscular_hemoglobin_concentration_mean,2,"MCHC is not a recognized driver or early marker of AKI; postoperative changes often reflect hemodilution/transfusion effects. Mean further smooths any transient abnormalities, limiting relevance."
13_24h_mean_corpuscular_hemoglobin_concentration_mean,2,"MCHC has minimal physiologic linkage to renal perfusion or tubular injury, and mean values are unlikely to capture meaningful pathology. At most it weakly reflects anemia/transfusion context."
25_36h_mean_corpuscular_hemoglobin_concentration_mean,2,"Even close to outcome, MCHC is not a clinically established predictor of AKI and is largely unrelated to kidney injury mechanisms. Mean aggregation further reduces signal."
0_12h_mean_corpuscular_hemoglobin_concentration_max,3,"An elevated MCHC max can occur with hemolysis/spherocytosis or lab artifact; hemolysis after CPB could theoretically contribute to pigment nephropathy, but this is uncommon and nonspecific. Early post-op period also has high noise."
13_24h_mean_corpuscular_hemoglobin_concentration_max,3,"Persistently high MCHC max may weakly suggest hemolysis or transfusion-related effects, which can be associated with AKI in severe cases. Still an indirect and low-specificity signal."
25_36h_mean_corpuscular_hemoglobin_concentration_max,2,"MCHC extremes are not a direct driver of renal perfusion or nephrotoxicity; changes usually reflect RBC indices/hemolysis or lab variation. At most an indirect marker of illness or transfusion, with weak linkage to AKI."
0_12h_mean_corpuscular_hemoglobin_concentration_min,2,Low MCHC in the immediate post-op window is rarely causally related to AKI and more reflects anemia/RBC indices. Early post-bypass shifts are common and nonspecific (0–12h capped).
13_24h_mean_corpuscular_hemoglobin_concentration_min,2,Persistently low MCHC is not an established predictor of AKI; it is more reflective of anemia/chronic indices than renal injury. Any association would be indirect via overall acuity.
25_36h_mean_corpuscular_hemoglobin_concentration_min,2,"Late low MCHC remains a weak, nonspecific marker and does not directly capture renal hypoperfusion or tubular injury. Compared with hemodynamics/creatinine/urine output, it adds little AKI signal."
0_12h_mean_corpuscular_hemoglobin_concentration_measured,1,"Measurement frequency mainly reflects routine CBC ordering after surgery rather than specific concern for impending AKI. As a behavioral proxy, it has minimal renal-specific prognostic value."
13_24h_mean_corpuscular_hemoglobin_concentration_measured,1,CBC/MCHC rechecks are common ICU practice and not specifically targeted to kidney injury risk. Measurement count is a weak acuity proxy and should be low-importance.
25_36h_mean_corpuscular_hemoglobin_concentration_measured,1,"More frequent MCHC measurements typically reflect routine labs or anemia/transfusion monitoring rather than renal-specific concern. As a _measured feature, it should remain low."
0_12h_hematocrit_mean,3,"Average hematocrit early after cardiac surgery reflects hemodilution/bleeding/transfusion and can influence oxygen delivery, but is nonspecific for AKI in the immediate period. Extremes are more pathophysiologically relevant than the mean (collinearity rule)."
13_24h_hematocrit_mean,4,"Sustained anemia/hemodilution may contribute to reduced renal oxygen delivery, but mean values still smooth over clinically important nadirs. Use of mean is less informative than minimum hematocrit for AKI risk."
25_36h_hematocrit_mean,4,"Later average hematocrit may reflect ongoing anemia and illness severity, which can relate to renal hypoxia, but the mean is less sensitive than the nadir. Kept modest to avoid redundancy with hematocrit_min."
0_12h_hematocrit_max,2,"High hematocrit early post-op is not a typical trigger for AKI and may reflect hemoconcentration or transfusion without clear causal linkage. In 0–12h, transient shifts are common and nonspecific (capped)."
13_24h_hematocrit_max,2,Elevated hematocrit is not an established AKI predictor; it may reflect hemoconcentration but is less relevant than hypotension/low Hct/low flow states. Thus low importance.
25_36h_hematocrit_max,3,"Late hemoconcentration could indicate dehydration/negative fluid balance and reduced renal perfusion, but this is indirect and context-dependent. Less predictive than hypotension, vasopressor need, or low hematocrit nadir."
0_12h_hematocrit_min,6,"A low hematocrit nadir reflects bleeding/hemodilution and reduced oxygen delivery during a vulnerable post-bypass period, which can contribute to renal ischemia. Despite early-window conservatism (max 6), this extreme is the most relevant hematocrit aggregation."
13_24h_hematocrit_min,7,"Persistent or worsening anemia (low nadir) in the trajectory phase can signal ongoing bleeding/hemodilution and impaired oxygen delivery, increasing AKI risk. The minimum captures the insult better than mean/max."
25_36h_hematocrit_min,8,"A low hematocrit nadir close to the outcome window suggests sustained anemia/ongoing losses or dilution with potential renal hypoxia and higher AKI risk. As an extreme and leading indicator, it is the most clinically informative hematocrit feature."
0_12h_hematocrit_measured,2,Measurement frequency mainly reflects monitoring/transfusion evaluation rather than renal physiology. Early post-op labs are routine and nonspecific for AKI risk.
