value,importance,reason
0_12h_r_an_agents_isoflurane_max,1,"Transient peaks in isoflurane dose early after surgery are common and mainly reflect anesthetic management rather than renal insult. Any impact on AKI would be mediated through hypotension, which is better represented by hemodynamic extremes."
0_12h_r_an_agents_isoflurane_min,1,Minimum isoflurane dose largely indicates weaning/off periods and does not capture a renal injury mechanism. It is unlikely to add prognostic value for creatinine_ratio.
0_12h_r_an_agents_isoflurane_measured,1,"As a _measured feature, it reflects documentation/monitoring frequency rather than physiologic exposure-response for AKI. Early post-op measurement intensity is routine and nonspecific."
13_24h_r_an_agents_isoflurane_measured,1,"Frequency of isoflurane recording is a weak behavioral proxy for sedation needs and does not directly indicate renal hypoperfusion or nephrotoxicity. Per rules, _measured features should be low unless strongly tied to AKI suspicion."
25_36h_r_an_agents_isoflurane_measured,1,Continued measurement may correlate with ongoing ventilation/sedation but is nonspecific for kidney injury and heavily confounded by ICU practice. It is not a direct predictor of creatinine rise.
0_12h_r_saturated_venous_o2_mean,2,"Mixed/central venous O2 saturation reflects global oxygen delivery vs consumption and can indirectly relate to renal perfusion. In 0–12h it is often transiently abnormal post-CPB, so the mean is a conservative, less specific signal."
13_24h_r_saturated_venous_o2_mean,2,"Persistently low average SvO2 may indicate inadequate cardiac output and systemic hypoperfusion, which can contribute to AKI. However, the mean smooths important lows and this mid window is less proximal to the 60h creatinine outcome."
0_12h_r_saturated_venous_o2_max,1,"High SvO2 extremes can reflect reduced extraction (e.g., sedation, shunting) and are not a typical trigger for AKI. In the immediate post-op period, maxima are particularly nonspecific."
13_24h_r_saturated_venous_o2_max,1,A high SvO2 maximum is not a recognized direct marker of renal hypoperfusion and is often driven by sedation/ventilation changes. It adds limited AKI-specific information compared with low SvO2 extremes.
0_12h_r_saturated_venous_o2_min,3,"Low SvO2 minima capture episodes of low cardiac output/systemic hypoperfusion, a plausible contributor to ischemic tubular injury. Even so, in 0–12h this can be transient post-CPB, so scoring is conservative."
13_24h_r_saturated_venous_o2_min,3,"A low SvO2 minimum during 13–24h suggests ongoing or recurrent inadequate oxygen delivery (often low output), which is an established AKI risk factor after cardiac surgery. The minimum better captures the pathologic insult than the mean/max while avoiding redundancy."
0_12h_r_saturated_venous_o2_measured,2,"More frequent SvO2 checks can indicate clinician concern for low output/shock, indirectly associated with AKI risk. As a _measured feature it remains a behavioral proxy and should be kept low."
13_24h_r_saturated_venous_o2_measured,2,"Increased SvO2 measurement frequency may reflect ongoing hemodynamic instability prompting closer monitoring, which can correlate with AKI risk. Still, it is not a physiologic mechanism and is scored low per the measurement-frequency rule."
25_36h_r_saturated_venous_o2_measured,2,"Measurement frequency reflects clinician concern/acuity (e.g., shock/low cardiac output) which can precede AKI, but it is not a physiologic value and is an indirect proxy."
0_12h_r_maintenance_iv_volume_mean,2,"Maintenance IV volume relates to volume status and renal perfusion, but early (0–12h) fluids are heavily protocol/anesthesia-driven and mean values dilute clinically important extremes."
13_24h_r_maintenance_iv_volume_mean,2,"Ongoing maintenance fluids may reflect evolving hemodynamics and kidney perfusion, but the mean is a blunt marker and is less informative than later-window extremes for AKI risk."
25_36h_r_maintenance_iv_volume_mean,3,"In the 25–36h leading window, sustained higher maintenance fluids can indicate persistent vasoplegia/third spacing or attempts to support perfusion, which is associated with AKI risk, though still indirect."
0_12h_r_maintenance_iv_volume_max,2,"A high maximum maintenance IV rate may signal acute hypotension/vasoplegia management, but in the immediate post-op period it is often transient and protocolized, limiting specificity for AKI."
13_24h_r_maintenance_iv_volume_max,2,"A higher max rate can reflect intermittent instability and attempts to augment perfusion, but it remains an indirect marker and can be confounded by routine ICU practice."
25_36h_r_maintenance_iv_volume_max,3,"A high maximum maintenance IV rate close to the outcome suggests ongoing hemodynamic instability or capillary leak requiring support, which increases AKI risk; max captures the insult better than mean/min."
0_12h_r_maintenance_iv_volume_min,1,Minimum maintenance IV rate is rarely a direct driver/marker of renal injury and in the immediate post-op window is often determined by standard orders rather than kidney-specific physiology.
13_24h_r_maintenance_iv_volume_min,1,Low minimum maintenance rate is nonspecific and may reflect routine titration or transitions in care; it is not an established predictor of AKI compared with hemodynamics/renal labs.
25_36h_r_maintenance_iv_volume_min,2,"In the later window, very low minimum rates could reflect fluid restriction/concern for overload or improved stability, but the relationship to AKI is indirect and confounded."
0_12h_r_maintenance_iv_volume_measured,1,Measurement frequency is a documentation/ordering artifact rather than physiology; early post-op charting is routine and not specific for impending AKI.
13_24h_r_maintenance_iv_volume_measured,1,"How often maintenance IV volume is recorded mainly reflects workflow and monitoring intensity, not a mechanistic link to kidney injury."
25_36h_r_maintenance_iv_volume_measured,1,"Even in the later window, recording frequency is primarily behavioral and provides little incremental physiologic information for predicting creatinine rise."
0_12h_r_an_pap_systolic_measured,2,"Having PAP monitoring suggests higher acuity/right heart dysfunction risk, which can contribute to renal congestion and AKI, but in 0–12h it is often routine for complex cardiac surgery and is indirect."
13_24h_r_an_pap_systolic_measured,2,"Continued PAP monitoring indicates ongoing concern for cardiopulmonary instability that can affect renal perfusion/congestion, but it remains a proxy rather than a direct biomarker."
25_36h_r_an_pap_systolic_measured,2,"PAP monitoring persisting into 25–36h may reflect unresolved RV failure/pulmonary hypertension and higher AKI risk via low forward flow/venous congestion, but it is still an indirect indicator (measured vs value)."
0_12h_r_an_pap_diastolic_measured,1,"Measurement frequency of PAP diastolic is mainly a proxy for monitoring intensity (e.g., PA catheter use) rather than a renal mechanism. Early post-op (0–12h) monitoring is common and not specific for impending AKI."
13_24h_r_an_pap_diastolic_measured,1,"PAP diastolic measurement count reflects clinician concern/PA catheter presence more than kidney perfusion. In 13–24h it may track acuity, but remains nonspecific for creatinine rise."
25_36h_r_an_pap_diastolic_measured,2,"More frequent PAP diastolic monitoring late (25–36h) can indicate ongoing cardiopulmonary instability or RV failure management, which can contribute to renal congestion/low output. Still a behavioral proxy, not a direct physiologic marker."
0_12h_r_an_central_venous_pressure_measured,1,CVP measurement frequency is largely routine in immediate post-cardiac surgery care and reflects monitoring intensity. It is not a direct biomarker of AKI and is highly nonspecific in the first 12 hours.
13_24h_r_an_central_venous_pressure_measured,1,Counting CVP measurements mainly captures clinician behavior and line presence rather than renal perfusion. Any association with AKI would be indirect via overall illness severity.
25_36h_r_an_central_venous_pressure_measured,2,"Increased CVP monitoring at 25–36h may signal persistent volume overload/right-sided failure management, which can worsen renal venous congestion and AKI risk. As a _measured feature it remains an indirect proxy and should be kept low."
0_12h_r_an_etco2_mean,1,"Mean EtCO2 in the immediate post-op window is heavily influenced by ventilator settings, sedation, and transient hemodynamic changes. It is not a specific driver or marker of renal injury in 0–12h."
13_24h_r_an_etco2_mean,2,"Sustained lower EtCO2 can reflect reduced pulmonary blood flow/low cardiac output or excessive ventilation, indirectly relating to renal hypoperfusion. Mean values are less sensitive than extremes for detecting acute low-flow states."
25_36h_r_an_etco2_mean,3,"Persistently low EtCO2 closer to outcome can indicate ongoing low cardiac output or poor perfusion, which is an established contributor to post-cardiac surgery AKI. Mean is still somewhat confounded by ventilation strategy, so not definitive."
0_12h_r_an_etco2_max,1,"High EtCO2 extremes early are more related to hypoventilation, CO2 production, or ventilator adjustments than renal perfusion. In 0–12h this is common and not specific for AKI."
13_24h_r_an_etco2_max,1,EtCO2 maxima generally reflect hypoventilation or permissive hypercapnia rather than a direct renal insult. It is less mechanistically tied to AKI than low EtCO2 (low flow) signals.
25_36h_r_an_etco2_max,1,"Even late, high EtCO2 is usually ventilatory/sedation related and not a strong predictor of creatinine rise. Compared with EtCO2 minima, it is less informative for low-perfusion AKI risk."
0_12h_r_an_etco2_min,2,"Very low EtCO2 can indicate low pulmonary blood flow/low cardiac output or severe hypotension, which can threaten renal perfusion. However, in 0–12h it is often transient and confounded by ventilation changes."
13_24h_r_an_etco2_min,3,"Low EtCO2 minima during 13–24h may reflect episodes of low cardiac output or shock physiology, an established AKI risk factor after cardiac surgery. Extremes are more informative than means for capturing acute low-flow insults."
25_36h_r_an_etco2_min,4,"Low EtCO2 minima close to hour 60 can be a strong indicator of ongoing low cardiac output/shock and impaired systemic perfusion, directly increasing AKI risk. As an extreme value it better captures clinically meaningful hypoperfusion than the mean."
0_12h_r_an_etco2_measured,1,"EtCO2 measurement frequency reflects monitoring intensity (e.g., intubation/ventilation) and routine care rather than renal pathophysiology. In the first 12 hours it is nearly universal and not discriminative for AKI."
13_24h_r_an_etco2_measured,1,Measurement frequency mainly reflects monitoring intensity rather than renal physiology. ETCO2 ordering is not a specific AKI signal in this trajectory window.
25_36h_r_an_etco2_measured,2,"More frequent ETCO2 checks can proxy ongoing ventilatory/hemodynamic instability closer to the outcome, which can correlate with AKI risk. Still behavioral and nonspecific, so kept low."
0_12h_r_an_fio2_mean,1,Average FiO2 early post-op is heavily driven by routine ventilator weaning practices and transient post-bypass lung dysfunction. It is not a direct driver/marker of renal injury and is collinear with FiO2 extremes.
0_12h_r_an_fio2_max,2,"High peak FiO2 may indicate acute hypoxemia or cardiopulmonary instability, which can indirectly worsen renal oxygen delivery. In the immediate 0–12h period this is common/transient, so conservative scoring."
0_12h_r_an_fio2_min,1,Low minimum FiO2 generally reflects stability and weaning rather than a pathologic insult. It has little mechanistic link to AKI compared with hypoperfusion markers.
0_12h_r_an_fio2_measured,1,Frequency of FiO2 documentation/orders is a care-process variable and not a physiologic AKI mechanism. Early post-op ventilator monitoring is routine.
13_24h_r_an_fio2_measured,1,FiO2 measurement frequency remains largely standard-of-care and nonspecific for AKI. It may reflect respiratory acuity but is not a strong renal predictor.
25_36h_r_an_fio2_measured,2,"Closer to hour 60, frequent FiO2 adjustments can indicate persistent respiratory/cardiac dysfunction that may co-occur with renal hypoperfusion. Still a behavioral proxy, so capped at 2."
0_12h_r_an_tidal_volume_mean,1,"Mean tidal volume early post-op is primarily set by ventilator strategy and body size, not kidney perfusion. Any association with AKI is indirect and confounded by routine ventilation practices."
13_24h_r_an_tidal_volume_mean,1,Sustained tidal volume settings are not established predictors of AKI in this context. They are more reflective of ventilation protocol than renal insult.
25_36h_r_an_tidal_volume_mean,2,"Persistently higher tidal volumes may contribute to ventilator-induced lung injury/inflammation and worse hemodynamics, indirectly increasing AKI risk. Effect is modest and nonspecific, so low importance."
0_12h_r_an_tidal_volume_max,2,"High peak tidal volumes can reflect ventilatory instability or aggressive ventilation, which may worsen intrathoracic pressures and renal venous congestion indirectly. In 0–12h this is often transient and protocol-driven, so conservative."
13_24h_r_an_tidal_volume_max,2,"Peak tidal volumes may capture intermittent high-pressure ventilation episodes that can impair venous return and renal perfusion. Still indirect and likely collinear with mean settings, so kept low."
25_36h_r_an_tidal_volume_max,3,"Later high tidal volume peaks may indicate ongoing respiratory failure or poor compliance requiring more aggressive ventilation, which can worsen hemodynamics and renal congestion closer to the AKI window. This is an indirect but clinically plausible risk marker."
0_12h_r_an_tidal_volume_min,1,"Low minimum tidal volume typically reflects weaning, sedation changes, or brief ventilator adjustments rather than a renal-relevant insult. It is not a recognized AKI predictor."
13_24h_r_an_tidal_volume_min,1,Minimum tidal volume is more indicative of ventilator management/weaning than kidney injury risk. Any relationship to AKI would be weak and confounded.
25_36h_r_an_tidal_volume_min,2,"Low tidal volumes may reflect lung-protective ventilation in sicker patients (e.g., ARDS), which correlates with overall severity and risk of AKI, but it is not a direct renal perfusion marker. As an extreme, it can capture acute respiratory failure severity closest to outcome, but remains indirect."
0_12h_r_an_tidal_volume_measured,1,Measurement frequency is primarily a care-pattern/monitoring proxy and not a physiologic driver of AKI. In the immediate post-op window it mostly reflects routine ventilator charting rather than renal risk.
13_24h_r_an_tidal_volume_measured,1,This is a monitoring frequency feature and is not mechanistically linked to kidney injury. In this mid-phase it still largely reflects routine ventilator documentation rather than impending AKI.
25_36h_r_an_tidal_volume_measured,2,"More frequent tidal volume documentation late may indicate ongoing ventilatory instability/ICU acuity, which can correlate with AKI risk. Still, it is a behavioral proxy and not a direct renal biomarker."
0_12h_r_an_abp_pulse_measured,1,ABP pulse measurement presence/frequency is a monitoring proxy and commonly routine after cardiac surgery (arterial line). Early post-op monitoring intensity is not specific for AKI risk.
13_24h_r_an_abp_pulse_measured,1,This reflects continued arterial line monitoring rather than a physiologic insult. It is not a direct predictor of creatinine rise.
25_36h_r_an_abp_pulse_measured,2,"Persistent need for close arterial waveform monitoring late may indicate hemodynamic instability, which is associated with AKI risk. However, as a measured/presence feature it remains indirect and non-specific."
0_12h_r_an_heart_rate_measured,1,Heart rate measurement presence is routine ICU monitoring and does not itself indicate renal hypoperfusion. In the immediate post-op period it is nearly universal and non-discriminative.
13_24h_r_an_heart_rate_measured,1,This is a monitoring proxy and not a physiologic measure of tachycardia/bradycardia burden. It provides little specific information about AKI risk.
25_36h_r_an_heart_rate_measured,2,"Late increased monitoring/documentation may reflect ongoing instability or arrhythmia concern, which can correlate with renal hypoperfusion risk. Still, it is not a direct physiologic predictor."
0_12h_r_an_abp_mean_measured,1,Mean arterial pressure measurement presence is routine with an arterial line post-cardiac surgery and is not itself a marker of hypotension burden. Early post-op measurement frequency is not specific for AKI.
13_24h_r_an_abp_mean_measured,1,"This is a monitoring frequency feature and does not capture actual hypotension, which is what drives AKI risk. It is therefore weakly informative."
25_36h_r_an_abp_mean_measured,2,"More frequent MAP documentation late may indicate concern for hemodynamic instability, which is relevant to AKI risk. As a measured feature it remains an indirect proxy and should be kept low to avoid over-weighting monitoring behavior."
0_12h_anesthesia_respirations_measured,1,Respiratory rate measurement frequency is largely routine perioperative/ICU documentation and not a direct renal risk factor. In the immediate post-op period it is especially non-specific.
13_24h_anesthesia_respirations_measured,1,This is a behavioral proxy for monitoring intensity rather than a physiologic derangement linked to AKI. It adds minimal specific prognostic value for creatinine rise.
25_36h_anesthesia_respirations_measured,2,"Late increased respiratory monitoring may reflect respiratory failure/sepsis concern and overall acuity, which can correlate with AKI. Nonetheless it is not mechanistic and should remain low importance."
0_12h_anesthesia_pulse_oximetry_measured,1,Measurement frequency mainly reflects routine monitoring intensity rather than a renal mechanism. In the immediate post-op window it is near-universal and poorly discriminates AKI risk.
13_24h_anesthesia_pulse_oximetry_measured,1,Still largely a care-process variable (how often SpO2 is charted) rather than physiology. Weak and nonspecific link to AKI except as a proxy for overall acuity.
25_36h_anesthesia_pulse_oximetry_measured,2,"More frequent monitoring at 25–36h may indicate ongoing instability/respiratory failure, which can correlate with renal hypoperfusion. However it remains an indirect behavioral proxy, not a direct AKI driver."
0_12h_r_tube_intake_measured,1,Counts/amounts of tube intake measurement are not a direct determinant of renal injury and are heavily influenced by feeding protocols. Early post-op feeding decisions are variable and weakly tied to AKI.
13_24h_r_tube_intake_measured,1,Enteral intake measurement is primarily nutritional/process-related and not a known predictor of creatinine rise. Any association would be confounded by illness severity and feeding tolerance.
25_36h_r_tube_intake_measured,2,"Reduced/withheld tube intake by 25–36h can reflect persistent shock, ileus, or high vasopressor needs, which are associated with AKI risk. Still indirect and nonspecific for renal injury."
0_12h_r_maintenance_iv_bolus_volume_mean,2,"IV fluid exposure can affect renal perfusion and dilutional creatinine, but mean bolus volume in the first 12h is often protocolized and confounded by CPB-related shifts. Mean is less informative than extremes for acute resuscitation needs."
0_12h_r_maintenance_iv_bolus_volume_max,3,"A large maximum bolus suggests episodes of hypotension/low cardiac output requiring resuscitation, a recognized pathway to ischemic AKI. Even so, in 0–12h this may reflect transient post-bypass physiology, so not definitive."
0_12h_r_maintenance_iv_bolus_volume_min,1,Minimum bolus volume is not clinically meaningful for AKI risk and adds redundancy relative to max/total exposure. It does not capture hypoperfusion episodes.
0_12h_r_maintenance_iv_bolus_volume_measured,1,Number of bolus entries reflects documentation/clinical behavior rather than a physiologic insult. In the immediate post-op period it is common and weakly discriminative for AKI.
13_24h_r_maintenance_iv_bolus_volume_measured,2,"More frequent bolus administration/charting in 13–24h can indicate ongoing hemodynamic instability, which increases AKI risk. Still a process proxy and less informative than actual bolus magnitude."
25_36h_r_maintenance_iv_bolus_volume_measured,2,"Persistent need for repeated boluses at 25–36h suggests continued low effective circulating volume or vasoplegia, which can precede creatinine rise. However it remains indirect and collinear with true hemodynamic variables."
0_12h_r_pacemaker_mean,2,"Need for pacing can indicate conduction issues/low cardiac output states that may reduce renal perfusion, but early post-op pacing is common and often transient. Mean pacing burden in 0–12h is therefore only a weak-to-moderate AKI signal."
13_24h_r_pacemaker_mean,2,"Ongoing pacing in 13–24h may reflect persistent bradyarrhythmia or myocardial dysfunction, which can contribute to renal hypoperfusion. Still indirect and not a kidney-specific marker."
25_36h_r_pacemaker_mean,3,"Persistent pacing requirement close to the outcome window can indicate sustained cardiac dysfunction/low output, a well-established contributor to postoperative AKI. This is a stronger leading indicator than earlier epochs but remains indirect."
0_12h_r_pacemaker_max,2,"Any peak pacing requirement early after surgery may reflect transient conduction disturbances and does not necessarily imply sustained low output. As an extreme it is somewhat more informative than mean, but in 0–12h it is still a conservative AKI predictor."
13_24h_r_pacemaker_max,2,"Need for pacing suggests conduction disease/low-output physiology that can reduce renal perfusion, but it is an indirect marker and often transient post-op. Trajectory window so predictive value is limited."
25_36h_r_pacemaker_max,3,"Persistent pacing requirement closer to hour 60 can indicate ongoing low cardiac output or hemodynamic instability, which is an established AKI risk factor. Still indirect and not kidney-specific."
0_12h_r_pacemaker_min,1,Immediate post-op pacing is common after cardiac surgery and often reflects transient conduction effects rather than sustained hypoperfusion. Initial window so conservatively scored.
13_24h_r_pacemaker_min,2,"Ongoing pacing in this period may reflect incomplete recovery of cardiac function and potential renal hypoperfusion, but remains nonspecific. Trajectory phase reduces weight."
25_36h_r_pacemaker_min,3,Pacing requirement in the leading-indicator window suggests persistent hemodynamic dependence that can contribute to renal ischemia. Indirect but clinically meaningful for AKI risk.
0_12h_r_pacemaker_measured,1,Measurement frequency is primarily a documentation/monitoring behavior and not a physiologic driver of AKI. Early post-op monitoring is routine.
13_24h_r_pacemaker_measured,1,Counts of measurements reflect clinician monitoring intensity rather than renal pathophysiology. Not specific for impending AKI.
25_36h_r_pacemaker_measured,2,"More frequent pacing-related measurements may indicate ongoing instability/concern, which can correlate with AKI risk, but it is still a behavioral proxy. Capped per _measured rule."
0_12h_r_sled_crrt_maintenance_blood_pump_rate_measured,2,"Any CRRT/SLED-related maintenance activity implies severe illness and possible early renal dysfunction, but this is a measurement/maintenance frequency rather than a direct physiologic value. Initial window and capped per _measured rule."
13_24h_r_sled_crrt_maintenance_blood_pump_rate_measured,2,"Ongoing CRRT/SLED maintenance suggests critical illness and renal support needs, indirectly associated with higher creatinine at 60h. Still a behavioral proxy and capped."
25_36h_r_sled_crrt_maintenance_blood_pump_rate_measured,2,"CRRT/SLED maintenance close to the outcome strongly signals severe renal/hemodynamic derangement, but as a _measured feature it reflects care intensity rather than kidney function itself. Capped per rule."
0_12h_r_an_agents_sevoflurane_measured,1,Sevoflurane exposure/recording is not a strong or consistent driver of postoperative AKI compared with perfusion and nephrotoxins. Measurement frequency mainly reflects anesthesia documentation.
13_24h_r_an_agents_sevoflurane_measured,1,"Post-op sevoflurane measurement is uncommon and, when present, is not a kidney-specific predictor; it mainly reflects sedation/anesthesia practice. Behavioral proxy only."
25_36h_r_an_agents_sevoflurane_measured,1,Continued sevoflurane-related measurement late post-op is not an established AKI predictor and likely reflects ongoing ventilation/sedation needs rather than renal injury. Capped as _measured.
0_12h_intravenous_intake_measured,1,Number of IV intake recordings reflects nursing documentation frequency and routine ICU care rather than true volume status or renal perfusion. Initial window and capped per _measured rule.
13_24h_intravenous_intake_measured,1,Measurement frequency of IV intake is a weak behavioral proxy and not a direct determinant of AKI; actual fluid balance values would be more informative. Trajectory phase but still capped.
25_36h_intravenous_intake_measured,2,"Measurement frequency mainly reflects nursing/ICU workflow and clinician attention rather than a direct renal insult. It may weakly proxy fluid management intensity in the closest window, but is not a physiologic driver of AKI."
0_12h_r_drain_output_measured,1,This is a measurement-count feature and largely reflects documentation/monitoring rather than bleeding severity or perfusion. In the immediate post-op period it is especially routine and nonspecific for AKI risk.
