value,importance,reason
age,5,"Even within an ≥80 cohort, increasing age reflects reduced renal reserve and higher susceptibility to ischemic/nephrotoxic injury after cardiac surgery. Effect size may be modest due to restricted age range."
gender,3,"Sex differences in AKI risk after cardiac surgery are inconsistent and largely mediated by body size, comorbidity burden, and hemodynamics. Provides at most an indirect signal."
race_caucasian,2,Race is not a direct physiologic driver of postoperative AKI and often acts as a proxy for social/healthcare factors. Limited incremental value once comorbidities and perioperative physiology are included.
race_black,3,"Black race can correlate with higher CKD prevalence and differential baseline creatinine generation, which may influence creatinine trajectories. Still an indirect proxy rather than a mechanistic AKI marker."
race_asian,2,"Not a direct physiologic determinant of AKI; any association is typically confounded by baseline kidney function, body habitus, and care patterns. Likely low incremental predictive value."
race_native_am,3,May proxy higher burden of diabetes/CKD and related AKI susceptibility in some populations. Indirect and context-dependent rather than mechanistic.
race_native_pacific,2,Primarily a demographic proxy with uncertain independent association to postoperative AKI once comorbidities and physiology are modeled. Weak direct clinical linkage.
race_other,2,Heterogeneous category with no specific mechanistic link to renal hypoperfusion or nephrotoxicity. Likely minimal standalone predictive value.
ethnicity,2,Ethnicity is not a direct physiologic driver of AKI and mainly reflects population-level differences in comorbidity and access to care. Limited incremental value beyond clinical variables.
height_cm,2,Height has no direct relationship to renal perfusion or tubular injury; it mainly contributes to body size indexing. Any effect is indirect and typically captured by weight/BSA-related dosing and hemodilution factors.
weight_kg,4,"Higher weight/obesity can increase AKI risk via metabolic syndrome, dosing/volume distribution, and perioperative hemodynamic complexity. Still indirect compared with direct hemodynamic and renal lab markers."
family_history_premature_cardiac_death,1,"Family history does not directly affect postoperative renal perfusion, nephrotoxin exposure, or tubular injury in the ICU course. Minimal relevance for predicting creatinine rise at 60 hours."
diabetes,6,"Diabetes is a well-established risk factor for postoperative AKI due to microvascular disease, baseline nephropathy, and heightened susceptibility to ischemia/reperfusion injury. Particularly relevant in elderly cardiac surgery patients."
diab_ctrl,4,"Poor glycemic control can worsen endothelial dysfunction and infection risk, indirectly increasing AKI susceptibility, but it is not a direct renal injury biomarker. Incremental value may be modest compared with perioperative hemodynamics and renal labs."
pre_op_dyslipidemia,2,Dyslipidemia is not a direct driver of acute postoperative AKI and is largely a chronic cardiovascular risk marker. Limited independent predictive value once other comorbidities are included.
hypertension,5,"Hypertension is associated with chronic kidney disease and impaired renal autoregulation, increasing vulnerability to perioperative hypotension and low-flow states. A common, established comorbidity risk factor for AKI."
endocarditis_history,4,"Prior endocarditis can imply chronic inflammation, embolic phenomena, and complex valve surgery, which may indirectly increase AKI risk. It is not a direct renal perfusion marker in the early postoperative window."
chronic_lung_disease,5,"COPD is associated with perioperative hypoxemia/hypercapnia and higher risk of hemodynamic instability and prolonged ventilation, which can worsen renal perfusion. It is an established but indirect AKI risk factor."
pre_op_home_oxygen,5,"Home oxygen is a marker of severe chronic lung disease and limited physiologic reserve, often correlating with perioperative hypoxemia and higher ICU acuity. These factors can contribute to renal hypoperfusion and AKI risk."
bronchodilator_therapy,3,Bronchodilator use mainly reflects underlying obstructive lung disease severity and perioperative respiratory management. It has only an indirect and relatively weak link to postoperative AKI compared with hemodynamics and renal labs.
pre_op_sleep_apnea,4,"Sleep apnea is associated with cardiovascular comorbidity and intermittent hypoxemia, which may increase perioperative risk. Its relationship to post-cardiac surgery AKI is plausible but not a strong direct predictor."
pneumonia,6,"Active/recent pneumonia increases risk of sepsis physiology, hypoxemia, and vasopressor requirement, all of which can reduce renal perfusion and precipitate AKI. In elderly cardiac surgery patients it meaningfully raises postoperative complication risk."
iv_drug_abuse,3,"IV drug use can correlate with infections (including endocarditis) and chronic comorbidity burden, but it is not itself a direct perioperative driver of renal hypoperfusion. Predictive value for creatinine rise is typically indirect."
depression,2,Depression is not a physiologic mechanism for AKI and is mainly a marker of baseline health status and medication use. Any association with postoperative creatinine change is weak and confounded.
alcohol,3,"Alcohol use can be associated with liver disease, malnutrition, and perioperative complications, which may indirectly affect renal outcomes. By itself it is not a strong or specific predictor of AKI after cardiac surgery."
liver_dis,6,"Liver disease predisposes to hemodynamic instability, altered volume status, and hepatorenal physiology, increasing susceptibility to AKI. It is an established comorbidity risk factor in major surgery/ICU settings."
imm_supp,5,"Immunosuppression increases infection/sepsis risk and may involve nephrotoxic agents (e.g., calcineurin inhibitors), both of which can contribute to AKI. It is a moderate, indirect predictor without concurrent renal/hemodynamic data."
mediast_rad,4,"Prior mediastinal radiation can indicate complex redo surgery, adhesions, and higher perioperative complication risk, which may secondarily increase AKI risk. The link is indirect rather than a direct renal insult marker."
cancer,4,"Cancer is a marker of frailty, inflammation, and potential exposure to nephrotoxic therapies, which can increase perioperative risk. However, it is not a direct physiologic predictor of postoperative creatinine rise."
peripheral_artery_disease,6,"PAD reflects systemic atherosclerosis and microvascular disease, which is associated with baseline CKD risk and vulnerability to renal hypoperfusion during/after cardiac surgery. It is a well-recognized comorbidity risk factor for AKI."
pre_op_thoracic_aorta_disease,6,"Thoracic aortic disease often implies more complex surgery (longer bypass/cross-clamp, circulatory arrest) and higher embolic/hemodynamic risk, which can precipitate AKI. It is an established perioperative risk factor though not a direct biomarker."
syncope,2,Syncope is a nonspecific symptom and does not directly reflect renal perfusion or nephrotoxic exposure in the postoperative period. Any association with AKI is weak and mediated by underlying cardiac disease severity.
unresponsive_state_history,3,"History of unresponsiveness is a frailty/neurologic severity marker that may correlate with overall illness and perioperative instability, indirectly increasing AKI risk. It is not a direct renal perfusion or nephrotoxin marker."
cerebrovascular_disease,4,"Cerebrovascular disease reflects systemic atherosclerosis and vascular stiffness, which can track with impaired renal reserve and perioperative hypoperfusion risk. Association with AKI is plausible but indirect."
pre_op_hemoglobin,6,"Preoperative anemia reduces oxygen delivery and increases transfusion likelihood, both linked to cardiac-surgery–associated AKI. It is a common, established perioperative risk factor but not kidney-specific."
total_albumin_before_surgery,6,"Low albumin is a marker of malnutrition/inflammation and lower oncotic pressure, associated with worse postoperative outcomes and higher AKI risk. It reflects reduced physiologic reserve rather than a direct renal injury biomarker."
total_bilirubin_before_surgery,5,"Elevated bilirubin suggests hepatic dysfunction/congestion and higher perioperative risk, often coexisting with venous congestion and low effective arterial volume that can worsen renal perfusion. It is an indirect but clinically meaningful risk marker."
a1c_lvl,6,"Higher HbA1c indicates diabetes severity and chronic microvascular disease, which reduces renal reserve and increases susceptibility to ischemic/nephrotoxic injury after cardiac surgery. It is an established comorbidity-level risk factor."
pre_op_heparin_induced_thrombocytopenia_antibodies,3,"HIT antibodies mainly indicate thrombotic risk and anticoagulation complexity; renal impact is typically indirect (e.g., thrombosis/embolism or bleeding/transfusion). Not a primary predictor of creatinine rise in most cardiac surgery patients."
meld_scr,7,MELD (including creatinine) captures baseline renal function and hepatorenal physiology; higher scores indicate limited renal reserve and higher risk of postoperative creatinine rise. It is a strong preoperative risk stratifier for AKI.
bnp,7,"Elevated BNP reflects heart failure and volume/venous congestion, which are strongly linked to renal dysfunction via cardiorenal mechanisms and postoperative low-output states. It is a strong indirect predictor of AKI after cardiac surgery."
five_m_walk_test,4,"Poor 5-meter walk performance is a frailty marker associated with worse postoperative outcomes and complications, including AKI, through reduced physiologic reserve. The link is indirect and less specific than hemodynamic or renal markers."
previous_cardiovascular_intervention,4,"Prior cardiovascular interventions indicate advanced coronary/vascular disease and higher surgical complexity, which can increase AKI risk via longer procedures and hemodynamic instability. The relationship is plausible but nonspecific."
previous_coronary_bypass_graft,5,"Prior CABG suggests diffuse coronary disease and potential for redo sternotomy/complex surgery, increasing risk of hypotension, transfusion, and longer bypass time—contributors to AKI. It is an established but indirect risk factor."
previous_surgery_cardiac_value,5,"History of prior cardiac surgery often implies redo operations with higher bleeding risk, longer operative times, and greater hemodynamic stress, all associated with AKI. It is a moderate, indirect predictor."
previous_percutaneous_coronary_intervention,4,"Prior PCI indicates coronary disease burden and may correlate with comorbidities that predispose to AKI, but it is not itself a direct renal insult. Predictive value is modest and indirect."
previous_percutaneous_coronary_intervention_this_episode_of_care,6,"PCI during the same episode often implies recent contrast exposure and acute coronary syndrome physiology, both increasing susceptibility to postoperative AKI. This is more temporally relevant than remote PCI history."
previous_percutaneous_coronary_intervention_stent,4,Presence of a stent mainly reflects coronary disease history and need for antiplatelet therapy; renal risk is indirect via overall disease severity and perioperative bleeding/transfusion. Not a direct driver of creatinine rise.
time_since_previous_cardiac_intervention,3,"Short interval since prior intervention can proxy higher baseline cardiovascular disease burden and perioperative complexity, which indirectly raises AKI risk. It is not a direct renal perfusion or nephrotoxin marker."
past_cardiac_interventions,4,"History of prior cardiac interventions suggests advanced atherosclerotic disease and potentially more complex redo surgery, both associated with higher AKI risk. The link is indirect and heterogeneous across intervention types."
pre_op_ace_inhibitor_within_48_hours,6,"ACE inhibitors can blunt efferent arteriolar tone and reduce renal autoregulation during perioperative hypotension/vasoplegia, increasing AKI susceptibility. Effect size varies, but it is a recognized perioperative renal risk modifier."
pre_op_adp_inhibitor_within_5_days,2,"ADP inhibitors mainly affect bleeding/transfusion risk rather than renal perfusion directly. Any AKI association is indirect (e.g., bleeding, hypotension, transfusion), so predictive value is limited."
pre_op_amiodarone,3,"Amiodarone use is a marker of arrhythmia/heart failure severity and may correlate with hemodynamic instability, indirectly affecting renal perfusion. It is not a typical direct nephrotoxin in this setting."
pre_op_anticoagulants,3,"Anticoagulants can increase bleeding/transfusion and hemodynamic instability risk, which may secondarily contribute to AKI. They do not directly reflect renal injury physiology in most post-cardiac surgery patients."
pre_op_aspirin,2,Aspirin at antiplatelet doses has minimal direct nephrotoxicity and is common standard-of-care in cardiac patients. Any AKI signal is likely confounded by comorbidity rather than causal.
pre_op_beta_blockers,3,"Beta-blocker use reflects underlying CAD/CHF and may influence perioperative hemodynamics, but it is not a primary AKI driver. Association with AKI is generally indirect and context-dependent."
pre_op_beta_blocker_therapy_for_2_weeks,2,Chronic beta-blocker therapy is common and mainly indicates baseline cardiac disease management rather than acute renal risk. It has limited direct mechanistic linkage to postoperative creatinine rise.
pre_op_calcium_channel_blocker_therapy_for_2_weeks,2,Chronic calcium channel blocker therapy is not a strong or direct predictor of AKI and mostly reflects hypertension/angina management. Any renal association is weak and indirect.
pre_op_glycoprotein_inhibitor,3,"GPIIb/IIIa inhibitor use suggests recent ACS/PCI and higher bleeding/transfusion risk, which can indirectly increase AKI risk. It is not a direct renal biomarker or nephrotoxin."
pre_op_inotropic_agents,7,"Pre-op inotrope requirement is a strong marker of low cardiac output/shock physiology and poor renal perfusion reserve, which strongly predisposes to postoperative AKI. It captures severity of hemodynamic compromise before surgery."
pre_op_lipid_lowering_med,2,"Statins/lipid-lowering therapy are common and not directly nephrotoxic; some data suggest possible renal protection, but effects are modest. Predictive value for creatinine rise is generally weak."
pre_op_long_acting_nitrate_therapy_for_2_weeks,2,Long-acting nitrates indicate angina burden but do not directly affect renal injury pathways. Any AKI association is indirect via cardiovascular disease severity.
pre_op_iv_nitrates,4,"IV nitrates pre-op can indicate active ischemia/heart failure and may contribute to hypotension, indirectly affecting renal perfusion. It is a moderate severity marker but not a direct AKI biomarker."
pre_op_other_antianginal_therapy_for_2_weeks,2,Other chronic antianginal therapy mainly reflects baseline CAD symptom management and has no strong direct renal mechanism. Its association with AKI is likely weak and confounded.
pre_op_steroid_usage,3,"Chronic/acute steroid use can reflect frailty, inflammation, or autoimmune disease and may worsen infection/hyperglycemia, indirectly increasing AKI risk. It is not a direct perioperative renal perfusion marker."
pre_op_thrombin_inhibitor_within_24_hours,2,Primarily affects bleeding risk and transfusion needs rather than renal perfusion directly. Any AKI association is indirect via hemodynamic instability/bleeding.
pre_op_warfarin_within_5_days,2,Warfarin mainly signals anticoagulation/AF history and perioperative bleeding risk; renal impact is indirect. Not a strong predictor of postoperative creatinine rise by itself.
pre_op_factor_xa_inhibitor_within_5_days,2,"Similar to other anticoagulants, it mainly influences bleeding/transfusion and perioperative management. AKI linkage is indirect and typically weak."
pre_op_thrombin_inhibitor_within_5_days,2,"Represents anticoagulation exposure with potential bleeding/transfusion implications, not a direct renal insult. Any association with AKI is mediated through complications rather than kidney physiology."
pre_op_lipid_lowering_med_is_statin,3,Statin use is a marker of atherosclerotic burden and may be modestly protective/neutral for AKI in some cardiac surgery cohorts. Overall effect size is small and not a direct biomarker.
cardiac_catheterization_performed,6,"Recent/preceding catheterization can imply contrast exposure and higher cardiovascular complexity, both associated with postoperative AKI risk. Still indirect without timing/contrast dose details."
cor_anat_dis_known,4,"Known coronary anatomy disease reflects systemic atherosclerosis and higher surgical complexity, which can increase AKI risk indirectly. Not a direct hemodynamic or renal injury measure."
number_of_diseased_coronary_vessels,5,"Greater coronary disease burden correlates with comorbidity, longer/complex surgery, and higher likelihood of low cardiac output states that predispose to AKI. It remains an indirect risk marker."
aortic_valve_disease,5,"Aortic valve disease (especially severe AS) is associated with perioperative hemodynamic instability and higher-risk surgery, which can impair renal perfusion. Predictive but not kidney-specific."
mitral_valve_disease,4,"Mitral disease can be associated with heart failure/pulmonary hypertension and perioperative instability, indirectly increasing AKI risk. Less directly tied to renal hypoperfusion than low-output markers."
tricuspid_valve_disease,6,"Tricuspid disease often reflects right-sided failure/venous congestion, which can reduce renal perfusion gradient and worsen AKI risk. Congestive nephropathy mechanisms make this more relevant."
pulmonic_valve_disease,3,Pulmonic valve disease is less common and usually less directly linked to renal hypoperfusion than left-sided or severe right-sided failure states. Any AKI association is typically indirect.
n_past_cardiac_surgeries,6,"Re-operations are associated with longer bypass times, bleeding/transfusion, and perioperative instability, all established AKI risk factors. Strong procedural complexity marker in elderly patients."
status,4,"If this encodes operative urgency or preoperative clinical status, it can correlate with shock/instability and AKI risk. Importance depends on exact definition, so treated as a moderate indirect predictor."
current_case_canceled,1,Case cancellation is an administrative/operational outcome and does not reflect postoperative renal physiology for completed surgeries. No meaningful mechanistic link to creatinine rise at 60 hours.
operative_approach_converted,5,"Conversion (e.g., minimally invasive to open) often reflects intraoperative difficulty, longer ischemic/CPB time, bleeding, and hemodynamic instability, all of which increase AKI risk indirectly."
robotic,3,"Robotic approaches are generally less invasive and may reduce inflammatory/bleeding burden, but the link to postoperative creatinine rise is indirect and procedure-selection confounded."
op_cab,5,"CABG is associated with CPB exposure (if on-pump), atheroembolism risk, and perioperative hemodynamic swings that can contribute to AKI, though it is not a direct biomarker."
op_valve,6,"Valve surgery (often longer CPB/cross-clamp, higher transfusion/vasopressor needs) is a well-known context for postoperative AKI risk, especially in older adults."
other_cardiac_procedure_completed,5,"Additional cardiac procedures typically increase operative complexity and duration, raising risk of hypotension, inflammation, and transfusion—common pathways to AKI."
a_fib_proc,3,"Concomitant AF procedures (e.g., Maze) add some operative time but have no strong direct renal-specific mechanism beyond general surgical complexity."
aort_proc,8,"Aortic procedures carry high AKI risk due to prolonged CPB/circulatory arrest, embolic burden, and profound hemodynamic/ischemic insults affecting renal perfusion."
other_non_cardiac_procedure_done,4,"Non-cardiac concomitant procedures may increase operative stress and fluid shifts, but the relationship to AKI is variable and largely indirect."
appropriate_antibiotic_selection,2,Appropriate prophylactic antibiotic choice is important for infection prevention but is not a primary driver of early postoperative creatinine rise; nephrotoxicity depends on specific agents not captured here.
appropriate_antibiotic_administration_timing,1,Timing of prophylactic antibiotics mainly affects surgical site infection risk and has minimal direct physiologic linkage to AKI within 60 hours.
antibiotic_discontinuation_ordered,1,Discontinuation ordering reflects stewardship/process rather than renal physiology and is unlikely to predict creatinine ratio meaningfully.
additional_intraoperative_prophylactic_antibiotic_dose,2,"An extra prophylactic dose is usually protocol-driven (e.g., long case) and only weakly relates to AKI; it may proxy longer operative duration rather than nephrotoxicity."
operative_lowest_core_temperature,4,"Lower nadir temperature can indicate deeper hypothermia/complex CPB and potential low-flow states, but its association with AKI is indirect and confounded by procedure type."
operative_lowest_hemoglobin,7,"Low intraoperative hemoglobin reflects anemia/bleeding/hemodilution and is linked to renal hypoxia and transfusion needs, both strong contributors to postoperative AKI."
high_intra_glu,4,"Intraoperative hyperglycemia is associated with stress response and worse outcomes, but it is an indirect and nonspecific predictor of AKI compared with hemodynamics and renal labs."
cardiopulmonary_coronary_perfused_used,4,Use of specialized perfusion strategies may reflect higher-risk coronary pathology or complex CPB management; the renal link is indirect and largely mediated by overall perfusion quality and case complexity.
arterial_cannulation_site_aortic,3,Aortic cannulation is common and usually reflects standard CPB setup rather than renal-specific risk. Any AKI signal is indirect via overall case complexity and embolic/flow considerations.
arterial_cannulation_site_femoral,4,Femoral cannulation can be a marker of higher-risk/emergent or redo cases and may increase embolic/retrograde perfusion concerns that could affect renal perfusion. Still an indirect proxy rather than a direct AKI driver.
arterial_cannulation_site_axillary,3,Axillary cannulation is often chosen for aortic pathology and cerebral protection strategies; renal impact is mostly through case type/complexity. Not a direct physiologic marker of kidney injury.
arterial_cannulation_site_innominate,3,Innominate cannulation typically reflects arch/aortic procedures and perfusion strategy. Association with AKI is indirect via operative complexity and circulatory management.
arterial_cannulation_site_other,2,Heterogeneous category with unclear and inconsistent relationship to renal perfusion. Likely functions as a weak proxy for unusual anatomy or complex cases.
venous_cannulation_site_femoral,3,Femoral venous cannulation may indicate minimally invasive approaches or complex access issues; renal relevance is indirect. It does not directly reflect renal perfusion or nephrotoxic exposure.
venous_cannulation_site_jugular,2,Jugular venous cannulation for CPB/venous drainage is uncommon and mainly reflects surgical approach. Limited direct mechanistic link to postoperative creatinine rise.
venous_cannulation_site_right_atrial,2,Right atrial venous cannulation is standard for many CPB cases and provides little discrimination for AKI risk. Any association would be weak and confounded by procedure type.
venous_cannulation_site_left_atrial,2,Left atrial cannulation is procedure-specific and not a direct determinant of renal ischemia or nephrotoxin exposure. Likely weakly informative at best.
venous_cannulation_site_pulmonary,2,Pulmonary venous/arterial cannulation reflects specialized procedures and does not directly indicate renal hypoperfusion. Any AKI association is indirect through operative complexity.
venous_cannulation_site_bicaval,3,Bicaval cannulation is more common in valve/congenital-type exposures and may correlate with longer/complex CPB runs. Renal relevance remains indirect compared with CPB duration and hemodynamics.
venous_cannulation_site_other,2,Mixed category with unclear physiologic meaning for kidney outcomes. Likely a weak proxy for atypical cases rather than a causal AKI factor.
cardiopulmonary_bypass_time,8,"Longer CPB time is a strong, well-established predictor of postoperative AKI via inflammation, hemolysis, nonpulsatile flow, and ischemia-reperfusion injury. Particularly relevant in very elderly patients with limited renal reserve."
circulatory_arrest,7,"Circulatory arrest implies periods of markedly reduced systemic perfusion and high operative complexity, both strongly linked to AKI risk. Even with protective strategies, it is a major renal ischemic stressor."
deep_hypothermic_circulatory_arrest_time,8,"Longer DHCA time increases duration of low/absent renal perfusion and ischemia-reperfusion injury, strongly predicting postoperative creatinine rise. It also correlates with complex arch surgery and higher inflammatory burden."
cerebral_perfusion_utilized,4,Use of cerebral perfusion is primarily a neuroprotection strategy and serves as a proxy for arch surgery/circulatory arrest cases. Renal impact is indirect and largely mediated by arrest duration and overall perfusion management.
cerebral_perfusion_time,4,"Longer selective cerebral perfusion often reflects complex arch surgery and prolonged bypass, which can increase systemic inflammatory response and renal hypoperfusion risk. It is an indirect proxy rather than a kidney-specific driver."
