value,importance,reason
age,3,"Older age reflects reduced renal reserve and higher susceptibility to perioperative AKI, even within an ≥80 cohort. It is a baseline risk factor but not a direct near-term physiologic indicator of Hour 60 creatinine rise."
gender,2,"Sex is a modest baseline risk modifier for AKI via differences in body composition, comorbidity patterns, and perioperative physiology. It is indirect and typically weaker than hemodynamics/labs closer to the outcome."
race_caucasian,1,Race category is not a direct renal mechanism and often acts as a weak proxy for social/healthcare factors rather than kidney injury pathways. Limited expected incremental value for predicting Hour 60 creatinine ratio in a sparse model.
race_black,2,"Black race can correlate with baseline CKD risk and creatinine generation differences, which may influence postoperative creatinine trajectories. Still indirect and prone to confounding/proxy effects rather than capturing perioperative renal insult."
race_asian,1,Asian race is an indirect demographic descriptor with inconsistent linkage to postoperative AKI once clinical variables are included. Likely low incremental predictive value versus physiologic and renal-specific features.
race_native_am,2,Native American race may correlate with higher prevalence of diabetes/CKD and thus lower renal reserve. However it remains a distal proxy variable and is not a direct marker of perioperative renal injury.
race_native_pacific,1,Native Pacific race is a demographic proxy with uncertain and typically small independent association with acute postoperative creatinine rise. Not renal-specific and likely redundant with comorbidity and physiologic features.
race_other,1,Other/unspecified race is heterogeneous and mainly a proxy for unmeasured factors. It has low renal specificity and limited expected predictive utility for Hour 60 creatinine ratio.
ethnicity,1,"Ethnicity is a broad demographic variable with weak, indirect association to AKI risk after adjusting for comorbidities and perioperative course. It is not temporally or mechanistically proximal to postoperative creatinine change."
height_cm,1,Height mainly reflects body size and is not directly linked to renal perfusion or kidney injury pathways. Any effect on creatinine is indirect (muscle mass) and usually small compared with perioperative renal/hemodynamic signals.
weight_kg,2,"Weight captures body habitus and may relate to dosing, hemodilution, and risk of complications that can affect renal outcomes. It is still indirect and less informative than renal labs, urine output, and hemodynamics."
family_history_premature_cardiac_death,1,Family history reflects long-term cardiovascular risk rather than acute perioperative renal injury mechanisms. It is temporally distant and unlikely to add meaningful predictive signal for Hour 60 creatinine ratio.
diabetes,3,"Diabetes is an established AKI risk factor via microvascular disease and reduced renal reserve, relevant in cardiac surgery patients. It is prognostically meaningful but still a baseline comorbidity rather than a near-term biomarker."
diab_ctrl,2,Diabetes control status is a coarse proxy for chronic metabolic health and may correlate with CKD burden and perioperative vulnerability. It is indirect and often noisy compared with direct renal function and perfusion measures.
pre_op_dyslipidemia,1,"Dyslipidemia is a chronic cardiovascular risk marker with weak direct linkage to acute postoperative kidney injury. Likely minimal incremental value once diabetes, hypertension, and perioperative physiology are modeled."
hypertension,3,"Hypertension is associated with chronic kidney disease and impaired autoregulation, increasing susceptibility to perioperative renal hypoperfusion. It is a moderate baseline predictor but not a direct indicator of evolving AKI by Hour 60."
endocarditis_history,2,"History of infective endocarditis reflects prior severe infection/valvular disease and possible prior antibiotic exposure. It is only an indirect, baseline risk marker for postoperative AKI and not temporally proximal to Hour 60 creatinine changes."
chronic_lung_disease,2,"Chronic lung disease is a comorbidity associated with higher perioperative risk and potential hypoxemia/hypercapnia. Renal linkage is indirect (overall frailty/illness severity), so predictive value for creatinine_ratio is likely weak."
pre_op_home_oxygen,2,Home oxygen use is a marker of advanced chronic respiratory disease and limited physiologic reserve. It may correlate with postoperative instability but is not kidney-specific and is a baseline proxy variable.
bronchodilator_therapy,1,Bronchodilator therapy mainly indicates obstructive lung disease treatment and care patterns. It has minimal mechanistic connection to renal perfusion or kidney injury and is largely nonspecific.
pre_op_sleep_apnea,2,"Sleep apnea is associated with cardiometabolic comorbidity and intermittent hypoxemia, which can increase perioperative risk. However, it is not a direct AKI pathway marker and is a relatively weak baseline predictor of Hour 60 creatinine_ratio."
pneumonia,3,"Pneumonia indicates active infection/inflammation and can drive hypotension, hypoxemia, and nephrotoxic antibiotic exposure, all relevant AKI pathways. While not kidney-specific, it can be a moderate prognostic factor for postoperative creatinine rise."
iv_drug_abuse,1,IV drug abuse is a social/behavioral history that may correlate with infections or liver disease but is not directly tied to perioperative renal physiology. For elderly cardiac surgery patients it is likely rare and weakly informative for creatinine_ratio.
depression,1,Depression is a nonspecific comorbidity that may reflect overall health status or medication use but lacks a direct renal injury mechanism. It is unlikely to add meaningful signal for Hour 60 creatinine_ratio.
alcohol,2,"Alcohol use can be associated with liver disease, malnutrition, and hemodynamic vulnerability, which may indirectly affect AKI risk. The relationship is heterogeneous and not kidney-specific, so expected predictive value is limited."
liver_dis,3,"Liver disease is linked to altered hemodynamics (low effective arterial volume), inflammation, and higher risk of postoperative shock and AKI. It is a meaningful baseline risk factor but still indirect relative to near-term renal biomarkers."
imm_supp,2,"Immunosuppression increases infection risk and may reflect chronic illness; some agents can be nephrotoxic, but this variable is broad. Overall it is an indirect predictor with substantial heterogeneity and proxy penalty."
mediast_rad,2,"Prior mediastinal radiation suggests complex cardiac pathology and potentially more difficult surgery, which can increase perioperative risk. Renal relevance is indirect (procedure complexity/instability) rather than a direct AKI pathway."
cancer,2,"Cancer history reflects chronic disease burden and possible prior nephrotoxic exposures, but effects vary widely by type and treatment. It is a baseline, nonspecific risk marker with modest expected value for Hour 60 creatinine_ratio."
peripheral_artery_disease,3,"Peripheral artery disease is a marker of systemic atherosclerosis and microvascular disease, correlating with reduced renal reserve and higher AKI risk after cardiac surgery. It is a moderate, established comorbidity predictor though not temporally proximal."
pre_op_thoracic_aorta_disease,3,"Thoracic aortic disease often implies more complex surgery (longer bypass/circulatory arrest risk) and higher embolic/ischemic burden, which can precipitate AKI. It is not kidney-specific but has a clearer causal link via operative complexity and perfusion risk."
syncope,1,"Syncope is a symptom with many etiologies and does not directly encode renal function or renal perfusion status in the perioperative window. It is likely a weak, nonspecific proxy for overall cardiovascular disease."
unresponsive_state_history,2,History of unresponsiveness/altered mental status is a nonspecific marker of frailty or prior neurologic injury. It has only indirect linkage to postoperative AKI/creatinine rise and mainly proxies overall vulnerability rather than renal mechanism.
cerebrovascular_disease,2,Chronic cerebrovascular disease reflects systemic atherosclerosis and comorbidity burden. It is an indirect AKI risk factor (vascular disease/frailty) but not kidney-specific and adds limited near-term prognostic signal for Hour-60 creatinine ratio.
pre_op_hemoglobin,3,Baseline anemia reduces oxygen delivery and is associated with higher cardiac-surgery AKI risk (hemodilution/transfusion/ischemia pathways). It is a moderate prognostic factor but not a direct renal biomarker.
total_albumin_before_surgery,3,"Pre-op hypoalbuminemia indicates poor nutritional/inflammatory state and lower physiologic reserve, which correlates with postoperative AKI risk. It is moderately predictive but nonspecific and partly a general illness severity proxy."
total_bilirubin_before_surgery,2,Baseline bilirubin reflects hepatic dysfunction/cholestasis and overall organ reserve. It is only indirectly related to renal outcomes (cardiohepatic congestion/systemic illness) and is not a proximal kidney injury marker.
a1c_lvl,3,"HbA1c captures chronic glycemic control/diabetes severity, which is linked to reduced renal reserve and higher AKI susceptibility after cardiac surgery. It is an established risk factor but temporally distal and not kidney-specific in the acute window."
pre_op_heparin_induced_thrombocytopenia_antibodies,1,"HIT antibody status mainly reflects anticoagulation history and potential thrombosis risk, not a common direct driver of postoperative creatinine rise. Any association with AKI would be rare/indirect and largely care-context dependent."
meld_scr,4,"MELD (including creatinine) summarizes baseline renal function and hepatic dysfunction, both strongly tied to postoperative renal vulnerability. Because it embeds creatinine, it is closely linked to renal reserve and thus a strong predictor of subsequent creatinine ratio."
bnp,3,"BNP reflects cardiac dysfunction and venous congestion, which can impair renal perfusion and contribute to cardiorenal AKI after surgery. It is a moderate predictor but indirect and influenced by age and chronic heart failure."
five_m_walk_test,2,"5-meter walk time is a frailty/functional status measure associated with postoperative complications. It is a weak-to-moderate indirect predictor for AKI via overall reserve, but not renal-specific."
previous_cardiovascular_intervention,2,Prior cardiovascular interventions indicate advanced coronary/vascular disease and comorbidity burden. This is an indirect AKI risk marker but lacks renal specificity and proximal physiologic information.
previous_coronary_bypass_graft,2,History of prior CABG suggests severe coronary disease and potentially higher surgical complexity. It may weakly increase AKI risk via comorbidity and operative risk but is not a direct renal pathway variable.
previous_surgery_cardiac_value,2,Prior cardiac surgery is a marker of reoperative status and higher perioperative risk. Its relationship to creatinine rise is indirect (complexity/bleeding/hemodynamics) and not kidney-specific.
previous_percutaneous_coronary_intervention,2,Prior PCI reflects coronary disease burden and prior contrast exposure history. It is an indirect predictor at best and temporally distant from the postoperative Hour-60 creatinine outcome.
previous_percutaneous_coronary_intervention_this_episode_of_care,3,"PCI during the same episode implies recent contrast load and acute coronary instability, both of which can increase AKI risk around surgery. This is more temporally relevant than remote PCI but still indirect relative to direct renal biomarkers."
previous_percutaneous_coronary_intervention_stent,2,Presence of a coronary stent mainly indicates prior CAD/PCI history and antiplatelet context. It has limited direct mechanistic linkage to postoperative renal dysfunction and is largely a comorbidity proxy.
time_since_previous_cardiac_intervention,2,Represents prior cardiac procedural history and chronic cardiovascular disease burden. Only indirectly relates to AKI risk via baseline frailty/complexity and is not temporally proximal to the 60h creatinine outcome.
past_cardiac_interventions,2,"Counts/encodes prior cardiac procedures, a proxy for advanced CAD/valvular disease and surgical complexity. Renal linkage is indirect (comorbidity/illness severity) rather than a kidney-specific mechanism."
pre_op_ace_inhibitor_within_48_hours,3,ACEi/ARB exposure can reduce efferent arteriolar tone and predispose to perioperative creatinine rise during hypotension/low effective circulating volume. It is a plausible AKI risk modifier but still pre-op and not a direct injury biomarker.
pre_op_adp_inhibitor_within_5_days,1,Recent P2Y12 inhibitor use mainly reflects antiplatelet therapy and bleeding/transfusion context. Any association with AKI is weak and largely mediated by downstream events not captured directly here.
pre_op_amiodarone,1,Amiodarone use reflects arrhythmia history and perioperative rhythm management. It has no strong direct pathway to postoperative AKI/creatinine rise in this setting.
pre_op_anticoagulants,2,"Anticoagulant use indicates AF/VTE/mechanical valve and may increase bleeding/transfusion risk, which can secondarily affect renal perfusion. Renal specificity is low and it is mostly a comorbidity/treatment-context proxy."
pre_op_aspirin,1,Aspirin use is common and primarily reflects cardiovascular prevention. It has minimal direct predictive value for postoperative creatinine ratio compared with hemodynamics and renal biomarkers.
pre_op_beta_blockers,2,Beta-blocker use reflects CAD/HF management and may influence perioperative hemodynamics. Renal relevance is indirect and confounded by indication and overall cardiac disease severity.
pre_op_beta_blocker_therapy_for_2_weeks,2,Chronic beta-blocker therapy indicates stable long-term cardiac management rather than an acute renal risk signal. Any AKI association is indirect via cardiac reserve/hemodynamic tolerance.
pre_op_calcium_channel_blocker_therapy_for_2_weeks,1,Chronic CCB therapy mainly reflects hypertension/angina treatment. It has weak and nonspecific linkage to postoperative AKI compared with perfusion and renal function measures.
pre_op_glycoprotein_inhibitor,2,Use of GP IIb/IIIa inhibitors suggests recent ACS/PCI and higher bleeding/transfusion risk. Renal impact is indirect and largely mediated through perioperative complications rather than kidney-specific physiology.
pre_op_inotropic_agents,4,"Pre-op inotrope requirement signals low cardiac output/shock physiology and poor renal perfusion reserve, a strong AKI precursor. Although preoperative, it is closely tied to perioperative hemodynamic instability that drives creatinine rise."
pre_op_lipid_lowering_med,1,Statin/lipid-lowering therapy is a common chronic medication and mostly reflects baseline cardiovascular risk management. It is not kidney-specific and has limited prognostic proximity to 60h creatinine changes.
pre_op_long_acting_nitrate_therapy_for_2_weeks,1,Chronic nitrate therapy indicates angina/CAD symptom control. It provides little direct information about renal perfusion or evolving AKI risk.
pre_op_iv_nitrates,3,"IV nitrates suggest active ischemia/heart failure management and potentially unstable hemodynamics pre-op. This can correlate with low effective renal perfusion and perioperative AKI risk, though still indirect and treatment-proxy confounded."
pre_op_other_antianginal_therapy_for_2_weeks,1,Other chronic antianginal therapy is a broad marker of CAD treatment. It is nonspecific and not mechanistically close to postoperative creatinine rise.
pre_op_steroid_usage,2,"Pre-op steroid exposure may reflect chronic inflammatory disease and can affect glucose/infection risk, indirectly influencing AKI risk. It is not kidney-specific and is a weak, distal predictor of Hour-60 creatinine change."
pre_op_thrombin_inhibitor_within_24_hours,1,Recent direct thrombin inhibitor use mainly reflects anticoagulation management and bleeding risk rather than renal physiology. Any renal signal is indirect (care-process/proxy) and unlikely to add much to creatinine ratio prediction.
pre_op_warfarin_within_5_days,1,"Warfarin exposure is primarily a marker of comorbidity (e.g., AF) and perioperative anticoagulation planning. It has no direct mechanistic link to early postoperative AKI and is mostly a proxy variable."
pre_op_factor_xa_inhibitor_within_5_days,1,Factor Xa inhibitor use reflects anticoagulation status and perioperative management decisions. It is not renal-specific and provides minimal direct prognostic information for postoperative creatinine rise.
pre_op_thrombin_inhibitor_within_5_days,1,"Thrombin inhibitor use within 5 days is largely an anticoagulation/care-context marker. Renal relevance is weak and indirect, so expected incremental value for Hour-60 creatinine ratio is low."
pre_op_lipid_lowering_med_is_statin,2,"Statin use is a marker of atherosclerotic burden and chronic cardiovascular risk; some studies suggest modest AKI associations but not strongly kidney-specific. As a baseline medication, it is temporally distal and likely a mild predictor at best."
cardiac_catheterization_performed,3,"Pre-op catheterization can imply recent contrast exposure and higher coronary disease complexity, both linked to AKI risk via nephrotoxicity and hemodynamic vulnerability. It is still indirect and timing may vary, but can be a moderate predictor in older cardiac surgery patients."
cor_anat_dis_known,2,"Known coronary anatomy disease indicates underlying CAD and systemic vascular disease, which correlates with reduced renal reserve and perioperative risk. It is a chronic, nonspecific risk marker rather than a near-term renal mechanism."
number_of_diseased_coronary_vessels,3,"Greater multivessel CAD reflects higher atherosclerotic burden and often more complex surgery/CPB exposure, increasing AKI susceptibility through perfusion and inflammatory pathways. It is not kidney-specific but is a reasonably strong baseline prognostic marker."
aortic_valve_disease,3,"Aortic valve disease (often severe AS) can be associated with low forward flow, perioperative hemodynamic instability, and higher CPB complexity, all relevant to renal hypoperfusion risk. It is an indirect but clinically meaningful AKI risk factor."
mitral_valve_disease,2,"Mitral valve disease can reflect chronic heart failure/pulmonary hypertension and perioperative complexity, which may increase AKI risk indirectly. The linkage to renal injury is less direct than sustained shock or renal biomarkers, so predictive value is moderate-low."
tricuspid_valve_disease,3,"Tricuspid disease often tracks right-sided failure and venous congestion, which can impair renal function via elevated renal venous pressure (congestive nephropathy). This is a plausible mechanistic pathway, making it a moderate predictor despite being a baseline diagnosis."
pulmonic_valve_disease,1,"Pulmonic valve disease is relatively uncommon and usually less tied to perioperative renal perfusion or AKI pathways in typical adult cardiac surgery cohorts. It is a weak, nonspecific predictor for Hour-60 creatinine ratio."
n_past_cardiac_surgeries,3,"More prior cardiac surgeries imply higher operative complexity, adhesions, longer bypass times, and greater transfusion/instability risk, all associated with AKI. It is not kidney-specific but is a meaningful baseline risk stratifier."
status,2,"A generic 'status' variable likely encodes administrative/clinical category (e.g., elective vs urgent) and overall acuity rather than renal physiology. It may correlate with AKI risk through severity/proxy effects but is not mechanistically specific."
current_case_canceled,1,Case cancellation is primarily an operational/process outcome and may reflect logistics or non-renal clinical issues. It has minimal direct relevance to postoperative creatinine trajectory and is likely noise for this prediction task.
operative_approach_converted,3,"Conversion (e.g., minimally invasive/robotic to open) often signals intraoperative complexity, longer ischemic time, bleeding, and hemodynamic instability that can predispose to AKI. It is an indirect but established perioperative risk marker rather than a renal-specific biomarker."
robotic,2,"Robotic approach mainly reflects surgical technique and case selection, with only indirect links to renal outcomes via operative duration, hemodynamics, and transfusion needs. It is not kidney-specific and may act as a proxy for patient selection and procedural complexity."
op_cab,3,"CABG is associated with CPB exposure (if on-pump), embolic/inflammatory load, and perioperative hypotension that can contribute to AKI risk. Procedure type is a moderate baseline prognostic factor but not temporally close or renal-specific."
op_valve,3,"Valve surgery often entails longer CPB/cross-clamp times and higher risk of low cardiac output syndrome, both relevant AKI pathways. Still, it is a procedure-category proxy rather than a direct physiologic indicator of evolving renal injury."
other_cardiac_procedure_completed,3,"Additional cardiac procedures generally indicate greater operative complexity and physiologic stress, increasing AKI risk through longer bypass time, bleeding, and instability. Predictive value is moderate and indirect."
a_fib_proc,2,"AF ablation/maze procedures add operative time and may correlate with comorbidity burden, but have weak direct linkage to renal perfusion or nephrotoxicity. Mostly a complexity proxy with limited renal specificity."
aort_proc,4,"Aortic procedures are strongly associated with embolic load, prolonged circulatory support, hypothermia, and higher rates of shock/bleeding—well-established drivers of postoperative AKI. This is a strong procedural risk marker even though it is not a kidney biomarker."
other_non_cardiac_procedure_done,2,"Concurrent non-cardiac procedures mainly reflect overall operative burden and complexity, which can correlate with AKI via longer anesthesia and instability. The association is indirect and heterogeneous, limiting specificity."
appropriate_antibiotic_selection,1,Appropriate prophylactic antibiotic choice is primarily a quality/process measure and not a direct determinant of creatinine rise by 60 hours. Any renal signal is weak and confounded by institutional practice patterns.
appropriate_antibiotic_administration_timing,1,Timing of prophylactic antibiotics is a care-process metric with minimal mechanistic connection to early postoperative creatinine changes. It is largely unrelated to renal perfusion or nephrotoxic exposure in this context.
antibiotic_discontinuation_ordered,1,"Ordering discontinuation reflects stewardship/process rather than renal physiology, and is unlikely to drive creatinine ratio at 60 hours. Any association would be indirect via infection suspicion or practice variation."
additional_intraoperative_prophylactic_antibiotic_dose,2,"An extra prophylactic dose may proxy longer operations or higher blood loss/volume of distribution, which can correlate with AKI risk. The antibiotic exposure itself is usually not nephrotoxic at prophylactic dosing, so renal specificity is low."
operative_lowest_core_temperature,3,"Lower nadir temperature reflects hypothermia strategy and often correlates with CPB duration/complexity and potential low-flow states, which can affect renal perfusion. It is a moderate indirect predictor with some mechanistic plausibility but not kidney-specific."
operative_lowest_hemoglobin,4,"Low intraoperative hemoglobin indicates anemia/hemodilution/bleeding and reduced oxygen delivery, which can precipitate renal ischemia and AKI, especially in older patients. The nadir (extreme) captures the insult better than averages and is a strong perioperative risk signal."
high_intra_glu,2,"Intraoperative hyperglycemia reflects stress response and diabetes/insulin resistance and is associated with worse outcomes, but links to AKI are indirect and confounded. It is a weak-to-moderate prognostic marker rather than a proximal renal driver."
cardiopulmonary_coronary_perfused_used,3,"Use of cardiopulmonary support/perfusion strategy implies CPB exposure and altered renal perfusion/inflammatory activation, established contributors to postoperative AKI. However, it is a coarse procedural indicator and less informative than post-op hemodynamics/labs closer to hour 60."
arterial_cannulation_site_aortic,2,"Aortic arterial cannulation generally reflects standard CPB setup and surgical approach rather than renal physiology. Any AKI signal is indirect via case complexity and embolic/flow considerations, so predictive value for Hour-60 creatinine ratio is limited."
arterial_cannulation_site_femoral,3,"Femoral arterial cannulation often indicates more complex/aortic pathology or redo/emergent cases and may increase embolic risk and malperfusion potential. Renal relevance is indirect but plausible through perfusion/atheromatous burden, giving moderate prognostic value."
arterial_cannulation_site_axillary,2,Axillary cannulation is typically chosen for aortic disease/arch work and cerebral protection strategy; renal impact is not direct. It mainly proxies operative strategy and complexity rather than a kidney-specific pathway.
arterial_cannulation_site_innominate,2,"Innominate cannulation is a technique choice often tied to arch surgery and cerebral perfusion planning. It has weak, indirect linkage to postoperative renal dysfunction beyond overall procedural complexity."
arterial_cannulation_site_other,2,An 'other' cannulation site suggests atypical anatomy or complex operative circumstances. This is a nonspecific proxy for complexity with limited kidney-specific mechanistic information.
