value,importance,reason
25_36h_absolute_neutrophil_count_measured,2,"More frequent ANC measurement at 25–36h may reflect clinician concern for infection/sepsis, which can precipitate AKI. Still a behavioral proxy, so capped at low importance."
0_12h_troponin_measured,1,Troponin ordering frequency is mostly protocolized after cardiac surgery and reflects surveillance rather than renal physiology. Early (0–12h) measurement is common and nonspecific for AKI risk.
13_24h_troponin_measured,2,"More frequent troponin checks may indicate suspected perioperative MI/low cardiac output, which can reduce renal perfusion and increase AKI risk. As a measured-count feature it remains an indirect proxy."
25_36h_troponin_measured,2,"At 25–36h, repeated troponins can signal ongoing myocardial injury/instability with potential renal hypoperfusion. Still a utilization marker rather than the troponin value itself, so limited importance."
0_12h_po2_mean,1,Average PaO2 in the immediate postoperative period is heavily influenced by ventilator settings and transient physiology and is not a primary AKI driver. Hypoxemia-related AKI risk is better captured by extremes rather than mean early values.
13_24h_po2_mean,2,"Sustained lower oxygenation can contribute to systemic hypoxia and renal ischemic susceptibility, but PaO2 mean is still an indirect marker. Collinearity-wise, mean is less informative than true hypoxemic extremes."
25_36h_po2_mean,2,"Closer to outcome, persistently impaired oxygenation may reflect ongoing cardiopulmonary dysfunction associated with AKI risk. However, mean PaO2 is less pathologic than hypoxemic minima and can be confounded by FiO2."
0_12h_po2_max,1,"High PaO2 peaks usually reflect high FiO2 rather than a renal insult, and hyperoxia is not a strong established predictor of AKI in this context. In 0–12h it is particularly protocol-driven."
13_24h_po2_max,1,PaO2 maxima mainly capture ventilator/FiO2 management rather than kidney perfusion or injury. Any hyperoxia-AKI link is weak and inconsistent compared with hemodynamic predictors.
25_36h_po2_max,1,"Even near 60h, PaO2 maxima are more reflective of oxygen therapy than renal pathophysiology. Extremes relevant to AKI would more plausibly be hypoxemia (min) rather than hyperoxemia (max)."
0_12h_po2_min,2,"Low PaO2 can reflect hypoxemia and overall cardiopulmonary instability that may contribute to renal ischemia, but early post-op hypoxemia is often transient and multifactorial. In the 0–12h epoch it is a weak-to-indirect AKI signal."
13_24h_po2_min,2,"Persistent hypoxemia into 13–24h suggests ongoing respiratory/cardiac dysfunction and higher illness severity, which can worsen renal oxygen delivery. Still indirect and not kidney-specific."
25_36h_po2_min,3,"Hypoxemia close to the outcome window can indicate sustained low oxygen delivery and/or low cardiac output physiology, both associated with AKI risk after cardiac surgery. As an extreme (min) it captures acute insults better than mean PaO2."
0_12h_po2_measured,1,Measurement frequency mainly reflects monitoring intensity/acuity rather than a physiologic mechanism of AKI. Early post-op ABG frequency is routine after cardiac surgery.
13_24h_po2_measured,1,"More frequent PaO2 checks may indicate instability, but it is primarily clinician behavior and highly practice-dependent. Weak and non-specific for AKI."
25_36h_po2_measured,2,"Frequent PaO2 measurement late may reflect ongoing ventilatory/hemodynamic instability and higher severity of illness, which correlates with AKI risk. Still an indirect behavioral proxy, not a renal biomarker."
0_12h_potassium_mean,2,"Potassium abnormalities can accompany renal dysfunction, acidosis, transfusion/hemolysis, or shifts after bypass, but mean values early are diluted by treatment and transient shifts. Extremes are more informative than mean for AKI linkage."
13_24h_potassium_mean,2,"Sustained potassium elevation can suggest evolving renal impairment, but mean values are influenced by supplementation/diuretics/insulin and may mask peaks. Indirect signal in this mid epoch."
25_36h_potassium_mean,3,A higher sustained potassium level closer to hour 60 can reflect reduced renal excretion and is more consistent with evolving AKI. Still less specific than potassium_max for capturing clinically meaningful hyperkalemia.
0_12h_potassium_max,3,"Hyperkalemia peaks can be an early marker of impaired renal excretion or severe tissue injury/hemolysis after CPB, and may track with AKI risk. In 0–12h it is tempered by common transient post-op shifts and rapid correction."
13_24h_potassium_max,3,A potassium peak in 13–24h is more suggestive of evolving renal dysfunction than immediate post-op shifts and correlates with AKI risk. Still not definitive because medications and supplementation can contribute.
25_36h_potassium_max,4,"Late hyperkalemia is a strong indicator of reduced renal clearance and/or severe ongoing shock/acid-base derangement, both tightly linked to AKI progression. As an extreme value near the outcome window, it is more predictive than mean/min."
0_12h_potassium_min,1,Hypokalemia is common from diuretics/insulin shifts and does not directly indicate AKI; it more often reflects treatment effects. As a minimum value it is not a typical trigger/marker for postoperative AKI.
13_24h_potassium_min,1,Low potassium in this period is usually iatrogenic or redistribution and is not a recognized predictor of AKI compared with hyperkalemia. Weak physiologic linkage to creatinine rise.
25_36h_potassium_min,1,"A low potassium minimum late is generally driven by therapy (diuresis, insulin, alkalosis) rather than renal failure physiology. It is not a direct marker of impending creatinine rise."
0_12h_potassium_measured,1,Potassium measurement frequency reflects monitoring intensity and routine post-cardiac surgery electrolyte management rather than a causal AKI mechanism. Early frequent checks are standard-of-care.
13_24h_potassium_measured,2,"Measurement frequency reflects clinician concern for electrolyte/renal issues but is not a physiologic driver of AKI. In the 13–24h trajectory phase, ordering patterns are only a modest proxy for evolving instability."
25_36h_potassium_measured,2,"More frequent potassium checks near 36h can indicate concern for renal dysfunction, acidosis, or arrhythmia risk, but it remains a behavioral proxy. Per rules, _measured features should stay low unless uniquely indicative."
0_12h_total_bilirubin_mean,2,"Early postoperative bilirubin can reflect hemolysis/CPB effect or hepatic congestion, which correlates with systemic hypoperfusion and AKI risk. The mean in 0–12h is less informative than extremes and this epoch is often transient."
0_12h_total_bilirubin_max,3,"An early bilirubin spike may signal significant hemolysis, hepatic ischemia, or right-sided congestion—systemic insults associated with higher AKI risk after cardiac surgery. Max better captures acute injury than mean/min, though 0–12h changes can be transient."
0_12h_total_bilirubin_min,1,The minimum bilirubin in the immediate postoperative window is not a plausible marker of renal hypoperfusion or nephrotoxic exposure. It adds little beyond baseline/normal physiology and is likely redundant.
0_12h_total_bilirubin_measured,1,"How often bilirubin is checked mainly reflects routine post-op labs or clinician concern for liver dysfunction rather than kidney injury. In 0–12h, ordering is common and nonspecific."
13_24h_total_bilirubin_measured,1,"Repeat bilirubin ordering may reflect concern for hepatic dysfunction/hemolysis but is not a direct AKI mechanism. As a _measured feature it is a weak, nonspecific acuity proxy."
25_36h_total_bilirubin_measured,2,"Persistent bilirubin monitoring closer to 36h can indicate ongoing shock liver/congestion, which often co-tracks with AKI risk, but it remains an ordering-behavior surrogate. Therefore it should stay low per the rubric."
0_12h_rbc_count_mean,2,"Lower RBC count/anemia can worsen renal oxygen delivery and is associated with transfusion/bleeding, indirectly increasing AKI risk. The mean in 0–12h is heavily influenced by hemodilution from CPB and fluids, limiting specificity."
13_24h_rbc_count_mean,2,"Ongoing anemia in the trajectory phase may reflect bleeding/hemodilution and reduced oxygen delivery, indirectly contributing to AKI risk. Mean values are less sensitive than minima for capturing clinically relevant anemia."
25_36h_rbc_count_mean,3,"Sustained anemia closer to the outcome window can meaningfully reduce renal oxygen delivery and correlate with ongoing bleeding/transfusion needs, both linked to AKI after cardiac surgery. Mean is still less specific than the minimum but becomes more informative in 25–36h."
0_12h_rbc_count_max,1,A higher RBC count is not a typical trigger for postoperative AKI and may simply reflect hemoconcentration or lab variability. Max is unlikely to capture the relevant pathology compared with low values.
13_24h_rbc_count_max,1,Elevated RBC count is not an established predictor of AKI in this setting and is often non-pathologic. It is also likely redundant with other volume status markers.
25_36h_rbc_count_max,1,High RBC count late is not a direct marker of renal injury and is less clinically relevant than anemia-related minima. It provides limited incremental prognostic value for creatinine rise.
0_12h_rbc_count_min,3,"The minimum RBC count captures clinically meaningful anemia from bleeding/hemodilution, which can impair renal oxygen delivery and is associated with transfusion and AKI risk. Even in 0–12h (often transient), the nadir is more informative than mean/max."
13_24h_rbc_count_min,3,"A low RBC nadir during 13–24h suggests persistent anemia/ongoing bleeding or dilution, which can contribute to renal hypoxia and correlate with higher AKI risk. Min is preferred over mean/max to reduce collinearity and capture the relevant insult."
25_36h_rbc_count_min,2,"Low RBC count can reflect bleeding/hemodilution and reduced oxygen delivery, which may contribute indirectly to renal ischemia. It is not a direct AKI biomarker, but in the 25–36h window a low nadir may track ongoing instability/transfusion needs."
0_12h_rbc_count_measured,1,Measurement frequency mainly reflects routine post-op monitoring and clinician behavior rather than renal physiology. In the immediate 0–12h period it is especially standard-of-care and weakly specific for AKI risk.
13_24h_rbc_count_measured,1,Ordering frequency is a nonspecific acuity proxy and does not directly indicate kidney injury. In 13–24h it remains largely driven by routine post-cardiac surgery labs and anemia/bleeding surveillance.
25_36h_rbc_count_measured,2,"More frequent RBC checks at 25–36h may indicate ongoing bleeding, transfusion, or hemodynamic concern, which can secondarily increase AKI risk. Still, it is a behavioral proxy and not a physiologic renal marker."
0_12h_d_dimer_measured,1,"D-dimer ordering early post-op is often protocolized or driven by nonspecific concern for thrombosis/bleeding and is not kidney-specific. As a measured/ordered indicator, it has weak specificity for predicting creatinine rise."
13_24h_d_dimer_measured,1,This reflects clinician suspicion for thrombotic/bleeding complications rather than a direct mechanism of AKI. In 13–24h it remains a nonspecific behavioral marker.
25_36h_d_dimer_measured,2,"Late ordering (25–36h) may signal evolving complications (e.g., thrombosis, DIC, severe inflammation) that can contribute to renal hypoperfusion or microthrombi. However, it is still an ordering proxy and not a direct renal biomarker."
0_12h_teg_activated_clotting_time_measured,1,"TEG ACT measurement early after cardiac surgery is commonly used to guide heparin reversal and bleeding management and is not kidney-specific. As a measured feature, it mainly reflects routine coagulation management."
13_24h_teg_activated_clotting_time_measured,1,Ordering TEG ACT in this window is a nonspecific marker of bleeding/coagulopathy evaluation rather than renal injury. Measurement frequency provides limited incremental AKI prediction.
25_36h_teg_activated_clotting_time_measured,2,"Needing TEG ACT at 25–36h may indicate persistent coagulopathy/bleeding requiring transfusion or re-intervention, which can increase AKI risk via shock and inflammation. Still, it is an ordering proxy and not a direct physiologic renal measure."
0_12h_percent_immature_granulocyte_mean,1,Immature granulocytes reflect systemic inflammation/stress but are nonspecific and commonly elevated immediately post-CPB. The mean in 0–12h is especially confounded by transient post-op inflammatory response.
13_24h_percent_immature_granulocyte_mean,2,"Persistently elevated immature granulocytes can indicate ongoing inflammation/infection, which can contribute to AKI risk via sepsis physiology. Using the mean reduces sensitivity to acute spikes and is less specific than an extreme value."
0_12h_percent_immature_granulocyte_max,2,"A high early peak may reflect an exaggerated inflammatory response, which can be associated with AKI after CPB, but early post-op peaks are common and nonspecific. Max is preferred over mean/min for capturing inflammatory insult, but scoring is conservative in 0–12h."
13_24h_percent_immature_granulocyte_max,3,"A high peak in 13–24h is more concerning for evolving infection or sustained systemic inflammation, both established contributors to AKI risk. The max better captures clinically meaningful inflammatory surges than the mean."
0_12h_percent_immature_granulocyte_min,1,The minimum immature granulocyte percentage is not a plausible trigger or marker for AKI and is largely uninformative. Early post-op values are also heavily influenced by routine perioperative stress.
13_24h_percent_immature_granulocyte_min,1,A low minimum value does not indicate pathology relevant to AKI prediction and adds little beyond other inflammatory summaries. It is less clinically meaningful than the max for detecting inflammatory deterioration.
0_12h_percent_immature_granulocyte_measured,1,Measurement frequency of immature granulocytes mainly reflects clinician concern for infection/inflammation rather than renal physiology. In the immediate 0–12h post-op window it is especially nonspecific for predicting later creatinine rise.
13_24h_percent_immature_granulocyte_measured,1,Ordering frequency is a weak behavioral proxy for acuity and not a direct AKI mechanism. At 13–24h it remains nonspecific for subsequent creatinine ratio at 60h.
25_36h_percent_immature_granulocyte_measured,2,"More frequent CBC differentials late (25–36h) may indicate evolving sepsis/SIRS, which can precipitate AKI, but it is still an indirect and noisy proxy. Scored low per the _measured rule."
0_12h_teg_fibrinolysis_measured,1,"TEG fibrinolysis testing reflects bleeding/coagulopathy management and transfusion decisions, not a direct renal perfusion or tubular injury marker. In 0–12h it is common perioperatively and weakly informative for AKI."
13_24h_teg_fibrinolysis_measured,1,Ongoing TEG fibrinolysis assessment indicates coagulation/bleeding concerns rather than kidney injury. Any AKI link would be indirect via shock/transfusion and is not specific.
25_36h_teg_fibrinolysis_measured,2,"Late need for TEG may signal persistent bleeding, transfusion, or hemodynamic instability that can contribute to renal hypoperfusion, but it remains indirect. Thus only low importance."
0_12h_creatinine_ratio_mean,3,"Early postoperative creatinine changes can reflect hemodilution and transient peri-CPB effects, so the mean in 0–12h is less specific for true AKI trajectory. Still, any early rise is an established risk signal."
13_24h_creatinine_ratio_mean,4,"By 13–24h, sustained elevation in creatinine ratio more often reflects evolving kidney injury rather than pure dilutional effects. The mean captures persistent dysfunction and is a strong predictor of later creatinine at 60h."
25_36h_creatinine_ratio_mean,5,Creatinine ratio in the 25–36h window is a near-term biomarker of renal dysfunction and strongly tracks progression to higher creatinine at 60h. A sustained elevated mean here is highly predictive.
0_12h_creatinine_ratio_max,3,"A peak creatinine ratio in 0–12h may represent an early insult but can be confounded by perioperative fluid shifts and lab timing. Extremes are more informative than means, but early timing warrants conservatism."
13_24h_creatinine_ratio_max,4,A higher peak creatinine ratio during 13–24h suggests worsening renal function and is more specific for AKI than the early post-op period. The extreme value captures acute deterioration relevant to later creatinine.
25_36h_creatinine_ratio_max,5,"The maximum creatinine ratio closest to the outcome is essentially an early manifestation of the same process driving the 60h creatinine ratio. As an extreme marker of renal dysfunction, it is highly predictive."
0_12h_creatinine_ratio_min,1,The minimum creatinine ratio early after surgery is often driven by hemodilution and does not represent renal injury. It is unlikely to add prognostic value beyond max/mean and is prone to collinearity.
13_24h_creatinine_ratio_min,1,A low minimum creatinine ratio is not a plausible trigger or marker of AKI and mainly reflects dilution or recovery. It is redundant given more pathologic aggregations (max/mean).
25_36h_creatinine_ratio_min,2,"Even late, the minimum creatinine ratio is less informative than the max/mean for detecting injury; it may reflect intermittent dilution or partial recovery. Kept low to reduce redundancy/collinearity with stronger creatinine aggregations."
0_12h_creatinine_ratio_measured,2,"More frequent creatinine checks can indicate clinician concern for renal dysfunction or instability, but it is a behavioral proxy rather than physiology. In 0–12h it is often routine post-cardiac surgery monitoring, limiting specificity."
13_24h_creatinine_ratio_measured,2,Measurement frequency reflects clinician concern and monitoring intensity rather than renal physiology. It may weakly proxy evolving AKI risk but is not a direct predictor.
25_36h_creatinine_ratio_measured,2,"Closer to the 60h outcome, more frequent creatinine checks can indicate suspected renal deterioration, but it remains a behavioral/acuity marker rather than a mechanistic driver."
0_12h_x25_percent_albumin_dose_total_12h,2,"Hyperoncotic albumin use early post-op often reflects hemodynamic instability or volume management, which can relate indirectly to renal perfusion. In the immediate 0–12h period this is common and nonspecific."
13_24h_x25_percent_albumin_dose_total_12h,2,"Ongoing need for 25% albumin may indicate persistent capillary leak/vasoplegia or aggressive diuresis with intravascular depletion, indirectly increasing AKI risk. Still a treatment proxy with confounding by indication."
25_36h_x25_percent_albumin_dose_total_12h,3,"Late requirement for 25% albumin suggests continued hemodynamic/volume derangements near the outcome window, which can impair renal perfusion. It is not a direct biomarker but can be an established indirect risk signal."
0_12h_albumin_5_percent_dose_total_12h,2,"5% albumin is used for volume expansion and may reflect hypotension/low effective circulating volume, indirectly affecting kidney perfusion. In 0–12h it is routine and highly confounded."
13_24h_albumin_5_percent_dose_total_12h,2,"Continued colloid resuscitation can indicate ongoing vasoplegia/third spacing and risk for renal hypoperfusion, but it remains nonspecific and treatment-driven."
25_36h_albumin_5_percent_dose_total_12h,3,"Need for volume expansion in the 25–36h window suggests persistent instability or intravascular depletion close to the creatinine outcome, which is a meaningful AKI risk context. Still indirect and confounded by indication."
0_12h_acetaminophen_codeine_dose_total_12h,1,Analgesic dosing has no meaningful direct link to postoperative AKI; codeine/acetaminophen are not typical nephrotoxins at standard doses. Early post-op use mainly reflects pain control.
13_24h_acetaminophen_codeine_dose_total_12h,1,Ongoing acetaminophen-codeine use is not a recognized driver or marker of AKI in this setting. It primarily reflects analgesia needs and sedation strategy.
25_36h_acetaminophen_codeine_dose_total_12h,1,Late analgesic dosing remains clinically unrelated to renal tubular injury or perfusion failure. Any association would be weak and confounded.
0_12h_acetaminophen_dose_total_12h,1,Acetaminophen is not nephrotoxic in typical ICU dosing and does not directly predict AKI after cardiac surgery. Early administration is routine.
13_24h_acetaminophen_dose_total_12h,1,Acetaminophen dose is not an established AKI risk factor and mainly reflects fever/pain management. It provides minimal prognostic information for creatinine rise.
25_36h_acetaminophen_dose_total_12h,1,Acetaminophen dosing near 25–36h is still not mechanistically linked to AKI and is unlikely to add predictive value beyond illness severity.
0_12h_allopurinol_dose_total_12h,2,"Allopurinol use indicates gout/hyperuricemia and chronic comorbidity; dosing may be reduced in renal dysfunction but early post-op continuation is inconsistent. It is an indirect marker at best, not a driver of AKI."
13_24h_allopurinol_dose_total_12h,2,"Continuation/withholding of allopurinol can weakly reflect renal function awareness and comorbidity burden, but it is not a direct predictor of postoperative AKI. Association is likely confounded and modest."
25_36h_allopurinol_dose_total_12h,1,Allopurinol use is usually chronic gout management and is not a typical perioperative driver of AKI in this setting. Dose in this window more likely reflects home-med continuation than renal perfusion injury.
0_12h_aminocaproic_acid_dose_total_12h,1,Aminocaproic acid is an antifibrinolytic used around cardiac surgery and is not a direct nephrotoxin. In the immediate 0–12h period it mainly reflects routine intra/post-op practice rather than AKI physiology.
13_24h_aminocaproic_acid_dose_total_12h,1,Continued antifibrinolytic exposure has no strong mechanistic link to renal tubular injury or hypoperfusion. In this mid-phase it is still more practice-pattern than a renal risk signal.
25_36h_aminocaproic_acid_dose_total_12h,1,"Late use remains uncommon and, when present, is more indicative of bleeding management than kidney injury mechanisms. Not an established predictor of creatinine rise by 60h."
0_12h_amiodarone_dose_total_12h,2,"Amiodarone itself is not a classic nephrotoxin, but its use can proxy postoperative atrial/ventricular arrhythmias and hemodynamic instability that may reduce renal perfusion. In 0–12h, arrhythmias and treatment are common/transient, so prognostic value is limited."
13_24h_amiodarone_dose_total_12h,2,"Ongoing amiodarone suggests persistent arrhythmia burden or instability, which can contribute indirectly to renal hypoperfusion and AKI risk. Still an indirect marker rather than a direct renal insult."
25_36h_amiodarone_dose_total_12h,3,"Need for amiodarone this late more strongly indicates sustained arrhythmia/low-output physiology, which is an established contributor to postoperative AKI. As a leading-indicator window, it can meaningfully track risk via hemodynamic compromise."
0_12h_amlodipine_dose_total_12h,1,Amlodipine is a chronic antihypertensive and is rarely a direct driver of AKI; early postoperative administration is uncommon and not mechanistically linked to tubular injury. In 0–12h it likely reflects medication reconciliation rather than renal risk.
13_24h_amlodipine_dose_total_12h,1,Continuation of a calcium-channel blocker has minimal direct relationship to postoperative creatinine rise. It is more reflective of baseline hypertension management than evolving AKI.
25_36h_amlodipine_dose_total_12h,1,Late administration still primarily indicates chronic BP control and does not capture a known AKI trigger. Any association would be weak and confounded by overall stability permitting oral meds.
0_12h_ampicillin_dose_total_12h,1,"Ampicillin is not typically nephrotoxic compared with other antibiotics (e.g., aminoglycosides, vancomycin) and early use often reflects prophylaxis/empiric coverage. In 0–12h it is unlikely to add specific AKI prediction beyond illness severity."
13_24h_ampicillin_dose_total_12h,2,"Antibiotic continuation can be a proxy for suspected infection/sepsis, which can precipitate AKI via inflammation and hypotension. The drug itself is a weak renal risk, so the link is indirect."
25_36h_ampicillin_dose_total_12h,2,"Use in the 25–36h window may indicate evolving infection or ongoing critical illness, both associated with AKI risk. Still largely a severity-of-illness proxy rather than a direct nephrotoxic exposure."
0_12h_angiotensin_ii_dose_total_12h,3,"Angiotensin II use indicates vasodilatory shock requiring high-level vasopressor support, a known AKI risk context due to hypoperfusion and systemic inflammation. In 0–12h, immediate post-CPB vasoplegia is common, so be cautious interpreting it as persistent risk."
13_24h_angiotensin_ii_dose_total_12h,4,"Requirement for angiotensin II at 13–24h suggests ongoing refractory vasoplegia/shock, strongly associated with subsequent AKI through sustained renal hypoperfusion and catecholamine exposure. This is a strong severity/hemodynamic predictor even if not a biomarker."
25_36h_angiotensin_ii_dose_total_12h,5,"Angiotensin II requirement in the 25–36h leading window implies persistent severe shock/vasoplegia close to the outcome time, a near-direct driver of ischemic ATN and creatinine rise. This is one of the strongest hemodynamic predictors of postoperative AKI risk."
