value,importance,reason
0_12h_absolute_neutrophil_count_min,1,"Low neutrophil counts are not a typical mechanistic driver or early marker of postoperative AKI, and early values can be affected by dilution/transfusion and lab variability."
13_24h_absolute_neutrophil_count_min,1,Neutropenia is not an established predictor of AKI in this setting and is more relevant to infection risk than renal perfusion or tubular injury.
0_12h_absolute_neutrophil_count_measured,1,Measurement frequency mainly reflects routine postoperative lab ordering rather than renal pathophysiology; in the immediate 0–12h period it is weakly informative.
13_24h_absolute_neutrophil_count_measured,1,Ordering frequency is a behavioral proxy for acuity but ANC checks are common post-cardiac surgery and not specifically tied to impending AKI.
25_36h_absolute_neutrophil_count_measured,2,"More frequent ANC checks late may reflect concern for infection/sepsis, which can precipitate AKI, but it is still an indirect behavioral signal rather than a biomarker."
0_12h_troponin_measured,1,Troponin ordering early is often protocolized after cardiac surgery and does not directly measure renal injury; it is at best an indirect marker of myocardial injury/hemodynamic risk.
13_24h_troponin_measured,2,"Continued troponin testing may indicate suspected perioperative MI/low cardiac output, which can reduce renal perfusion and increase AKI risk, but measurement frequency remains indirect."
25_36h_troponin_measured,2,"Late repeated troponins can signal ongoing myocardial injury or instability associated with renal hypoperfusion, yet it is still a behavioral proxy and not kidney-specific."
0_12h_po2_mean,2,"Sustained hypoxemia can worsen renal medullary oxygenation, but early postoperative PaO2 is heavily influenced by ventilation/FiO2 changes and is often transient in 0–12h."
13_24h_po2_mean,2,"Ongoing lower mean PaO2 may reflect respiratory failure and systemic illness that increases AKI risk, though it is not a primary direct driver compared with perfusion/pressure variables."
25_36h_po2_mean,3,"Persistently reduced oxygenation closer to the outcome can indicate significant cardiopulmonary dysfunction and higher illness severity, which is an established contributor to AKI risk."
0_12h_po2_max,1,"PaO2 maxima largely reflect transient high FiO2/ventilator settings rather than pathology; extremes on the high side are not a typical trigger for AKI, so score is capped to avoid redundancy with mean."
13_24h_po2_max,1,High PaO2 peaks are usually iatrogenic and not mechanistically linked to AKI; max adds little beyond mean for renal risk prediction.
25_36h_po2_max,1,"Even late, PaO2 maximum is mainly determined by oxygen therapy and does not capture the hypoxemic insult relevant to AKI; mean (or minima, if available) would be more informative."
0_12h_po2_min,2,"Severe hypoxemia can worsen renal medullary hypoxia and contribute to AKI, but early post-op oxygenation is often transiently unstable and less specific for later creatinine rise."
13_24h_po2_min,2,"Persistent/recurrent hypoxemia may reflect ongoing cardiopulmonary dysfunction that can impair renal oxygen delivery, but it remains an indirect and nonspecific AKI predictor."
25_36h_po2_min,3,"Late-window hypoxemia closer to hour 60 suggests ongoing respiratory/cardiac failure and reduced systemic oxygen delivery, which more strongly associates with subsequent AKI."
0_12h_po2_measured,1,Measurement frequency mainly reflects monitoring intensity/acuity rather than a renal mechanism; early post-op ABG frequency is routine after cardiac surgery.
13_24h_po2_measured,1,More frequent PO2 checks indicate clinician concern but are not a direct physiologic driver of AKI and are common in unstable ICU patients.
25_36h_po2_measured,2,"In the late window, frequent PO2 measurement may signal ongoing instability (ventilation/oxygenation problems) that correlates with AKI risk, but it is still a behavioral proxy."
0_12h_potassium_mean,2,"Potassium abnormalities can accompany renal dysfunction and shock, but the mean in the immediate post-op period is diluted by transient shifts (CPB, transfusion, insulin) and is less specific than extremes."
13_24h_potassium_mean,2,"Sustained potassium elevation can reflect evolving renal impairment, but the mean is less sensitive than the maximum for detecting clinically meaningful hyperkalemia related to AKI."
25_36h_potassium_mean,3,"A higher late-window average potassium suggests persistent impaired renal excretion and/or ongoing tissue injury, making it a more relevant (though still indirect) predictor of creatinine rise."
0_12h_potassium_max,3,"Hyperkalemia can be an early signal of reduced renal clearance or severe illness, but in the first 12 hours it is often driven by perioperative factors (CPB, hemolysis, transfusion) and is less specific."
13_24h_potassium_max,3,"Peak potassium in this trajectory phase better captures clinically significant hyperkalemia that may reflect evolving AKI or ongoing hypoperfusion, though it is not a definitive biomarker."
25_36h_potassium_max,4,"Late-window hyperkalemia is a strong indicator of impaired renal excretion and correlates with impending/worsening AKI, making the maximum more informative than the mean for pathology."
0_12h_potassium_min,1,Hypokalemia is not a typical driver of AKI and early post-op lows are commonly iatrogenic (diuretics/insulin shifts) rather than reflecting renal injury.
13_24h_potassium_min,1,Low potassium more often reflects treatment effects or redistribution and has weak linkage to subsequent creatinine rise compared with hyperkalemia.
25_36h_potassium_min,1,"Even in the late window, hypokalemia is generally not a direct marker or cause of AKI; it is less clinically relevant than potassium maxima for renal risk."
0_12h_potassium_measured,1,Potassium check frequency is largely a monitoring/acuity proxy and is routine early after cardiac surgery; it does not directly indicate renal injury.
13_24h_potassium_measured,2,Measurement frequency reflects clinician concern for electrolyte/renal issues but is not a physiologic driver of AKI. In the trajectory phase it may weakly proxy evolving renal dysfunction or arrhythmia risk prompting labs.
25_36h_potassium_measured,2,"More frequent potassium checks closer to hour 60 can indicate concern for renal impairment, acidosis, or ongoing diuretic/renal replacement management. Still a behavioral proxy, so capped at 2."
0_12h_total_bilirubin_mean,1,Early postoperative bilirubin changes are often transient from CPB/hemolysis and do not directly predict creatinine rise. Mean value is less informative than extremes and is distant from the outcome window.
0_12h_total_bilirubin_max,2,"A high early bilirubin can reflect hemolysis, hepatic congestion, or low-flow states that may co-occur with renal hypoperfusion, but in 0–12h it is nonspecific and often transient. Max is the most relevant aggregation for acute insult, so modest score."
0_12h_total_bilirubin_min,1,Low bilirubin has no meaningful mechanistic link to AKI risk. The minimum is not a useful marker of postoperative organ dysfunction.
0_12h_total_bilirubin_measured,1,"Ordering frequency for bilirubin mainly reflects routine postoperative labs or concern for hepatic dysfunction rather than imminent AKI. As a behavioral proxy in the immediate period, it has weak predictive value."
13_24h_total_bilirubin_measured,1,"Repeat bilirubin checks may indicate ongoing concern for hepatic injury/hemolysis, which can correlate with overall illness severity but is not specific for AKI. Measurement count is a weak behavioral proxy."
25_36h_total_bilirubin_measured,2,"More frequent bilirubin monitoring late may signal persistent shock/congestion or multi-organ dysfunction, which can accompany AKI risk. Still a non-physiologic ordering proxy, so limited to 2."
0_12h_rbc_count_mean,2,"Lower RBC count/anemia can worsen renal oxygen delivery, but early postoperative hemodilution and transfusions make the mean nonspecific. Mean is less informative than the nadir for ischemic risk."
13_24h_rbc_count_mean,2,Persistent anemia in the trajectory phase may reflect bleeding/hemodilution and can contribute indirectly to renal hypoxia. Mean remains a smoothed measure and is not a direct AKI marker.
25_36h_rbc_count_mean,3,"Sustained anemia closer to hour 60 can meaningfully reduce renal oxygen delivery and often tracks ongoing bleeding, inflammation, or hemodynamic instability. Still indirect compared with creatinine/urine output, so moderate importance."
0_12h_rbc_count_max,1,Higher RBC count is not a typical driver of postoperative AKI and may simply reflect hemoconcentration or transfusion. The maximum is not a reliable marker of renal hypoperfusion.
13_24h_rbc_count_max,1,RBC maxima mainly reflect transfusion/hemoconcentration and are not established predictors of AKI. Limited physiologic linkage to creatinine rise.
25_36h_rbc_count_max,1,A high RBC count late is generally not causally linked to AKI and is often treatment-related. It provides little incremental signal versus anemia/nadir measures.
0_12h_rbc_count_min,3,"The nadir RBC count captures acute anemia from bleeding/hemodilution, which can impair renal oxygen delivery and correlate with shock/transfusion burden. In 0–12h it is common and transient, so not scored higher."
13_24h_rbc_count_min,3,"A low RBC nadir during 13–24h suggests persistent anemia/bleeding and can contribute to renal hypoxia and overall severity of illness. Min is the most pathophysiologically relevant aggregation for this feature, so moderate importance."
25_36h_rbc_count_min,3,"Low RBC count late (25–36h) can reflect ongoing bleeding/hemodilution and reduced oxygen delivery, which can worsen renal medullary hypoxia and AKI risk. Min captures the worst anemia better than mean/max for renal ischemic stress."
0_12h_rbc_count_measured,1,"Measurement frequency is mainly a proxy for routine post-op monitoring and early instability rather than a direct AKI mechanism. In the immediate 0–12h window, labs are commonly ordered for most patients."
13_24h_rbc_count_measured,1,"RBC count ordering frequency reflects clinician monitoring intensity more than renal pathophysiology. By 13–24h it may indicate complexity, but it is still a weak and nonspecific AKI signal."
25_36h_rbc_count_measured,2,"More frequent CBC checks at 25–36h can indicate ongoing bleeding/transfusion needs or clinical deterioration, which can correlate with AKI risk. Still, it is an indirect behavioral proxy rather than a physiologic driver."
0_12h_d_dimer_measured,1,"Whether D-dimer was checked early is largely practice-pattern driven (bleeding/thrombosis evaluation) and not specific for AKI. In 0–12h post-cardiac surgery, coagulation testing is common and nonspecific."
13_24h_d_dimer_measured,1,"D-dimer ordering indicates concern for thrombosis/consumption but is not a direct predictor of creatinine rise. As a measured/ordered flag, it remains a weak proxy signal."
25_36h_d_dimer_measured,2,"Late D-dimer testing may reflect suspected thromboembolism, DIC, or ongoing inflammatory/coagulopathic complications that can accompany shock and AKI. However, it is still an indirect marker based on clinician suspicion."
0_12h_teg_activated_clotting_time_measured,1,"TEG ACT being obtained early mainly reflects routine post-bypass coagulation management and bleeding evaluation, not kidney injury. As a measurement flag in 0–12h, it is highly nonspecific for AKI."
13_24h_teg_activated_clotting_time_measured,1,"Ordering TEG ACT in 13–24h suggests ongoing bleeding/coagulopathy assessment but does not directly capture renal perfusion or tubular injury. As a measured feature, it is a weak AKI predictor."
25_36h_teg_activated_clotting_time_measured,2,"Late TEG ACT measurement can indicate persistent bleeding/coagulopathy or need for re-intervention/transfusion, which can be associated with hypotension and AKI. Still, it is an indirect behavioral proxy."
0_12h_percent_immature_granulocyte_mean,1,"Early postoperative inflammatory response commonly elevates immature granulocytes and is often transient after surgery/CPB, making it nonspecific for AKI in 0–12h. Mean further dilutes brief spikes that might reflect true infection/sepsis."
13_24h_percent_immature_granulocyte_mean,2,"Persistently elevated immature granulocytes can suggest evolving infection/systemic inflammation, which can contribute to AKI via cytokine-mediated injury and hemodynamic instability. Using mean is less informative than extremes for acute deterioration."
0_12h_percent_immature_granulocyte_max,2,"A high early peak may indicate marked inflammatory activation or early infection, which can increase AKI risk, but 0–12h post-CPB peaks are often nonspecific. Max is preferred over mean/min for capturing concerning spikes."
13_24h_percent_immature_granulocyte_max,3,A high peak in 13–24h is more concerning for evolving sepsis/inflammation beyond expected immediate post-op changes and can precede AKI. Max captures acute inflammatory surges better than mean/min and is less redundant.
0_12h_percent_immature_granulocyte_min,1,The minimum immature granulocyte percentage is not a plausible trigger or marker of AKI and is largely uninformative clinically. In 0–12h it adds redundancy without capturing pathology.
13_24h_percent_immature_granulocyte_min,1,A low minimum value does not indicate renal risk and is not mechanistically linked to AKI. It is also redundant given that clinically relevant information would be in elevated peaks rather than minima.
0_12h_percent_immature_granulocyte_measured,1,"Measurement frequency of immature granulocytes mainly reflects clinician concern for infection/inflammation rather than renal perfusion or tubular injury, and early post-op ordering is common. As a _measured proxy in 0–12h, it has weak specificity for later creatinine rise."
13_24h_percent_immature_granulocyte_measured,1,Still a behavioral proxy for suspected infection/SIRS rather than a direct AKI mechanism. In 13–24h it remains nonspecific for predicting creatinine_ratio at 60h.
25_36h_percent_immature_granulocyte_measured,2,"Late increased ordering may indicate evolving sepsis/SIRS, which can precipitate AKI via hypotension and inflammation, but it is indirect and nonspecific. As a _measured feature it is capped low by rule."
0_12h_teg_fibrinolysis_measured,1,"TEG fibrinolysis testing reflects bleeding/coagulopathy management and transfusion strategy, not a direct renal injury marker. In the immediate 0–12h post-bypass period it is common and weakly linked to later AKI."
13_24h_teg_fibrinolysis_measured,1,Ongoing TEG use indicates hemostasis concerns but has no established direct relationship to creatinine rise independent of overall severity. Thus it provides minimal incremental AKI prediction.
25_36h_teg_fibrinolysis_measured,2,"Late TEG use may signal persistent bleeding/transfusion needs and systemic instability that can contribute to AKI risk, but the link is indirect. As a measured/procedural indicator rather than physiology, importance remains low."
0_12h_creatinine_ratio_mean,3,"Early postoperative creatinine changes can reflect hemodilution and transient perioperative effects, so the mean in 0–12h is only moderately informative. It is an early renal function signal but less predictive than later epochs and extremes."
13_24h_creatinine_ratio_mean,4,"By 13–24h, sustained elevation in creatinine ratio suggests evolving AKI rather than pure dilutional effects. The mean captures trajectory but is still less specific than the max in the same epoch."
25_36h_creatinine_ratio_mean,4,"In 25–36h, creatinine ratio is close to the 60h outcome and reflects ongoing renal dysfunction. Mean elevation indicates persistent injury, though max may better capture acute worsening (collinearity consideration)."
0_12h_creatinine_ratio_max,3,"An early peak creatinine ratio may indicate immediate renal insult, but in 0–12h it can be confounded by perioperative fluid shifts and lab timing. It is a plausible early signal but not definitive this early."
13_24h_creatinine_ratio_max,4,"A higher peak creatinine ratio in 13–24h is a strong indicator of developing AKI and predicts continued rise by 60h. Extremes better capture pathologic worsening than the mean, reducing redundancy."
25_36h_creatinine_ratio_max,5,"Peak creatinine ratio in 25–36h is essentially an early biomarker of the same renal dysfunction being predicted at 60h and strongly forecasts persistence/progression. As the closest window and an extreme, it is the most direct predictor."
0_12h_creatinine_ratio_min,1,A low minimum creatinine ratio early after surgery often reflects hemodilution rather than renal protection and is not a trigger for AKI. It is unlikely to add predictive value beyond max/mean measures.
13_24h_creatinine_ratio_min,1,Minimum creatinine ratio is not a recognized risk marker for AKI and mainly reflects dilution or recovery periods. It is redundant and less pathophysiologically relevant than max/mean.
25_36h_creatinine_ratio_min,2,"A persistently elevated minimum (i.e., failure to return toward baseline) can suggest sustained renal dysfunction, but min is still less informative than max/mean for AKI prediction. Scored low to avoid collinearity with stronger creatinine aggregations."
0_12h_creatinine_ratio_measured,2,"More frequent creatinine checks early may reflect clinician concern for renal injury or hemodynamic instability, but it is a behavioral proxy rather than physiology. As a _measured feature in 0–12h, it is capped at low importance."
13_24h_creatinine_ratio_measured,2,Measurement frequency reflects clinician concern and monitoring intensity rather than renal physiology. In the trajectory phase it may weakly proxy evolving AKI risk but is not a direct predictor.
25_36h_creatinine_ratio_measured,2,"More frequent creatinine checks closer to hour 60 can indicate suspected renal dysfunction, but it remains a behavioral/acuity marker rather than a mechanistic driver. Score capped per _measured rule."
0_12h_x25_percent_albumin_dose_total_12h,2,"Hyperoncotic 25% albumin is often used for hypotension/third spacing and may reflect hemodynamic instability, but early post-bypass use is common and nonspecific. Indirect link to AKI via perfusion/volume status."
13_24h_x25_percent_albumin_dose_total_12h,2,"Use in this window suggests ongoing volume management or vasoplegia, which can correlate with renal hypoperfusion. Still an indirect and treatment-confounded marker rather than a primary AKI predictor."
25_36h_x25_percent_albumin_dose_total_12h,3,"Late need for 25% albumin may indicate persistent capillary leak, hypotension, or aggressive diuresis/low effective circulating volume, all associated with AKI risk. Closer temporal proximity increases relevance, though it remains a proxy for instability."
0_12h_albumin_5_percent_dose_total_12h,1,5% albumin is routine postoperative volume resuscitation and is highly confounded by standard care in the immediate period. Weak specific linkage to subsequent creatinine rise.
13_24h_albumin_5_percent_dose_total_12h,2,"Continued colloid resuscitation may reflect ongoing hemodynamic instability or third spacing, which can contribute to renal hypoperfusion. Still indirect and treatment-driven."
25_36h_albumin_5_percent_dose_total_12h,2,"Later albumin use can indicate persistent intravascular depletion or hypotension, which may precede AKI. However it is not a direct biomarker and is confounded by clinician practice."
0_12h_acetaminophen_codeine_dose_total_12h,1,Analgesic choice/dose has minimal direct relationship to renal perfusion or tubular injury in typical ICU dosing. Early postoperative administration is routine and nonspecific.
13_24h_acetaminophen_codeine_dose_total_12h,1,"Codeine/acetaminophen primarily reflects pain control strategy and sedation needs, not AKI pathophysiology. Any association would be indirect and weak."
25_36h_acetaminophen_codeine_dose_total_12h,1,Not a known driver of postoperative AKI at usual doses; more reflective of analgesia plan than renal injury. Weak prognostic value for creatinine_ratio.
0_12h_acetaminophen_dose_total_12h,1,Acetaminophen is not nephrotoxic at standard doses and does not meaningfully affect renal hemodynamics. Early use is routine after surgery.
13_24h_acetaminophen_dose_total_12h,1,Primarily indicates analgesia/antipyresis needs rather than kidney injury risk. No established predictive relationship with AKI in this context.
25_36h_acetaminophen_dose_total_12h,1,"Continued acetaminophen use is common and not mechanistically linked to AKI. Any correlation would be incidental (e.g., illness severity) and weak."
0_12h_allopurinol_dose_total_12h,2,"Allopurinol use suggests pre-existing gout/hyperuricemia and possibly CKD, which are AKI risk factors, but the medication itself is not a typical acute driver post-cardiac surgery. Early dosing is unlikely to add prognostic signal beyond comorbidity."
13_24h_allopurinol_dose_total_12h,2,Continued allopurinol reflects baseline comorbidity burden (possible CKD/metabolic disease) rather than acute renal insult. Indirect association with AKI risk but not a strong predictor.
25_36h_allopurinol_dose_total_12h,1,Allopurinol use/dose is not a typical driver of postoperative AKI and is usually a chronic medication signal rather than an acute renal perfusion/toxin marker in this setting.
0_12h_aminocaproic_acid_dose_total_12h,1,Aminocaproic acid is used for bleeding prophylaxis/therapy and has no strong direct link to AKI; in the immediate 0–12h window it mainly reflects routine perioperative practice.
13_24h_aminocaproic_acid_dose_total_12h,1,"Continued aminocaproic acid use is more a marker of bleeding management than renal injury risk, with weak physiologic connection to creatinine rise."
25_36h_aminocaproic_acid_dose_total_12h,2,"Late use may proxy ongoing bleeding/transfusion needs and illness severity, which can indirectly contribute to renal hypoperfusion, but it is not a primary AKI predictor."
0_12h_amiodarone_dose_total_12h,2,"Amiodarone itself is not strongly nephrotoxic, but early use can indicate postoperative arrhythmias/hemodynamic instability that may indirectly affect renal perfusion; 0–12h is less specific."
13_24h_amiodarone_dose_total_12h,2,"Ongoing amiodarone suggests persistent atrial/ventricular arrhythmia burden and potential low cardiac output episodes, an indirect AKI risk factor."
25_36h_amiodarone_dose_total_12h,3,"In the 25–36h leading window, continued amiodarone more strongly signals persistent arrhythmia/low-output physiology requiring treatment, which is an established contributor to renal hypoperfusion and AKI."
0_12h_amlodipine_dose_total_12h,1,Amlodipine is a chronic antihypertensive and is rarely a meaningful acute determinant of postoperative AKI; early administration is uncommon and not mechanistically linked to creatinine rise.
13_24h_amlodipine_dose_total_12h,1,Amlodipine use mainly reflects resumption of home BP meds and does not directly predict renal injury in the ICU context.
25_36h_amlodipine_dose_total_12h,1,Late amlodipine dosing is generally a marker of clinical stability and medication reconciliation rather than a driver of AKI risk.
0_12h_ampicillin_dose_total_12h,1,Ampicillin is not a common nephrotoxin and early postoperative antibiotics are often protocolized; weak direct relationship to AKI.
13_24h_ampicillin_dose_total_12h,2,"Continued antibiotics can be a proxy for suspected infection/sepsis, which can contribute to AKI, but ampicillin itself is not a strong renal toxin."
25_36h_ampicillin_dose_total_12h,2,"In the 25–36h window, antibiotic continuation may indicate evolving infection/inflammation (an indirect AKI risk), though the drug is not a primary nephrotoxic exposure."
0_12h_angiotensin_ii_dose_total_12h,3,"Angiotensin II use indicates vasodilatory shock and severe hemodynamic instability, which is an established AKI risk factor, but 0–12h post-CPB can include transient vasoplegia."
13_24h_angiotensin_ii_dose_total_12h,4,"Need for angiotensin II at 13–24h suggests persistent shock/vasoplegia with ongoing renal hypoperfusion risk, strongly associated with subsequent creatinine rise."
25_36h_angiotensin_ii_dose_total_12h,5,"Angiotensin II requirement in the 25–36h leading window is a strong marker of refractory shock and high vasopressor burden, a direct pathway to ischemic AKI and rising creatinine by hour 60."
0_12h_apixaban_dose_total_12h,1,"Apixaban is not nephrotoxic and does not directly affect renal perfusion; early post-op use is uncommon and more reflective of anticoagulation strategy than AKI biology. In the 0–12h window, it is unlikely to add specific prognostic signal for creatinine rise."
13_24h_apixaban_dose_total_12h,1,"Apixaban dosing mainly reflects atrial fibrillation/VTE prophylaxis decisions rather than kidney injury mechanisms. Any association with AKI would be indirect (bleeding/hemodynamics), typically weak."
25_36h_apixaban_dose_total_12h,2,"Later apixaban use may indirectly signal clinical stability (able to take/receive anticoagulation) or renal dosing considerations, but it is not a direct AKI driver. Potential signal is mostly confounding by indication and renal function–based prescribing."
0_12h_aspirin_dose_total_12h,1,"Aspirin at typical post-cardiac surgery doses is not a primary cause of AKI and has minimal direct impact on renal perfusion compared with hemodynamic factors. In the immediate 0–12h post-op period, it is largely routine care."
13_24h_aspirin_dose_total_12h,1,Continued aspirin use is standard post-op antiplatelet therapy and is not a strong predictor of subsequent creatinine rise. Any renal effect is generally negligible at antiplatelet dosing.
